"rownum","Id","Text (English)","Text (French)","Text (German)","Text (Japanese)","Text (Korean)","Text (Portuguese)","Text (Russian)","Text (Spanish)","Text (Thai)","Text (Traditional Chinese)","TextHardmode (English)","TextHardmode (French)","TextHardmode (German)","TextHardmode (Japanese)","TextHardmode (Korean)","TextHardmode (Portuguese)","TextHardmode (Russian)","TextHardmode (Spanish)","TextHardmode (Thai)","TextHardmode (Traditional Chinese)"
173,"ReminderTextMultipleMines","(Throwing Mines takes 10% more time for each additional Mine thrown)","(Lancer une Mine prend 10% Davantage de Temps par Mine supplémentaire lancée)","(Das Werfen von Minen dauert für jede zusätzlich geworfene Mine 10% länger)","(マインの投擲速度は、新たなマインごとに10%多くの時間がかかる)","(추가로 투척되는 지뢰 하나당 지뢰 투척 시간이 10% 증폭됩니다)","(Arremessar Minas demora 10% mais tempo para cada Mina adicional arremessada)","(Бросок мины занимает на 10% больше времени с каждой дополнительно брошенной миной)","(Lanzar minas durará un 10% más de tiempo por cada mina adicional que lances)","(การโยนทุ่นระเบิดจะใช้เวลา เพิ่มขึ้น อีก 10% ต่อจำนวนทุ่นระเบิดที่โยน เพิ่มเติม)","( 每個額外投擲地雷，使投擲地雷花費 10% 更多時間 )","","","","","","","","","",""
174,"ReminderTextGraspingVines","(Up to 10 Vines can grasp you, inflicting 8% less Movement Speed per Vine. Broken by moving)","(Vous pouvez cumuler jusqu'à 10 Lianes agrippantes, chacune infligeant 8% de Perte de Vitesse de déplacement. Déplacez-vous pour rompre les Lianes)","(Bis zu 10 Ranken können nach Euch greifen, die jeweils 8% weniger Bewegungsgeschwindigkeit anwenden. Die Ranken lösen sich durch Bewegung)","(Grasping Vines: プレイヤーは最大10本の蔓を受け、蔓1本につき移動スピードが8%低下する。蔓は移動することにより破壊される)","(최대 덩굴 10개에 사로잡힐 수 있으며, 덩굴 1개당 이동 속도가 8% 감폭됩니다. 이동 시 덩굴이 파괴됩니다)","(Máximo de 10 Vinhas podem te aprisionar, inflingindo 8% menos Velocidade de Movimento por Vinha. Quebram ao se mover)","(Вас могут опутывать до 10 лоз одновременно. Ваша скорость передвижения становится на 8% меньше за каждую лозу. Разрушаются при движении)","(Pueden atraparte hasta 10 enredaderas y cada una de ellas inflige un 8% menos de velocidad de movimiento sobre ti. Se rompen cuando te mueves.)","(คุณสามารถโดนเถาวัลย์รัดได้สูงสุด 10 เส้น ซึ่งแต่ละเส้นจะลดความเร็วในการเคลื่อนที่ลง อีก 8% หลุดจากเถาวัลย์โดยการเคลื่อนที่)","( 至多 10 條藤蔓可以抓住你，每個藤蔓造成 8% 更少移動速度。移動時掙脫 )","","","","","","","","","",""
175,"ReminderTextUnencumbered","(You are Unencumbered while you have no Gloves, no Main Hand Item, and no Off Hand Item Equipped)","(Tant que vous n'avez ni Gants, ni Objets d'équipés dans vos mains, vous êtes considéré comme n'étant pas encombré)","(Ihr habt freie Hand, während Ihr keine Handschuhe und keinen Haupt- oder Nebenhand-Gegenstand ausgerüstet habt)","(Unencumbered: 手袋、メインハンドアイテム、オフハンドアイテムを装備していない状態を徒手空拳と呼ぶ)","(장갑, 주 무기 그리고 보조 장비를 장착하지 않는 동안 \""홀가분\"" 상태가 됩니다)","(Você não está sobrecarregado enquanto não possuir Luvas, Itens na Mão Principal ou Secundária equipados)","(Ваши руки считаются свободными, если вы не экипированы парой перчаток, основным оружием и предметом для второй руки)","(Tienes las manos libres cuando no llevas guantes, objetos en la mano principal ni objetos en la mano secundaria)","(คุณมีสถานะ ไร้ภาระ ขณะที่คุณไม่ได้ใส่ ถุงมือ, ไอเทมมือหลัก, ไอเทมมือรอง ไว้สักชิ้น)","( 當你沒有裝備手套、主手或副手道具時，你視為無所拘束 )","","","","","","","","","",""
176,"ReminderTextArcaneSurgeNoDuration","(Arcane Surge grants 10% increased Cast Speed and 30% increased Mana Regeneration rate)","(L'Éruption arcanique octroie 10% d'Augmentation de Vitesse d'incantation et 30% d'Augmentation de Taux de Régénération de Mana)","(Arkane Woge gewährt 10% erhöhte Zaubergeschwindigkeit und 30% erhöhte Manaregenerations-Rate)","(Arcane Surge: アーケインサージは、キャストスピード10%増加およびマナ自動回復レート30%増加を付与する)","(\""비전 쇄도\""가 시전 속도를 10% 증가시키고, 마나 재생 속도를 30% 증가시킵니다)","(Fúria Arcana concede Velocidade de Conjuração aumentada em 10% e Regeneração de Mana aumentada em 30%)","(Колдовской выброс дарует на 10% повышение скорости сотворения чар и 30% повышение скорости регенерации маны)","(Sobrecarga arcana otorga velocidad de lanzamiento de hechizos aumentada un 10% y velocidad de regeneración de maná aumentada un 30%)","(กระแสอาคม เพิ่มความเร็วในการร่าย 10% และอัตราการ ฟื้นฟูมานา 30%)","( 秘能波動增加 10% 施放速度和增加 30% 魔力回復率 )","","","","","","","","","",""
177,"ReminderTextMeleeStrikeRange","(Affects Melee Strikes, including the Default Attack. Does not apply to Areas of Effect)","(Affecte les Frappes de mêlée, y compris l'Attaque par défaut. Ne s'applique pas aux Zones d'effet)","(Beeinflusst Nahkampfschläge, einschließlich des Standardangriffs. Wirkt sich nicht auf Wirkungsbereiche aus)","(通常攻撃を含む近接ストライク攻撃に影響する。範囲攻撃の効果範囲には適用されない)","(기본 공격을 포함한 근접 타격에 영향을 줍니다. 범위 효과에는 적용되지 않습니다)","(Afeta Golpes Corpo a Corpo, incluindo o Ataque Padrão. Não se aplica à Área de Efeito).","(Влияет на удары ближнего боя, включая обычную атаку. Не влияет на области действия)","(Afecta a los golpes cuerpo a cuerpo, incluido el ataque por defecto. No se aplica a las áreas de efecto.)","(ส่งผลต่อการ ฟาดประชิด ซึ่งรวมถึงการ โจมตีธรรมดา ด้วย แต่ไม่มีผลต่อพื้นที่ส่งผล)","( 影響近戰打擊，包含預設攻擊。不會套用至範圍效果 )","","","","","","","","","",""
178,"ReminderTextLingeringBlades","(Lingering Blades remain on the ground for a duration and can be used by specific skills. If Animated, they count as Daggers)","(Les Lames rémanentes restent plantées dans le sol pendant une certaine durée et peuvent être utilisées par des Aptitudes spécifiques. Lorsqu'elles sont Animées, ces Lames sont considérées comme des dagues)","(Verbleibende Klingen bleiben für eine Dauer auf dem Boden zurück und können von bestimmten Fertigkeiten benutzt werden. Wenn sie beseelt werden, zählen sie als Dolche)","(Lingering Blades: 消えない刃は地面上に一定時間残り、特定のスキルにより使用される。アニメイトされた場合、短剣として扱われる。）","(지속되는 칼날은 일정 시간 동안 바닥에 남으며, 특정 스킬로 이 칼날을 사용할 수 있습니다. 기동 시 단검으로 취급됩니다)","(Lâminas Persistentes continuam no chão por uma duração e podem ser usadas por habilidades específicas. Se Animadas, elas contam como Adagas)","(Остаточные клинки остаются на земеле в течение некоторого времени и могут быть использованы умениями. При оживлении считаются кинжалами)","(Los Filos persistentes se quedan en el suelo por un tiempo y puedes usarlos con algunas habilidades específicas. Si los animas, cuentan como dagas)","(มีดที่ทิ้งไว้ จะยังคงอยู่บนพื้นในช่วงระยะเวลาหนึ่งซึ่งสามารถถูกใช้งานโดยสกิลอื่นได้ และหากมันถูกปลุกเสกขึ้นมามันจะถือว่าเป็นมีดชนิดหนึ่ง)","( 地面上剩餘的劍刃會殘存一段時間，並可被特定技能使用。若被幻化將視為匕首 )","","","","","","","","","",""
179,"ReminderTextChanceToAvoidDamageMax","(No chance to avoid damage can be higher than 75%)","(Les chances de ne pas subir de dégâts ne peuvent excéder 75%)","(Eine Chance, Schaden zu vermeiden, kann niemals höher sein als 75%)","(ダメージをかわす確率を75%より上げることはできない)","(피해를 회피할 확률은 75%를 넘을 수 없습니다)","(Nenhuma chance de vitar dano pode ser maior do que 75%)","(Ни один шанс избежать урона не может превышать 75%)","(Ninguna probabilidad de evitar daño puede ser mayor del 75%)","(โอกาสในการหลีกเลี่ยงความเสียหายใดๆ นั้นไม่สามารถสูงกว่า 75% ได้)","( 避免傷害機率不會超過 75% )","","","","","","","","","",""
180,"ReminderTextFlaskNoQueue","(The duration of this flask's effect will still expire while other flask effects are active, even if they are from the same flask)","(La durée de l'effet de ce Flacon continuera d'expirer même si d'autres effets de Flacon sont actifs, et ce même si tous ces effets proviennent du même Flacon)","(Die Dauer dieser Fläschchenwirkung läuft auch dann ab, während andere Fläschchenwirkungen aktiv sind, selbst wenn sie vom selben Fläschchen stammen)","(このフラスコの持続時間は他のフラスコの効果がアクティブになると失効する。例え同種のフラスコであったとしても同様に失効する)","(해당 플라스크의 지속시간이 다른 플라스크 효과가 지속되는 한 계속 만료됩니다. 동일한 종류의 플라스크라 해도 같은 효과가 적용됩니다)","(A duração deste efeito de frasco ainda expirará enquanto outros efeitos de frascos estiverem ativos, mesmo que sejam do mesmo frasco)","(Время действия эффекта этого флакона продолжит истекать, пока активны другие эффекты флакона, даже если это эффекты одного и того же флакона)","(La duración del efecto de este frasco expirará incluso mientras estén activos los efectos de otros frascos, incluso si son del mismo frasco)","(ระยะเวลาส่งผลของขวดยานี้จะยังคงนับต่อไปแม้ว่าผลของขวดยาอื่นจะทำงานอยู่ก็ตาม รวมถึงผลจากขวดยาเดียวกันด้วย)","( 此藥劑效果的持續時間即使在其他藥劑效果作用中仍會失效，即使它們來自同一藥劑 )","","","","","","","","","",""
181,"ReminderTextBrandDamage","(Brand Damage is any Damage dealt by Brand Skills or by Skills Triggered by a Brand)","(Les Dégâts des Symboles sont à la fois les Dégâts infligés par les Aptitudes de Symbole et les Dégâts infligés par les Aptitudes déclenchées par des Symboles)","(Zeichenschaden ist jeglicher Schaden, der durch Zeichen-Fertigkeiten oder Fertigkeiten verursacht wird, die durch ein Zeichen ausgelöst werden)","(ブランドダメージとは、ブランドスキルまたはブランドによってトリガーされたスキルによるダメージ)","(낙인 피해란 낙인 스킬이나 낙인으로 인해 발동하는 스킬이 주는 피해입니다.)","(Dano de Runas é qualquer Dano causado por Habilidades de Runas ou por Habilidades Ativadas por uma Runa)","(Урон клеймами - любой урон, наносимый умениями клейм или умениями, срабатывание которых было вызвано клеймом)","(El daño de marcas es cualquier daño infligido por habilidades de marcas o por habilidades activadas por una marca)","(ความเสียหาย ตราเวท คือความเสียหายที่สร้างจากสกิล ตราเวท และสกิลที่ร่ายจาก ตราเวท)","( 烙印傷害為烙印技能或被烙印觸發的技能所造成的所有傷害 )","","","","","","","","","",""
182,"ReminderTextBrandCrits","(Brand Critical Strikes are any Critical Strikes dealt by Brand Skills or by Skills Triggered by a Brand)","(Les Coups critiques des Symboles sont à la fois les Coups critiques infligés par les Aptitudes de Symbole et les Coups critiques infligés par les Aptitudes déclenchées par des Symboles)","(Kritische Treffer mit Zeichen sind jegliche kritische Treffer, die durch Zeichen-Fertigkeiten oder Fertigkeiten verursacht werden, die durch ein Zeichen ausgelöst werden)","(ブランドクリティカルストライクとは、ブランドスキルまたはブランドによりトリガーされたスキルによるクリティカルストライク)","(낙인 치명타란 낙인 스킬 또는 낙인으로 인해 발동하는 스킬이 주는 치명타입니다.)","(Golpes Críticos de Runas são quaisquer Golpes Críticos causados por Habilidades de Runas ou por Habilidades Ativadas por uma Runa)","(Критические удары клеймами - любые критические удары, наносимые умениями клейм или умениями, срабатывание которых было вызвано клеймом)","(Los golpes críticos de marcas son cualquier golpe crítico infligido por habilidades de marcas o por habilidades activadas por una marca)","(การคริติคอลของ ตราเวท คือการคริติคอลที่มาจาก ตราเวท และสกิลที่ร่ายจาก ตราเวท)","( 烙印暴擊為烙印技能或被烙印觸發的技能所造成的所有暴擊 )","","","","","","","","","",""
183,"ReminderTextPower","(Normal Monsters have 1 Power, Magic Monsters 2, Rare Monsters 10, Unique Monsters 20, and Players 5)","(La Puissance des Monstres est de 1 lorsqu'ils sont Normaux, 2 lorsqu'ils sont Magiques, 10 lorsqu'ils sont Rares et 20 lorsqu'ils sont Uniques. Les joueurs ont une Puissance de 5)","(Normale Monster haben 1 Stärkegrad, magische Monster 2, seltene Monster 10, einzigartige Monster 20 und Spieler 5)","(ノーマルモンスターは1パワー、マジックモンスターは2パワー、レアモンスターは10パワー、ユニークモンスターは20パワー、そして他の敵対プレイヤーは5パワー)","(일반 몬스터는 위세가 1, 마법 몬스터는 2, 희귀 몬스터는 10, 고유 몬스터는 20, 플레이어는 5입니다.)","(Monstros Normais têm 1 de Poder, Mágicos 2, Monstros Raros 10, Únicos 20 e Jogadores 5)","(Обычные монстры имеют 1 влияния,  волшебные - 2, редкие - 10, уникальные - 20, игроки - 5)","(Los monstruos normales tienen 1 Poder, los monstruos mágicos 2, los monstruos raros 10, los monstruos únicos 20 y los jugadores 5)","(มอนสเตอร์ระดับธรรมดานับเป็น 1 ระดับ, เมจิกนับเป็น 2 ระดับ, แรร์นับเป็บ 10 ระดับ, ยูนิคนับเป็น 20 ระดับ, ตัวละครผู้เล่นนับเป็น 5 ระดับ)","( 普通怪物為 1 強度、魔法怪物為 2 強度、稀有怪物為 10 強度、傳奇怪物為 20 強度、玩家為 5 強度 )","","","","","","","","","",""
184,"ReminderTextKeystoneGlancingBlows","(Chance to Block Attack Damage is doubled\nChance to Block Spell Damage is doubled\nYou take 65% of Damage from Blocked Hits)","(Les Chances de Bloquer les Dégâts d'Attaque sont doublées\nLes Chances de Bloquer les Dégâts des Sorts sont doublées\nVous subissez 65% des Dégâts au Toucher ainsi Bloqués)","(Die Chance, Angriffsschaden zu blocken, ist verdoppelt\nDie Chance, Zauberschaden zu blocken, ist verdoppelt\nIhr erleidet 65% des Schadens von geblockten Treffern)","(Glancing Blows: アタックブロック率は倍になる\nスペルブロック率は倍になる\nブロックしたヒットの65%のダメージを受ける)","(공격 피해 막기 확률 2배\n주문 피해 막기 확률 2배\n피격을 막아낼 시 65%의 피해를 받음)","(Chance de Bloquear o Dano de Ataques é dobrado\nChance de Bloquear o Dano Mágico é dobrada\nVocê sofre 65% do Dano dos Acertos Bloqueados)","(Шанс заблокировать урон от атак удвоен\nШанс заблокировать урон от чар удвоен\nВы получаете 65% урона от заблокированных ударов)","(La probabilidad de bloquear daño de ataques se duplica\nLa probabilidad de bloquear daño de hechizos se duplica\nRecibes el 65% del daño de los golpes bloqueados)","(โอกาสบล็อคการโจมตีเพิ่มเป็นสองเท่า\nโอกาสบล็อคเวทเพิ่มเป็นสองเท่า\nคุณรับความเสียหาย 65% จากการปะทะที่บล็อคได้)","( 攻擊傷害格擋率被加倍\n法術傷害格擋率被加倍\n你承受 65% 來自格擋擊中的傷害 )","","","","","","","","","",""
185,"ReminderTextKeystoneSoulTether","(Energy Shield starts at zero. Cannot Recharge or Regenerate Energy Shield. Lose 5% of Energy Shield per second. Life Leech effects are not removed when Unreserved Life is Filled. Life Leech effects Recover Energy Shield instead while on Full Life)","(Le Bouclier d'énergie commence à 0, ne se Recharge pas et ne se Régénère pas. Vous perdez 5% de Bouclier d'énergie par seconde. Les effets du Drain de Vie ne s'arrêtent pas lorsque votre Vie non Réservée est remplie. Les effets du Drain de Vie vous font Récupérer du Bouclier d'énergie à la place tant que votre Vie est Pleine)","(Euer Energieschild startet bei Null. Ihr könnt keinen Energieschild wiederaufladen oder regenerieren. Verliert 5% des Energieschilds pro Sekunde. Lebensraub-Effekte dauern an, wenn das unreservierte Leben gefüllt ist. Lebensraub-Effekte stellen stattdessen Energieschild wieder her, während Ihr bei vollem Leben seid)","(Immortal Ambition: エナジーシールドが0から開始し、エナジーシールドのリチャージと自動回復が起きなくなる。秒間5%のエナジーシールドを失う。未リザーブのライフが満杯になってもライフリーチの効果はなくならない。フルライフ時にリーチの効果によりエナジーシールドが回復する)","(에너지 보호막이 0에서 시작합니다. 에너지 보호막을 재충전하거나 재생할 수 없습니다. 에너지 보호막을 1초마다 5% 잃습니다. 점유되지 않은 생명력이 찼을 때 생명력 흡수 효과가 제거되지 않습니다. 최대 생명력일 때 생명력 흡수 시 생명력이 아닌 에너지 보호막을 회복합니다.)","(Escudo de Energia começa do zero. Não pode Recarregar ou Regenerar Escudo de Energia. Perde 5% do Escudo de Energia por segundo. Efeitos de Dreno de Vida não são removidos quando a vida Não Reservada está Cheia. Dreno de Vida afeta a Recuperação do Escudo de Energia ao invés enquanto em Vida Cheia)","(Ваш энергетический щит опустошён. Вы не можете перезаряжать или регенерировать энергетический щит. Вы теряете 5% энергетического щита в секунду. Эффекты похищения здоровья не удаляются при заполнении не удержанного здоровья. Эффекты похищения здоровья восстанавливают энергетический щит при полном здоровье)","(El escudo de energía empieza en cero. El escudo de energía no se puede recargar ni regenerar. Pierdes un 5% de escudo de energía por segundo. Los efectos de la absorción de vida no se eliminan cuando se llena la vida sin reservar. Los efectos de absorción de vida recuperan escudo de energía en lugar de vida cuando tienes la vida llena.)","(โล่พลังงาน ของคุณเริ่มจาก ศูนย์\nไม่สามารถ รีชาร์จหรือฟื้นฟู โล่พลังงาน ได้\nสูญเสียโล่พลังงาน 5% ต่อวินาที\nไม่มีการกำจัดการ ดูดพลังชีวิต เมื่อ พลังชีวิตที่ไม่สำรอง ถูกเติมจนเต็ม\nการ ดูดพลังชีวิต จะ เติมโล่พลังงาน แทนเมื่อ พลังชีวิตเต็ม)","( 能量護盾從 0 開始。無法充能或回復能量護盾。每秒失去 5% 能量護盾。未保留生命滿時，生命偷取效果不會被移除。滿血時生命偷取效果改為回復能量護盾 )","","","","","","","","","",""
186,"ReminderTextAlchemistsGenius","(Alchemist's Genius increases Flask Charges gained by 20% and effect of Flasks by 10%, for 4 seconds)","(Génie de l'alchimiste augmente de 20% la quantité de charges de Flacon gagnées et de 10% l'Effet des Flacons, le tout pendant une durée de 4 secondes)","(Genie des Alchemisten erhöht die erhaltenen Fläschchenfüllungen um 20% und die Fläschchenwirkung um 10%, für 4 Sekunden)","(Alchemist Genius: 錬金術師の天才は、フラスコチャージ獲得量を20%、フラスコ効果を10%増加させる。持続時間は4秒)","(연금술사의 천재성이 4초 동안 플라스크 충전량을 20%, 플라스크의 효과를 10% 증가시킵니다.)","(Gênio Alquímico aumenta as Cargas de Frasco recebidas em 20% e efeito de Frascos em 10%, por 4 segundos)","(Гениальность алхимика на 4 секунды увеличивает количество получаемых зарядов флакона на 20% и эффективность флаконов на 10%)","(El Talento del alquimista aumenta un 20% las cargas de frascos ganadas y un 10% el efecto de los frascos durante 4 segundos)","(ความอัจฉริยะของนักเล่นแร่แปรธาตุ เพิ่มจำนวนชาร์จขวดยาที่ได้รับ 20% และเพิ่มผลของขวดยา 10%, เป็นเวลา 4 วินาที)","( 鍊金之材增加 20% 獲得藥劑充能和 10% 藥劑效果，持續 4 秒 )","","","","","","","","","",""
187,"ReminderTextKeystoneSacredBastion","(100% chance to Defend with Double Armour. Maximum Damage Reduction for any Damage Type is 50%)","(100% de chances de vous défendre avec une Armure doublée. Le maximum de Réduction de tous les types de Dégâts est de 50%)","(100% Chance, Schaden mit doppelter Rüstung zu verteidigen. Maximale Schadensminderung für alle Schadenstypen beträgt 50%)","(Imbalanced Guard: 100%の確率で倍のアーマー値で防御できる。全てのダメージタイプへの最大ダメージ軽減効果が50%となる)","(100% 확률로 2배의 방어도로 방어합니다. 모든 피해 유형에 대한 피해 감소의 최대치는 50%입니다.)","(100% de chance de Defender com Armadura Dupla. Redução de Dano de qualquer Tipo Máxima é de 50%)","(100% шанс на защиту с удвоенной бронёй. Максимум уменьшения урона от любого типа урона составляет 50%)","(100% de probabilidad de defender con el doble de armadura. La reducción de daño máxima para cualquier tipo de daño es del 50%)","(มีโอกาสป้องกันด้วยค่าเกราะสองเท่าของค่าจริง 100% การลดความเสียหายทุกชนิดจะไม่สามารถลดได้ต่ำกว่า 50%)","(100% 機率使用 2 倍護甲防禦\n最大任何傷害減免為 50%)","","","","","","","","","",""
