"rownum","Id","Text (English)","Text (French)","Text (German)","Text (Japanese)","Text (Korean)","Text (Portuguese)","Text (Russian)","Text (Spanish)","Text (Thai)","Text (Traditional Chinese)","TextHardmode (English)","TextHardmode (French)","TextHardmode (German)","TextHardmode (Japanese)","TextHardmode (Korean)","TextHardmode (Portuguese)","TextHardmode (Russian)","TextHardmode (Spanish)","TextHardmode (Thai)","TextHardmode (Traditional Chinese)"
82,"ReminderTextKeystoneConduit","(Share Endurance, Frenzy and Power Charges with nearby party members)","(Vous partagez les Charges d'endurance, de frénésie et de pouvoir avec les membres de votre groupe à proximité)","(Teilt Widerstands-, Raserei- und Energie-Ladungen mit nahen Gruppenmitgliedern)","(Conduit: エンデュランスチャージ、フレンジーチャージおよびパワーチャージを近くのパーティーメンバーと共有する)","(주변의 파티원과 인내, 격분, 권능 충전을 공유합니다)","(Compartilha Cargas de Tolerância, Frenesi e Poder com membros do grupo próximos)","(Делится зарядами энергии, выносливости и ярости с ближайшими членами группы)","(Compartes tus cargas de aguante, frenesí y poder con los miembros cercanos de tu grupo)","(แบ่งปัน Endurance, Frenzy, Power Charge ให้กับสมาชิกปาร์ตี้ที่อยู่ใกล้)","(與鄰近的隊友分享耐力、狂怒與暴擊球)","","","","","","","","","",""
83,"ReminderTextKeystoneVaalPact","(Total Recovery from Life Leech is doubled, Maximum total Life Recovery per second from Leech is doubled, You have no Life Regeneration)","(Votre Drain de Vie par seconde est doublé. Votre Drain de Vie maximal par seconde est doublé. Vous n'avez pas de Régénération de Vie)","(Gesamtwiederherstellung durch Lebensraub ist verdoppelt, maximale Gesamtwiederherstellung des Lebens pro Sekunde, die durch Raub erfolgt, ist verdoppelt, Ihr habt keine Lebensregeneration)","(Vaal Pact: ライフリーチによる合計回復量とライフリーチによる1秒当たりの最大合計回復量が倍になる。ライフ自動回復が起きなくなる)","(생명력 흡수로 인한 총 회복량이 2배로 증가합니다. 흡수로 인한 초당 총 생명력 회복량 최대치가 2배로 증가합니다. 생명력 재생이 없습니다.)","(Recuperação Total do Dreno de Vida é dobrada, Máximo de Recuperação total de Vida do Dreno por segundo é dobrada, Você não tem Regeneração de Vida.)","(Итоговое восстановление от похищения здоровья удвоено, максимальное итоговое восстановление здоровья в секунду от похищения удвоено, регенерация здоровья не действует)","(La recuperación total de la absorción de vida está duplicada; la recuperación de vida total máxima por segundo de la absorción está duplicada; no tienes regeneración de vida.)","(อัตราการเติมสุทธิ จากการ ดูดพลังชีวิต เพิ่มเป็นสองเท่า, อัตราการ เติมพลังชีวิต สุทธิสูงสุดจากการ ดูด เพิ่มเป็นสองเท่า, คุณไม่มีการ ฟื้นฟูพลังชีวิต)","(生命偷取總恢復加倍，偷取的每秒最大總生命恢復加倍，你沒有生命回復)","","","","","","","","","",""
84,"ReminderTextKeystoneMindOverMatter","(40% of Damage is taken from Mana before Life)","(40% des Dégâts subis retirent du Mana à la place de la Vie)","(40 % des Schadens werden zuerst vom Mana und dann vom Leben abgezogen.)","(Mind Over Matter: 40%のダメージをライフより先にマナで受ける)","(피해의 40%만큼 생명력 대신 마나가 소모됩니다.)","(40% do Dano é retirado da Mana antes da Vida)","(40% урона берётся сначала из маны вместо здоровья)","(El 40% del daño se toma del maná antes que de la vida)","(รับความเสียหาย 40% ด้วย มานา ก่อน พลังชีวิต)","(被擊中時，40% 的傷害從魔力扣取)","","","","","","","","","",""
85,"ReminderTextKeystoneUnwaveringStance","(Cannot Evade enemy Attacks. Cannot be Stunned)","(Vous ne pouvez plus Éviter les Attaques. Vous êtes Immunisé à l'Étourdissement)","(Ihr könnt gegnerischen Angriffen nicht ausweichen. Ihr könnt nicht betäubt werden.)","(Unwavering Stance: 敵の攻撃を回避できなくなるが、スタンさせられることがなくなる)","(적 공격을 회피할 수 없습니다. 기절하지 않습니다)","(Não pode Evadir Ataques inimigos. Não pode ser Atordoado)","(Невозможно уклониться от вражеских атак. Невозможно получить оглушение)","(No puedes evadir los ataques de los enemigos. No puedes ser aturdido)","(ไม่สามารถหลบหลีกการโจมตีของศัตรูได้ แต่ไม่ติดสถานะ มึนงง","(無法閃避敵人攻擊。不會被暈眩)","","","","","","","","","",""
86,"ReminderTextKeystonePointBlank","(Projectile Attack Hits deal up to 30% more Damage to targets at the start of their movement, dealing less Damage to targets as the projectile travels farther)","(Les Attaques à Projectiles ont jusqu'à 30% Davantage de Dégâts au début de leur déplacement, infligeant moins de dégâts aux cibles à mesure que le Projectile s'éloigne)","(Treffer mit Projektilangriffen verursachen bis zu 30 % mehr Schaden am Anfang ihrer Bewegung; der Schaden wird geringer, je weiter sich das Projektil entfernt)","(Point Blank: 投射物によるアタックヒットは、投射開始時点で与えるダメージが30%上昇し、遠くに飛ぶにつれて与えるダメージが低下する)","(투사체 명중 시, 투사체 발사 지점에서 대상이 가까울수록 받는 피해가 최대 30% 증폭하고, 멀어질수록 받는 피해가 감폭합니다)","(Acertos de Ataques de Projéteis causam até 30% mais Dano em alvos no começo do movimento, causando menos Dano em alvos conforme o projétil viaja adiante)","(Снаряды от атак наносят до 30% больше урона целям в начале своего движения, нанося меньше урона удалённым целям)","(Los golpes de ataques de proyectiles infligen hasta un 30% más de daño a los objetivos al comienzo de su movimiento e infligen menos daño a los objetivos a medida que el proyectil viaja más lejos)","(การปะทะด้วยการโจมตี กระสุน สร้างความเสียหายเพิ่มขึ้น อีก 30% ณ จุดเริ่มต้นของการเคลื่อนที่ของกระสุนนั้น และสร้างความเสียหายลดลงเรื่อยๆ ขณะที่กระสุนเดินทางไกลออกไป)","(投射物攻擊擊中目標時，在起始位置造成至多 30% 更多傷害，隨著投射物飛行越遠對目標造成傷害減少 )","","","","","","","","","",""
87,"ReminderTextLucky","(Lucky things are rolled twice and the best result used)","(Une valeur qui en Favorable est tirée deux fois au sort, et le meilleur des deux résultats est conservé)","(Günstig heißt, dass eine Zahl zweimal ausgewürfelt und das bessere Resultat gewählt wird.)","(Lucky: 幸運は2度試行し、良いほうの結果を用いる)","(\""행운\""은 주사위를 2회 굴린 수치 중 좋은 값을 사용하는 메커니즘입니다)","(Coisas Sortudas são calculadas duas vezes e o melhor resultado é usado)","(Проверка на удачливые события происходит дважды, выбирается наилучший из исходов)","(Las cosas afortunadas se aleatorizan dos veces y se usa el mejor resultado)","(โชคดี คือการสุ่มค่า 2 ครั้งแล้วใช้ค่าที่ดีที่สุด)","(幸運令各種隨機數值計算兩次，並取高值做為結果。)","","","","","","","","","",""
88,"ReminderTextUnlucky","(Unlucky things are rolled twice and the worst result used)","(Une valeur qui est Défavorable est tirée deux fois au sort, et le moins bon des deux résultats est conservé)","(Ungünstig heißt, dass eine Zahl zweimal ausgewürfelt und das schlechtere Resultat gewählt wird.)","(Unlucky: 不運は2度試行し、悪いほうの結果を用いる)","(\""불운\""은 주사위를 2회 굴려서 나쁜 값을 사용합니다)","(Coisas Azaradas são calculadas duas vezes e o pior resultado é usado)","(Проверка на неудачливые события происходит дважды, выбирается наихудший из исходов)","(Las cosas desafortunadas se aleatorizan dos veces y se elige el peor resultado)","(โชคร้าย คือการสุ่มค่า 2 ครั้งแล้วใช้ค่าที่แย่ที่สุด)","(不幸令各種隨機數值計算兩次，並取低值做為結果。)","","","","","","","","","",""
89,"ReminderTextUncappedResist","(Uncapped Resistance is the value Resistance would have if ignoring Maximum Resistance)","(La Résistance totale correspond à la valeur qu'a une Résistance si l'on ignore sa valeur maximale)","(Ungedeckelter Widerstand ist der Wert, den ein Widerstand haben würde, wenn der maximale Wert des Widerstands ignoriert werden würde)","(Uncapped Resistance: 最大値に制限されない耐性とは、耐性の最大値に制限されない場合の耐性値のことである。)","(\""비 제한 저항\""은 저항 최대치를 무시할 때의 저항 값입니다)","(Resistência Não Limitada é o valor que a Resistência teria se ignorasse o Máximo de Resistência)","(Не ограниченное сопротивление - полное значение сопротивления без учёта максимального предела)","(La resistencia sin limitar es el valor que tendría la resistencia si se ignorase la resistencia máxima)","(ค่าต้านทานรวมเกิน คือค่าต้านทานที่คุณจะมีหากมองข้ามค่าสูงสุดของความต้านทานนั้นๆ หรือก็คือค่าต้านทานในวงเล็บนั่นเอง)","(不將抗性上限列入計算的抗性絕對值)","","","","","","","","","",""
90,"ReminderTextKeystoneAvatarOfFire","(50% of Physical, Cold and Lightning Damage Converted to Fire Damage.\nDeal no Non-Fire Damage)","(50% de vos Dégâts physiques, de froid et de foudre sont Convertis en Dégâts de feu.\nVous n'infligez pas de Dégâts à l'exception des Dégâts de feu)","(50% des physischen, Kälte- und Blitzschadens werden in Feuerschaden umgewandelt.\nIhr verursacht ausschließlich Feuerschaden.)","(Avatar of Fire: 物理、冷気、雷ダメージの50%を火ダメージに変換する。\n火ダメージ以外を与えられない)","(물리, 냉기 및 번개 피해의 50%를 화염 피해로 전환합니다\n화염 피해만 줄 수 있습니다)","(50% do Dano Físico, Gelo e Raio Convertido para Dano de Fogo.\nNão causa Dano que não seja de Fogo)","(50% физического урона, урона от холода и молнии становятся уроном от огня.\nНаносит только урон от огня)","(El 50% del daño físico, de hielo y de rayo se convierte en daño de fuego.\\No inflige ningún daño que no sea de fuego)","(แปลงความเสียหาย กายภาพ, น้ำแข็ง, สายฟ้า 50% เป็น ไฟ\nไม่สามารถสร้างความเสียหายชนิดอื่นที่ไม่ใช่ ไฟ ได้)","(50% 物理、冰冷、閃電傷害轉換成火焰傷害。除火焰傷害外不造成其他傷害。)","","","","","","","","","",""
91,"ReminderTextKeystoneAncestralBond","(You can't deal Damage with Skills yourself.  +1 to maximum number of Summoned Totems)","(Vous ne pouvez plus infliger de Dégâts avec vos Aptitudes directement. +1 au nombre maximal de Totems Invoqués)","(Ihr verursacht mit Euren Fertigkeiten selbst keinen Schaden.\nErlaubt gleichzeitige Kontrolle von 1 zusätzlichen Totem.)","(Ancestral Bond: プレイヤー自らはダメージを与えられなくなる。トーテムの最大召喚可能数が+1される)","(스킬을 사용하여 직접 피해를 줄 수 없습니다. 소환된 토템의 최대 수가 1 증가합니다)","(Você próprio não pode causar Dano com Habilidades. Pode ter até 1 Totem adicional convocado por vez)","(Вы не можете самостоятельно наносить урон своими умениями. +1 к максимальному количеству установленных тотемов)","(No puedes infligir daño con habilidades tú mismo. +1 a la cantidad máxima de tótems invocados)","(คุณไม่สามารถสร้างความเสียหายด้วยสกิลของตนเองได้ จำนวน โทเทม สูงสุด +1 เสา)","(你的技能無法造成傷害。+1 召喚圖騰的最大數量)","","","","","","","","","",""
92,"ReminderTextKeystoneEldritchBattery","(Spend Energy Shield before Mana for Skill Mana Costs. Energy Shield protects Mana instead of Life. 50% less Energy Shield Recharge Rate)","(Désormais, vous payez d'abord le Coût en Mana de vos Aptitudes avec votre Bouclier d'énergie. Votre Bouclier d'Énergie protège votre Mana au lieu de votre Vie. 50% de Perte de Vitesse de recharge du Bouclier d'énergie)","(Manakosten für Fertigkeiten werden zuerst vom Energieschild und erst dann vom Mana abgezogen. Energieschild schützt Mana statt Leben. 50% weniger Energieschild-Wiederaufladungsrate)","(Eldrich Battery: スキルのマナコストを消費する際、マナの前にエナジーシールドを消費する。エナジーシールドはライフの代わりにマナを守る。エナジーシールドのリチャージ速度50%低下)","(스킬의 마나 소모량 차감 시 마나 대신 에너지 보호막을 우선 소모합니다. 에너지 보호막이 생명력 대신 마나를 보호합니다. 에너지 보호막 재충전 속도가 50% 감폭됩니다)","(Gasta Escudo de Energia antes da Mana para Custo de Mana de Habilidades. Escudo de Energia protégé a Mana ao invés da Vida. 50% menos Recarga do Escudo de Energia.)","(При расходе умениями маны сначала расходуется энергетический щит вместо маны. Энергетический щит защищает ману вместо здоровья. На 50% меньшая скорость перезарядки энергетического щита)","(Gastas escudo de energía antes que maná para los costos de las habilidades. El escudo de energía protege el maná en lugar de la vida. 50% menos de velocidad de recarga del escudo de energía)","(จ่าย โล่พลังงาน ก่อน มานา ในส่วนของ ค่าใช้งาน ที่เป็น มานา, ลดอัตราการ รีชาร์จโล่พลังงาน อีก 50%)","(優先使用能量護盾代替技能魔力消耗。能量護盾從生命護盾變成魔力護盾。50% 更少能量護盾回復速度)","","","","","","","","","",""
93,"ReminderTextCoveredInAsh","(Being Covered in Ash applies 20% less Movement Speed and 20% increased Fire Damage Taken, for 4 seconds)","(Être Recouvert de cendres inflige 20% de Perte de Vitesse de déplacement et 20% d'Augmentation des Dégâts de feu subis pendant 4 secondes)","(Mit Asche bedeckt zu sein wendet 20% weniger Bewegungsgeschwindigkeit und 20% erhöhten erlittenen Feuerschaden an, für 4 Sekunden)","(Covered in Ash: 灰まみれは、移動スピードを20%低下させ、受ける火ダメージを20%増加させる。持続時間は4秒)","(\""재로 뒤덮임\"" 상태에서는 이동 속도가 20% 감폭되고 받는 화염 피해가 20% 증가합니다. 4초 동안 유지됩니다)","(Estar coberto por Cinzas reduz em 20% Velocidade de Movimento e aumenta em 20% o Dano de Fogo Sofrido, dura por 4 segundos)","(Покрытие пеплом даёт на 20% меньше скорости передвижения и увеличивает получаемый урон от огня на 20% на 4 секунды)","(Estar cubierto de ceniza otorga un 20% menos de velocidad de movimiento y daño de fuego recibido aumentado un 20%, durante 4 segundos)","(สถานะ อาบขี้เถ้า ลดความเร็วในการเคลื่อนที่ อีก 20% และเพิ่มความเสียหาย ไฟ ที่ได้รับ 20% เป็นเวลา 4 วินาที)","(被餘燼纏身時20%更少移動速度並增加承受20%火焰傷害，持續 4 秒)","","","","","","","","","",""
94,"ReminderTextCoveredInAshNoDuration","(Being Covered in Ash applies 20% less Movement Speed and 20% increased Fire Damage Taken)","(Être Recouvert de cendres inflige 20% de Perte de Vitesse de déplacement et 20% d'Augmentation des Dégâts de feu subis)","(Mit Asche bedeckt zu sein wendet 20% weniger Bewegungsgeschwindigkeit und 20% erhöhten erlittenen Feuerschaden an)","(Covered in Ash: 灰まみれは、移動スピードを20%低下させ、受ける火ダメージが20%増加させる)","(\""재로 뒤덮임\"" 상태에서는 이동 속도가 20% 감폭되고 받는 화염 피해가 20% 증가합니다.)","(Inimigos Cobertos por Cinzas têm 20% menos Velocidade de Movimento e 20% de Dano de Fogo Sofrido aumentado)","(Покрытие пеплом даёт на 20% меньше скорости передвижения и увеличивает получаемый урон от огня на 20%)","(Estar cubierto de ceniza otorga un 20% menos de velocidad de movimiento y daño de fuego recibido aumentado un 20%)","(สถานะ อาบขี้เถ้า ลดความเร็วในการเคลื่อนที่ อีก 20% และเพิ่มความเสียหาย ไฟ ที่ได้รับ 20%)","(被餘燼纏身的敵人20%更少移動速度並增加承受20%火焰傷害)","","","","","","","","","",""
95,"ReminderTextCoveredInAshVariableDamgaeTaken","(Being Covered in Ash applies 20% less Movement Speed and increases Fire Damage taken, for 4 seconds)","(Être Recouvert de cendres inflige 20% de Perte de Vitesse de déplacement et 20% d'Augmentation des Dégâts de feu subis)","(Mit Asche bedeckt zu sein wendet 20% weniger Bewegungsgeschwindigkeit an und erhöht den erlittenen Feuerschaden für 4 Sekunden)","(Covered in Ash: 灰まみれは、移動スピードを20%低下させ、受ける火ダメージを増加させる。持続時間は4秒)","(\""재로 뒤덮임\"" 상태에서는 이동 속도가 20% 감폭되고 받는 화염 피해가 증가합니다. 4초 동안 유지됩니다)","(Estar coberto por Cinzas reduz em 20% Velocidade de Movimento e aumenta em 20% o Dano de Fogo Sofrido, dura por 4 segundos)","(Покрытие пеплом даёт на 20% меньше скорости передвижения и увеличивает получаемый урон от огня на 4 секунды)","(Estar cubierto de ceniza otorga un 20% menos de velocidad de movimiento y aumenta el daño de fuego recibido, durante 4 segundos)","(สถานะ อาบขี้เถ้า ลดความเร็วในการเคลื่อนที่ อีก 20% และเพิ่มความเสียหาย ไฟ ที่ได้รับ เป็นเวลา 4 วินาที)","( 餘燼纏身套用 20% 更少移動速度和增加承受 20% 火焰傷害，持續 4 秒 )","","","","","","","","","",""
96,"ReminderTextKeystoneChaosInoculation","(Maximum Life becomes 1, Immune to Chaos Damage)","(Votre Vie maximale passe à 1. Vous êtes immunisé aux Dégâts de chaos)","(Setzt maximales Leben auf 1 und macht immun gegen Chaosschaden.)","(Chaos Inoculation: ライフの最大値が1になる。混沌ダメージを受けなくなる)","(최대 생명력이 1이 되고, 카오스 피해에 면역이 됩니다)","(Vida Máxima torna-se 1, Imune a Dano de Caos)","(Максимальное количество здоровья становится равно 1, иммунитет к урону хаосом)","(La vida máxima se vuelve 1. Inmune al daño de caos)","(พลังชีวิตสูงสุด กลายเป็น 1, ไม่ได้รับความเสียหาย เคออส)","(最大生命變成 1，免疫混沌傷害)","","","","","","","","","",""
97,"ReminderTextKeystoneElementalEquilibrium","(Hits that deal Elemental Damage remove Exposure to those Elements and inflict Exposure to other Elements, applying -25% to Resistances)","(Lorsque vous touchez avec des Dégâts élémentaires, vous retirez l'Exposition aux éléments correspondants et infligez l'Exposition aux autres éléments, ce qui inflige -25% de malus aux Résistances concernées)","(Treffer, die Elementarschaden verursachen, entfernen die Anfälligkeit für diese Elemente und verursachen Anfälligkeit für die anderen Elemente, was -25% zu Widerständen anwendet)","(Elemental Equilibrium: 元素ダメージによるヒットは、ヒットされた対象からその元素への曝露を取り除き、代わりに対象を他の元素へ曝露させる。その結果、対象はその元素への耐性が-25%になる。)","(명중으로 원소 피해를 주면 해당 원소의 노출을 제거하고 다른 원소의 노출을 유발하여 저항 -25%를 적용합니다)","(Acertos que causam Dano Elemental removem Exposição para aqueles Elementos e infligem Exposição aos outros Elementos, aplicando -25% às Resistências)","(Удары, наносящие урон от стихий, снимают Восприимчивость к соответствующим стихиям и накладывают Восприимчивость к другим стихиям, добавляя -25% к сопротивлениям)","(Los golpes que infligen daño elemental eliminan la exposición a esos elementos y aplican exposición a otros elementos, y también aplican un -25% a todas las resistencias)","(การปะทะที่สร้างความเสียหาย ธาตุ จะกำจัดสถานะ พ่ายแก่ธาตุ ต่อธาตุเหล่านั้น แล้วสร้างสถานะ พ่ายแก่ธาตุ ของธาตุอื่นๆ ทำให้ค่าต้านทาน ธาตุเหล่านั้น -25%)","(擊中造成的元素傷害移除該元素曝曬並造成其他元素曝曬，-25% 元素)","","","","","","","","","",""
