"rownum","Id","Text (English)","Text (French)","Text (German)","Text (Japanese)","Text (Korean)","Text (Portuguese)","Text (Russian)","Text (Spanish)","Text (Thai)","Text (Traditional Chinese)","TextHardmode (English)","TextHardmode (French)","TextHardmode (German)","TextHardmode (Japanese)","TextHardmode (Korean)","TextHardmode (Portuguese)","TextHardmode (Russian)","TextHardmode (Spanish)","TextHardmode (Thai)","TextHardmode (Traditional Chinese)"
253,"ReminderTextCruelty","(Cruelty makes all Skills Supported by Cruelty Support deal up to 40% more Damage over Time, based on the amount of Damage in the Hit which grants it)","(Cruauté permet aux Aptitudes modifiées par Soutien : Cruauté d'avoir jusqu'à 40% Davantage de Dégâts sur la durée, en fonction des Dégâts au Toucher qui vous ont donné Cruauté)","(Grausamkeit bewirkt, dass durch Grausamkeit unterstützte Fertigkeiten bis zu 40% mehr Schaden über Zeit verursachen, basierend auf der Schadensmenge des Treffers, der Grausamkeit gewährt hat)","(Cruelty: クルーエルティはクルーエルティにサポートされている全てのスキルの継続ダメージをそれを発生させた攻撃のヒットダメージに基づいて最大40%上昇させる)","(잔혹이 잔혹을 부여하는 명중의 피해량에 따라 잔혹 보조 효과가 적용되는 모든 스킬의 지속 피해를 최대 40% 증폭시킴)","(Crueldade faz com que as Habilidades Suportadas por Suporte: Crueldade causem até 40% mais Dano Degenerativo, baseado na quantidade de Dano no Acerto que o concedeu)","(Злость заставляет все умения, усиленные камнем поддержки Злость, наносить вплоть до 40% больше постепенного урона, в зависимости от даровавшего этот эффект удара)","(Crueldad hace que todas las habilidades asistidas por Asistencia de Crueldad inflijan hasta un 40% más de daño degenerativo, según la cantidad de daño que inflija el golpe que la otorga)","(อำมหิต ทำให้สกิลที่เสริมด้วย หินเสริม Cruelty สร้างความเสียหายต่อเนื่อง เพิ่มขึ้น สูงสุด อีก 40% โดยขึ้นกับความเสียหายจากการปะทะที่สร้างสถานะนั้น)","(殘酷使所有被殘酷輔助的技能，根據擊中的傷害總量，造成至多 40% 更多持續傷害)","","","","","","","","","",""
254,"ReminderTextKeystoneEverlastingSacrifice","(When you reach full Energy Shield, Sacrifice all Energy Shield to gain +5% to all Maximum Resistances for 4 seconds)","(Lorsque votre Bouclier d'énergie devient Plein, tout votre Bouclier d'énergie est sacrifié afin de vous octroyer +5% à toutes les Résistances maximales pendant 4 secondes)","(Wenn Ihr vollen Energieschild erreicht, wird sämtlicher Energieschild geopfert und für 4 Sekunden +5% zu allen maximalen Widerständen gewährt)","(Everlasting Sacrifice: エナジーシールドが最大になった時、全てのエナジーシールドを犠牲に4秒間全ての最大耐性に+5%を得る。)","(에너지 보호막이 최대에 도달하면, 에너지 보호막을 모두 희생하여 4초 동안 모든 저항 최대치를 +5% 얻습니다.)","(Quando atingir Escudo de Energia cheio, Sacrifica todo o Escudo de Energia para ganhar +5% do Máximo de Resistências por 4 segundos)","(Когда ваш энергетический щит заполняется, вы жертвуете всем энергетическим щитом и получаете +5% к максимуму всех сопротивлений на 4 секунды)","(Cuando llenas tu escudo de energía, sacrificas todo el escudo de energía para ganar +5% a todas las resistencias máximas durante 4 segundos)","(เมื่อคุณมี โล่พลังงานเต็ม สังเวย โล่พลังงานทั้งหมด เพื่อได้รับ ค่าต้านทาน ทุกธาตุ สูงสุด +5% เป็นเวลา 4 วินาที)","(當你滿能量護盾時，獻祭全部能量護盾以獲得 +5% 全部最大抗性 4 秒)","","","","","","","","","",""
255,"ReminderTextShepherdOfSouls","(When you use a Vaal Skill, other Vaal skills gain 50% of the consumed Souls. Deal 30% less Damage with Non-Vaal Skills)","(Lorsque vous utilisez une Aptitude vaal, les autres Aptitudes vaal gagnent 50% des Âmes consommées. Vous avez 30% de Perte de Dégâts avec les Aptitudes non vaal)","(Wenn Ihr eine Vaal-Fertigkeit verwendet, erhalten andere Vaal-Fertigkeiten 50% der verbrauchten Seelen. Verursacht 30% weniger Schaden mit Nicht-Vaal-Fertigkeiten)","(Shepherd of Souls: ヴァ―ルスキルを使用すると、消費した魂の50％がそれ以外のヴァ―ルスキルに追加される。ただし、ヴァ―ルスキルでないスキルのダメージが30％低下する)","(바알 스킬을 사용하면, 다른 바알 스킬들이 소모된 영혼의 50%를 얻습니다. 비-바알 스킬로 주는 피해가 30% 감폭됩니다.)","(Ao usar uma Habilidade Vaal, outras habilidades Vaal ganham 50% das Almas consumidas. Causa 30% menos Dano com Habilidades Não Vaal)","(Когда вы используете умение ваал, другие умения ваал получают 50% от затраченых душ. На 30% меньше урона умениями не-ваал)","(Cuando usas una habilidad vaal, las otras habilidades vaal ganan el 50% de las almas consumidas. Inflige un 30% menos de daño con habilidades que no sean vaal)","(เมื่อคุณใช้ สกิลวาล์ สกิลวาล์อื่นๆ จะได้รับวิญญาณที่ถูกใช้ไป 50% คุณสร้างความเสียหายด้วยสกิลที่ไม่ใช่ วาล์ ลดลง อีก 30%)","(當你使用瓦爾技能時，其他瓦爾技能獲得 50% 消耗的靈魂。非瓦爾技能造成 30% 更少傷害)","","","","","","","","","",""
256,"ReminderTextLifetap","(Lifetap grants 20% increased Life Recovery from Flasks)","(Ponction vitale octroie 20% d'Augmentation de la Récupération de Vie des Flacons)","(Aderlass gewährt 20% erhöhte Lebenswiederherstellung von Fläschchen)","(Lifetap: ライフタップはフラスコによるライフ回復を20%増加させる)","(생명력 전환 시 플라스크로 얻는 생명력 회복 20% 증가)","(Fonte de Vida concede Recuperação de Vida dos Frascos aumentada em 20%)","(Жизнеотвод дарует 20% увеличение восстановления здоровья от флаконов)","(Transfusión de vida otorga recuperación de vida con frascos aumentada un 20%)","(จ่ายชีวี เพิ่มการ เติมพลังชีวิต จาก ขวดยา 20%)","(活栓增加 20% 來自藥劑的生命回復)","","","","","","","","","",""
257,"ReminderTextKeystoneMagebane","(Dexterity provides no inherent bonus to Evasion Rating. +1% chance to Suppress Spell Damage per 15 Dexterity)","(La Dextérité n'octroie plus de bonus de Score d'Évasion inhérent. +1% de chances de Réprimer les Dégâts des Sorts tous les 15 de Dextérité)","(Geschick bietet keinen inhärenten Bonus auf den Ausweichwert. +1% Chance, Zauberschaden zu unterdrücken pro 15 Geschick)","(器用さは本来のボーナスを回避力に与えなくなる。器用さ15毎にスペルダメージ抑制確率を+1%)","(민첩이 회피에 직접적인 보너스를 주지 않습니다. 민첩 15당 주문 피해 억제 확률 1%를 부여합니다.)","(Destreza não concede nenhum bônus inerente para Evasão. +1% de chance de Suprimir Dano Mágico por cada 15 de Destreza)","(Ловкость перестаёт увеличивать уклонение. +1% шанс подавить урон от чар за каждые 15 ловкости)","(La destreza no otorga ninguna bonificación inherente a la evasión. +1% de probabilidad de atenuar el daño de los hechizos por cada 15 de destreza)","(Dexterity ไม่ให้โบนัสดั้งเดิมแก่ อัตราการหลบหลีก แต่มีโอกาส ยับยั้งความเสียหาย เวท +1% ต่อ Dexterity 15 หน่วย)","( 敏捷不提供固有的閃避值加成。每 15 點敏捷 +1 法術傷害壓抑率 )","","","","","","","","","",""
258,"ReminderTextSuppression","(50% of Damage from Suppressed Hits and Ailments they inflict is prevented)","(Lorsque des Dégâts au Toucher et avec les Altérations sont Réprimés, 50% de leur montant est absorbé)","(50% des Schadens von unterdrückten Treffern und Beeinträchtigungen, die sie verursachen, wird verhindert)","(抑制したヒットによるダメージとそのヒットが付与した状態異常によるダメージの50%を防ぐ)","(억제된 명중과 상태 이상으로 받는 피해의 50%를 방지합니다.)","(50% de Dano dos Acertos e Afecções Suprimidas que eles infligirem é negado)","(50% урона от подавленных ударов и накладываемых ими состояний предотвращается)","(El 50% del daño de los golpes y estados alterados atenuados que aplican se evita)","(ความเสียหาย 50% จากการปะทะและเจ็บป่วยที่ถูกยับยั้ง จะถูกยกเว้น)","( 來自壓抑的擊中和它們所造成異常狀態傷害的 50% 被阻止 )","","","","","","","","","",""
259,"ReminderTextKeystoneGhostDance","(Cannot Recover Energy Shield to above Evasion Rating. Every 2 seconds, gain a Ghost Shroud, up to a maximum of 3. When Hit, lose a Ghost Shroud to Recover Energy Shield equal to 3% of your Evasion Rating)","(Vous ne pouvez pas Récupérer de Bouclier d'énergie au-delà de votre Évasion. Toutes les 2 secondes, vous gagnez un Voile fantomatique, jusqu'à un maximum de 3. Lorsque vous êtes Touché, vous perdez un Voile fantomatique et Récupérez un montant de Bouclier d'énergie équivalent à 3% de votre Score d'Évasion)","(Ihr könnt keinen Energieschild über den Ausweichwert hinaus wiederherstellen. Erhaltet alle 2 Sekunden einen Geisterschleier, bis zu einem Maximum von 3. Wenn Ihr getroffen werdet, verliert Ihr einen Geisterschleier und stellt Energieschild in Höhe von 3% Eures Ausweichwerts wieder her)","(Ghost Dance: 回避力の値以上にエナジーシールドを回復できなくなる。2秒ごとにゴーストシュラウドを獲得し、その最大値は3である。ヒットを受けた際、ゴーストシュラウドを1つ取り除き、回避力の3%分のエナジーシールドを回復する)","(에너지 보호막 회복량은 회피를 넘어갈 수 없습니다. 2초마다 유령 연막 1개씩 획득하며, 유령 연막은 최대 3개입니다. 피격 시 유령 연막을 1개 잃고 회피의 3%와 동일한 에너지 보호막이 회복됩니다.)","(Não pode Recuperar Escudo de Energia acima da Evasão. A cada 2 segundos, ganha uma Mortalha Fantasma, máximo de 3. Quando Acertado, perca uma Mortalha Fantasma para Recuperar Escudo de Energia igual a 3% da sua Evasão)","(Нельзя восстановить энергетический щит выше уклонения. Каждые 2 секунды вы получаете Призрачный покров, вплоть до 3. При получении удара вы теряете Призрачный покров и восстанавливаете энергетический щит в размере 3% от вашего уклонения)","(No puedes recuperar escudo de energía por encima del valor de evasión. Cada 2 segundos, ganas un Velo fantasmal hasta un máximo de 3. Cuando te golpean, pierdes un Velo fantasmal y recuperas escudo de energía igual a un 3% de tu evasión)","(ไม่สามารถ เติมโล่พลังงาน ให้สูงไปกว่า อัตราการหลบหลีก ได้ แต่ทุก 2 วินาทีจะได้รับสถานะ ห่อวิญญาณ 1 ชั้น สูงสุด 3 ชั้น และเมื่อถูกปะทะจะสูญเสียสถานะ ห่อวิญญาณ 1 ชั้น เพื่อ เติมโล่พลังงาน เท่ากับ 3% ของ อัตราการหลบหลีก ของคุณ)","( 能量護盾無法回復超過閃避值。每 2 秒獲得 1 層幽魂屍布，最多 3 層。被擊中時，失去 1 層幽魂屍布以回復 3% 等同於你閃避值的能量護盾 )","","","","","","","","","",""
260,"ReminderTextKeystoneDivineShield","(Cannot Recover Energy Shield to above Armour. 3% of Physical Damage prevented from Hits Recently is Regenerated as Energy Shield per second)","(Vous ne pouvez pas Récupérer de Bouclier d'énergie au-delà de votre Armure. 3% des Dégâts physiques au Toucher neutralisés Récement sont Régénérés sous forme de Bouclier d'énergie par seconde)","(Ihr könnt keinen Energieschild über den Rüstungswert hinaus wiederherstellen. 3% des physischen Schadens, der kürzlich von Treffern verhindert wurde, wird als Energieschild pro Sekunde regeneriert)","(アーマーの値以上にエナジーシールドを回復できなくなる。直近受けたヒットから軽減した物理ダメージの3%を毎秒エナジーシールドとして回復する)","(에너지 보호막 회복량은 방어도를 넘어갈 수 없습니다. 1초당 최근 4초 이내의 피격에서 방지한 물리 피해의 3%를 에너지 보호막으로 재생합니다.)","(Não pode recuperar Escudo de Energia acima da Armadura. 3% do Dano Físico negado dos Acertos Recentes é Regenerado como Escudo de Energia por segundo)","(Нельзя восстановить энергетический щит выше брони. 3% от недавно предотвращённого физического урона от ударов регенерируется в виде энергетического щита в секунду)","(No puedes recuperar escudo de energía por encima del valor de armadura. El 3% del daño físico evitado de los golpes recientemente se regenera como escudo de energía por segundo)","(ไม่สามารถ เติมโล่พลังงาน ให้สูงไปกว่า ค่าเกราะ ได้ นอกจากนี้ แปลง 3% ของความเสียหาย ปะทะ กายภาพ ที่ยกเว้นได้ในเร็วๆ นี้ เป็นค่า ฟื้นฟูโล่พลังงาน ต่อวินาที)","( 能量護盾無法回復超過護甲。近期被防止擊中的 3% 物理傷害，以每秒回復為能量護盾 )","","","","","","","","","",""
261,"ReminderTextKeystoneSolipsism","(Intelligence provides no inherent bonus to Energy Shield. 2% reduced Duration of Elemental Ailments on you per 15 Intelligence)","(L'Intelligence n'octroie plus de bonus de Bouclier d'énergie inhérent. 2% de Réduction de la Durée des Altérations élémentaires vous affectant tous les 15 d'Intelligence)","(Intelligenz bietet keinen inhärenten Bonus auf den Energieschild. 2% verringerte Dauer von elementaren Beeinträchtigungen auf Euch pro 15 Intelligenz)","(Solipsism: 知性は本来のボーナスをエナジーシールドに与えなくなる。知性15毎に状態異常持続時間が2%減少)","(지능이 에너지 보호막에 직접적인 보너스를 주지 않습니다. 플레이어에게 적용되는 원소 상태 이상의 지속시간이 지능 15당 2% 감소합니다.)","(Inteligência não concede nenhum bônus inerente ao Escudo de Energia. 2% de redução da Duração de Afecções Elementais em você por cada 15 de Inteligência)","(Интеллект перестаёт усиливать энергетический щит. 2% уменьшение длительности стихийных состояний на вас за каждые 15 интеллекта)","(La inteligencia no otorga ninguna bonificación inherente de escudo de energía. Duración de los estados alterados elementales reducida un 2% sobre ti por cada 15 de inteligencia)","(Intelligence ไม่ให้โบนัสดั้งเดิมแก่ โล่พลังงาน และลดระยะเวลาของสถานะ เจ็บป่วยธาตุ ต่อตัวคุณ 2% ต่อ Intelligence 15 หน่วย)","( 智慧不提供固有的能量護盾加成。每 15 點智慧減少 2% 你身上元素異常狀態的持續時間 )","","","","","","","","","",""
262,"ReminderTextKeystoneVersatileCombatant","(-25% to maximum Chance to Block Attack Damage, -25% to maximum Chance to Block Spell Damage, +2% Chance to Block Spell Damage for each 1% Overcapped Chance to Block Attack Damage)","(-25% au maximum de chances de Bloquer les Dégâts des Attaques, -25% au maximum de chances de Bloquer les Dégâts des Sorts, +2% de chances de Bloquer les Dégâts des Sorts tous les 1% de chances excédentaires de Bloquer les Dégâts des Attaque)","(-25% zu maximaler Chance, Angriffsschaden zu blocken, -25% zu maximaler Chance, Zauberschaden zu blocken, +2% Chance, Zauberschaden zu blocken für jede 1% übergedeckelte Chance, Angriffsschaden zu blocken)","(Versatile Combatant: アタックダメージブロック率の最大値に-25%、スペルダメージブロック率の最大値に-25%、最大値を超えた分のアタックダメージブロック率1%ごとにスペルダメージブロック率を+2%)","(공격 피해 막기 확률 최대치 -25% 및 주문 피해 막기 확률 최대치 -25%를 부여합니다. 제한 초과 공격 피해 막기 확률 1%당 주문 피해 막기 확률 +2%를 부여합니다.)","(-25% do máximo de Chance de Bloquear Dano de Ataque, -25% do máximo de Chance de Bloquear Dano Mágico, +2% de Chance de Bloquear Dano Mágico para cada 1% de Chance de Bloquear o Dano de Ataques Excedente)","(-25% к максимальному шансу блока урона от атак, -25% к максимальному шансу блока урона от чар, +2% к шансу блока урона от чар за каждый 1% шанса блока урона от атак выше максимума)","(-25% a la probabilidad máxima de bloquear el daño de ataques y -25% a la probabilidad máxima de bloquear el daño de hechizos, +2% de probabilidad de bloquear el daño de hechizos por cada 1% de probabilidad excedente de bloquear el daño de ataques)","(มีโอกาสบล็อคความเสียหาย โจมตี สูงสุด -25%, มีโอกาสบล็อคความเสียหาย เวท -25%, มีโอกาสบล็อคความเสียหาย เวท +2% ต่อโอกาสบล็อคความเสียหาย โจมตี ที่เกินค่าบล็อคสูงสุด)","( -25% 最大攻擊傷害格擋率、-25% 最大法術傷害格擋率、每 1% 超過上限的攻擊傷害格擋率 +2% 法術傷害格擋率 )","","","","","","","","","",""
263,"ReminderTextKeystoneLetheShade","(Take 50% less Damage over Time if you've started taking Damage over Time in the past second. 100% more Duration of Ailments on you)","(50% de Perte des Dégâts sur la durée subis si vous avez commencé à prendre des Dégâts sur la durée au cours de la dernière seconde. 100% Davantage de Durée des Altérations vous affectant)","(Erleidet 50% weniger Schaden über Zeit, wenn Ihr in der letzten Sekunde aufgehört habt, Schaden über Zeit zu erleiden. 100% mehr Dauer von Beeinträchtigungen auf Euch)","(Lethe Shade: 過去1秒以内に継続ダメージを受け始めた場合、受ける継続ダメージが50%低下する。受ける状態異常の持続時間が100%上昇)","(지난 1초 내에 지속 피해를 받기 시작한 경우 지속 피해가 50% 감폭됩니다. 플레이어에게 적용된 상태 이상의 지속시간이 100% 증폭됩니다.)","(Sofre 50% menos Dano Degenerativo se você começou a sofrer Dano Degenerativo no último segundo. 100% mais Duração de Afecções em você)","(Вы получаете на 50% меньше постепенного урона, если начали получать постепенный урон в последнюю секунду. На 100% большая длительность состояний на вас)","(Recibes un 50% menos de daño degenerativo si has comenzado a recibir daño degenerativo en el último segundo. 100% más de duración de los estados alterados sobre ti)","(ได้รับความเสียหายต่อเนื่อง ลดลง อีก 50% หากคุณเริ่มได้รับความเสียหายต่อเนื่อง ในวินาทีที่ผ่านมา และเพิ่มระยะเวลาของสถานะ เจ็บป่วย ต่อตัวคุณ อีก 100%)","( 若你在過去 1 秒開始受到持續傷害，承受 50% 更少持續傷害。100% 更多你身上異常狀態的持續時間 )","","","","","","","","","",""
264,"ReminderTextUncappedBlockChance","(Uncapped Chance to Block is the value Chance to Block would have if ignoring Maximum Chance to Block)","(Vos chances de Bloquer totales correspondent à la valeur qu'auraient vos chances de Bloquer si elles ignoraient vos chances de Bloquer maximales)","(Die ungedeckelte Blockchance ist der Wert, den die Blockchance hätte, wenn die maximale Blockchance ignoriert würde)","(最大値に制限されないブロック率はブロック率の最大値を無視した場合のブロック率の値)","(\""비 제한 막기 확률\""은 막기 확률 최대치를 무시했을 때의 막기 확률 값입니다)","(Chance de Bloqueio Não Limitada é o valor que a Chance de Bloqueio teria se ignorasse o Máximo de Chance de Bloqueio)","(Не ограниченый шанс блока - полное значение шанса блока без учёта максимального предела)","(La probabilidad de bloquear sin limitar es el valor que tendría la probabilidad de bloquear si se ignorase la probabilidad de bloquear máxima)","(โอกาสบล็อครวมเกิน คือค่าของโอกาสบล็อคที่ควรจะมี หากไม่นำเอาค่าโอกาสบล็อคสูงสุดมาพิจารณา)","( 無上限格擋率是指若無視最大格擋率，格擋率可獲得的值 )","","","","","","","","","",""
265,"ReminderTextOvercappedBlockChance","(Overcapped Chance to Block is the amount by which Uncapped Chance to Block is higher than Maximum Chance to Block)","(La différence entre vos chances de Bloquer totales et vos chances de Bloquer maximales représente vos chances de Bloquer excédentaires)","(Die übergedeckelte Blockchance ist der Wert, um den die ungedeckelte Blockchance den Wert der maximalen Blockchance übersteigt)","(最大値を超えたブロック率は、無制限ブロック率が、最大ブロック率よりも高い場合の値)","(\""제한 초과 막기 확률\""은 비 제한 막기 확률에서 막기 확률 최대치를 뺀 값입니다)","(Chance de Bloqueio Excedente é a quantidade acima do Máximo de Chance de Bloqueio)","(Шанс блока выше максимума - величина, на которую не ограниченный шанс блока превышает максимальный шанс блока)","(La probabilidad de bloquear excedente es la cantidad por la cual la probabilidad de bloquear sin limitar es mayor que la probabilidad de bloquear máxima)","(โอกาสบล็อคที่เกินค่าบล็อคสูงสุด คือจำนวนที่ ค่าโอกาสบล็อครวมเกิน นั้นสูงกว่า ค่าโอกาสบล็อคสูงสุด)","( 超過上限的格擋率是指絕對格擋率高於最大格擋率的值 )","","","","","","","","","",""
