"rownum","Id","Text (English)","Text (French)","Text (German)","Text (Japanese)","Text (Korean)","Text (Portuguese)","Text (Russian)","Text (Spanish)","Text (Thai)","Text (Traditional Chinese)","TextHardmode (English)","TextHardmode (French)","TextHardmode (German)","TextHardmode (Japanese)","TextHardmode (Korean)","TextHardmode (Portuguese)","TextHardmode (Russian)","TextHardmode (Spanish)","TextHardmode (Thai)","TextHardmode (Traditional Chinese)"
0,"ReminderTextAddedPassivesNoOtherJewels","(Added Passive Skills are never considered to be in Radius by other Jewels)","(Les Talents passifs ajoutés ne peuvent jamais être comptés comme étant dans le Rayon d'autres Joyaux)","(Hinzugefügte passive Fertigkeiten fallen nicht in den Radius von anderen Juwelen)","(追加されたパッシブスキルは他のジュエルの範囲内にあるとみなされることはない)","(추가된 패시브 스킬은 다른 주얼의 반경 내에 있는 것으로 간주되지 않습니다)","(Habilidades Passivas Adicionadas nunca são consideradas como estando no Raio por outras Joias)","(Добавленные пассивные умения никогда не будут считаться находящимися в радиусе других самоцветов)","(Las habilidades pasivas agregadas nunca se consideran dentro del radio de otras joyas)","(พาสซีฟที่เพิ่มเข้ามาจะไม่นับว่าอยู่ในรัศมีของจิวเวลเม็ดอื่นๆ)","( 附加的天賦點不會被其它珠寶視為範圍內 )","","","","","","","","","",""
1,"ReminderTextAddedPassivesSmallDefault","(All Added Passive Skills are Small unless otherwise specified)","(Sauf indication contraire, tous les Talents passifs ajoutés sont des Talents mineurs)","(Alle hinzugefügten passiven Fertigkeiten sind klein, sofern nicht anders angegeben)","(追加されるパッシブスキルは別途明記されない限り通常パッシブである)","(추가된 모든 패시브 스킬은 따로 언급이 없을 시 소형으로 취급합니다)","(Todas as Habilidades Passivas Adicionadas são Pequenas a menos que o contrário seja especificado)","(Все добавленные пассивные умения считаются малыми, если не оговорено иное)","(Todas las habilidades pasivas agregadas son pequeñas a menos que se especifique lo contrario)","(พาสซีฟที่เพิ่มเข้ามานับว่าเป็น พาสซีฟเล็ก เว้นแต่จะระบุไว้เป็นขนาดอื่น)","( 所有附加的天賦點都為小型，除非有特條件 )","","","","","","","","","",""
2,"ReminderTextShortestPathToClassStart","(Always counts the shortest possible path)","(Prends toujours en compte le chemin le plus court)","(Es wird immer der kürzeste Weg gezählt)","(常に最も短い経路で計算する)","(항상 가능한 한 최단 경로를 산출합니다)","(Sempre conta o caminho mais curto possível)","(Всегда рассчитывается кратчайший из доступных путей)","(Siempre se cuenta el camino más corto posible)","(นับจากเส้นทางที่สั้นที่สุดเท่านั้น)","( 必定計算最短路徑 )","","","","","","","","","",""
3,"ReminderTextFeedingFrenzy","(Feeding Frenzy grants 10% more Minion Damage, 10% increased Minion Movement Speed and 10% increased Minion Attack and Cast Speed)","(Frénésie dévorante octroie 10% Davantage de Dégâts des Créatures, 15% d'Augmentation de la Vitesse de déplacement des Créatures et 15% d'Augmentation de la Vitesse d'attaque et d'incantation des Créatures)","(Fressrausch gewährt 10% mehr Kreaturenschaden, 10% erhöhte Kreaturen-Bewegungsgeschwindigkeit und 10% erhöhte Kreaturenangriffs- und -zaubergeschwindigkeit)","(feeding frenzy: 暴食はミニオンのダメージ10%上昇、ミニオンの移動スピード10%増加、そしてミニオンのアタック及びキャストスピード10%増加を与える)","(\""격분 주입\""은 소환수 피해 10% 증폭, 소환수 이동 속도 10% 증가, 소환수 공격 속도 및 시전 속도 10% 증가를 부여합니다.)","(Frenesi Faminto concede 10% mais Dano de Lacaios, Velocidade de Movimento dos Lacaios aumentada em 10% e Velocidade de Ataque e Conjuração dos Lacaios aumentada em 10%)","(Голодное остервенение дарует на 10% больше урона приспешникам, 10% повышение скорости передвижения приспешников и 10% повышение скорости атаки и сотворения чар приспешниками)","(Frenesí voraz otorga un 10% más de daño de esbirros, velocidad de movimiento de esbirros aumentada un 10% y velocidades de ataque y de lanzamiento de hechizos de esbirros aumentadas en un 10%)","(สถานะ รุมเขมือบ เพิ่มความเสียหายของ มิเนียน อีก 10%, เพิ่มความเร็วในการเคลื่อนที่, โจมตี, ร่ายของ มิเนียน 10%)","( 豢養狂熱給予 10% 更多召喚物傷害、增加 10% 召喚物移動速度和增加 10% 召喚物攻擊和施放速度 )","","","","","","","","","",""
4,"ReminderTextOverpowered","(Overpowered can be applied any number of times)","(Le Débordement peut être appliqué plus d'une fois)","(Überwältigung kann beliebige Male angewendet werden)","(Overpowered: オーバーパワーは何回でも付与できる)","(\""압도\""는 횟수에 상관없이 적용 가능합니다)","(Subjugado pode ser aplicado qualquer quantidade de vezes)","(Притеснение можно наложить неограниченное количество раз)","(Subyugado se puede aplicar cualquier cantidad de veces)","(สถานะ สะเทือนโล่ สามารถทำให้เกิดซ้อนกันกี่ครั้งก็ได้)","( 壓制可以被作用很多次 )","","","","","","","","","",""
5,"ReminderTextImpale","(When an Impaled enemy is hit, the Impale reflects 10% of the physical damage of the Impaling hit to that enemy. Impale lasts for 5 hits or 8 seconds)","(Lorsqu'un Ennemi Empalé est Touché, 10% des Dégâts physiques qui ont appliqué l'Empalement lui sont renvoyés. L'Empalement prend fin après 8 secondes, ou après avoir renvoyé des Dégâts à 5 reprises.)","(Wenn ein aufgespießter Gegner getroffen wird, reflektiert das Aufspießen 10% des physischen Schadens des aufspießenden Treffers auf diesen Gegner. Aufspießen dauert 5 Treffer oder 8 Sekunden an)","(Impale: 串刺された敵がヒットを受けた際、串刺しは串刺しを与えたヒットの物理ダメージの10%を敵に反射する。串刺しは5ヒットまたは8秒間持続する)","(\""꿰뚫린\"" 적이 피격당하면, 꿰뚫림이 적용되었던 타격의 물리 피해량의 10%가 적에게 반사됩니다. 꿰뚫림은 5회 피격될 동안 또는 8초 동안 유지됩니다)","(Quando um inimigo Empalado é acertado, o Empalamento reflete 10% do dano físico do acerto Empalador ao inimigo. Emapalar dura 5 acertos ou 8 segundos)","(Когда враг с наложенным на него Проколом получает удар, Прокол отражает 10% от физического урона прокалывающего удара этому же врагу. Эффект Прокола длится 5 ударов или 8 секунд.)","(Cuando un enemigo empalado es golpeado, el empalamiento refleja un 10% del daño físico del golpe empalador a ese enemigo. Empalar dura 5 golpes o 8 segundos)","(เมื่อศัตรูที่ติดสถานะ ทิ่มแทง ถูกปะทะอีกครั้ง มันจะได้รับความเสียหาย สะท้อน 10% ของความเสียหาย กายภาพ ที่สร้างสถานะนี้ สถานะนี้รับการปะทะได้ 5 ครั้งแต่คงอยู่ไม่เกิน 8 วินาที)","( 當被穿刺的敵人被擊中，穿刺會反射 10% 穿刺之擊所造成的物理傷害至敵人。穿刺持續 5 次擊中 )","","","","","","","","","",""
6,"ReminderTextConsecutive","(These are consecutive)","(Ces effets sont consécutifs)","(Diese sind konsekutiv)","(これらの効果は連続して起きる)","(지속 효과)","(consecutivamente)","(Действуют последовательно)","(Estas son consecutivas)","(สิ่งเหล่านี้เกิดขึ้นอย่างต่อเนื่อง)","( 這是連續的 )","","","","","","","","","",""
7,"ReminderTextCounterAttack","(Attacks that Trigger when you are Hit are Counterattacks)","(Les Contre-attaques sont des Attaques qui se Déclenchent lorsque vous êtes Touché)","(Angriffe, die durch erlittenen Treffer ausgelöst werden, sind Gegenangriffe)","(Counter attack: 攻撃を受けたときにトリガーされる攻撃はカウンターである)","(\""반격\""은 피격당할 때 발동하는 공격입니다)","(Ataques Ativados quando você é Atingido são Contra-Ataques)","(Контратаками считаются атаки, которые используются при ударе по вам)","(Los ataques que se activan cuando te golpean son contraataques)","(การโจมตีที่ทริกเกอร์เมื่อคุณถูกปะทะคือ การโจมตีสวนกลับ)","( 你被擊中時觸發的攻擊為反擊 )","","","","","","","","","",""
8,"ReminderTextUnaffectedBy","(Debuffs you are Unaffected by can still be placed on you, but will not actually apply their effect)","(Les Effets néfastes auxquels vous êtes Insensible peuvent s'appliquer à vous, mais vous n'en subirez pas les effets)","(Schwächungen, die Euch nicht beeinträchtigen, können trotzdem auf Euch angewendet werden, auch wenn sie keine Wirkung haben)","(Unaffected: 影響を受けない場合でも、デバフがかけられるが、それによる効果は表れない)","(플레이어에게 효과가 없는 \""디버프\""는, 유지는 되겠지만 실제로 적용되지는 않습니다)","(Penalidades pelas quais você não está afetado ainda podem ser colocadas em você, mas não surtirão efeito)","(Отрицательные эффекты, не имеющие воздействия, все ещё будут накладываться на вас, но их эффект не будет действовать)","(Las penalidades que no te afectan pueden aplicarse sobre ti de todos modos, pero sus efectos no se aplicarán)","(ดีบัฟที่ไม่มีผลต่อคุณจะยังเกิดขึ้นบนตัวคุณได้ แต่จะไม่มีผลเท่านั้นเอง)","( 對你沒影響的減益效果仍可以放置你身上，但不會發揮效果 )","","","","","","","","","",""
9,"ReminderTextElementalConflux","(While you have Elemental Conflux, all Damage from Hits will cause Chill, Shock, and Ignite)","(Tant que vous avez Conflux élémentaire, vous Refroidissez, Électrocutez et Embrasez au Toucher)","(Solange Ihr über Elementarkonfluenz verfügt, führt jeder Schaden durch Treffer zur Entzündung, Unterkühlung und Schock)","(Elemental Conflux: エレメンタルコンフラックスの時、ヒットによる全てのダメージは冷却、感電、そして発火を引き起こす)","(\""원소 융합\"" 상태일 때, 명중으로 주는 모든 피해가 냉각, 감전, 점화를 유발합니다)","(Enquanto você estiver com Confluência Elemental, todo Dano de Acertos Resfriará, Eletrizará e Incendiará)","(Во время действия эффекта Слияния стихий, весь урон от ударов будет охлаждать, накладывать шок и поджигать)","(Mientras tengas Confluencia elemental, todo el daño de los golpes aplicará escarchamiento, electrocución y quemadura)","(ขณะที่มีสถานะ ธาตุบรรจบ, ความเสียหาย ปะทะ ทุกชนิด จะสร้างสถานะ หนาวเย็น, ช็อค, ลุกไหม้)","( 當你有元素匯流時，你所有擊中造成的傷害皆能造成感電、冰緩，和點燃 )","","","","","","","","","",""
10,"ReminderTextSavageHit","(A Hit that removes at least 15% of Maximum Life is a Savage Hit)","(Un Coup brutal est un coup qui retire au moins 15% de la Vie maximale)","(Ein Treffer, der mindestens 15% des maximalen Lebens vertilgt, ist ein schwerer Treffer)","(Savage hit: 最大ライフの15%以上のダメージを与えるヒットをサベージヒットと呼ぶ)","(한 번의 피격으로 최대 체력의 15% 이상이 사라지는 공격이 \""야만적인 타격\""입니다)","(Um Acerto que remove ao menos 15% da Vida Máxima é um Golpe Bestial)","(Удар, отнимающий не менее 15% от максимума здоровья, считается Жестоким ударом)","(Un golpe salvaje es un golpe que quita al menos un 15% de la vida máxima)","(การปะทะที่กำจัดพลังชีวิตมากกว่า 15% ถือว่าเป็น การปะทะที่ร้ายแรง)","( 當一個一次性的擊中傷害使目標失去 15% 最大生命以上的傷害時，該傷害視為殘暴之擊 )","","","","","","","","","",""
11,"ReminderTextOnslaught","(Onslaught grants 20% increased Attack, Cast, and Movement Speed)","(Assaut octroie 20% d'Augmentation de Vitesse d'attaque, d'incantation et de déplacement)","(Ansturm gewährt 20% erhöhte Angriffs-, Zauber- und Bewegungsgeschwindigkeit)","(Onslaught: 猛攻はアタックスピード、キャストスピード、移動スピードを20%増加させる)","(\""맹공\""은 공격, 시전, 이동 속도를 20% 증가시킵니다)","(Agressividade concede um aumento de 20% das Velocidades de Ataque, Conjuração e Movimento)","(Боевой раж дарует 20% повышение скорости атаки, сотворения чар и передвижения)","(Fervor otorga un 20% de aumento a las velocidades de ataque, de lanzamiento de hechizos y de movimiento)","(เร่งราวี เพิ่มความเร็วในการโจมตี, ร่าย, เคลื่อนที่ 20%)","( 猛攻增加你 20% 攻擊速度、施放速度，和移動速度 )","(Onslaught grants 20% increased Attack and Cast Speed)","(Assaut octroie 20% d'Augmentation de Vitesse d'attaque et d'incantation)","(Ansturm gewährt 20% erhöhte Angriffs- und Zaubergeschwindigkeit)","(猛攻はアタックスピードおよびキャストスピードを20%増加させる)","(\""맹공\""은 공격 및 시전 속도를 20% 증가시킵니다.)","(Agressividade concede Velocidade de Ataque e Conjuração aumentados em 20%)","(Боевой раж дарует 20% повышение скорости атаки и сотворения чар)","(Fervor otorga un 20% de aumento a las velocidades de ataque y de lanzamiento de hechizos)","(เร่งราวี เพิ่มความเร็วในการโจมตีและร่าย 20%)","( 猛攻增加你 20% 攻擊速度和施放速度 )"
12,"ReminderTextPoison","(Poison deals Chaos Damage over time, based on the base Physical and Chaos Damage of the Skill. Multiple instances of Poison stack)","(Le Poison inflige des Dégâts de chaos sur la durée, en fonction des Dégâts physiques et des Dégâts de chaos de l'Aptitude. Le Poison est cumulable.)","(Gift verursacht Chaosschaden über Zeit, basierend auf dem gesamten physischen Schaden und Chaosschaden der Fertigkeit. Mehrere Instanzen von Gift werden gestapelt)","(Poison: 毒は、スキルの基礎物理ダメージと基礎混沌ダメージに基づいて混沌継続ダメージを与える。複数インスタンスの毒がスタックできる)","(\""중독\""은 지속 카오스 피해를 가하며, 피해량은 해당 스킬의 기본 물리 및 카오스 피해에 의해 결정됩니다. 중독은 다회 적용될 시에 중첩됩니다.)","(Veneno causa Dano Degenerativo de Caos baseado no Dano base Físico e de Caos da Habilidade. Múltiplas instâncias de Veneno acumulam)","(Яд наносит постепенный урон хаосом, основанный на сумме базового физического урона и урона хаосом от удара. Урон от нескольких зарядов яда складывается)","(El veneno inflige daño de caos degenerativo en función del daño físico y de caos base de la habilidad. El veneno es acumulativo)","(พิษ สร้างความเสียหาย เคออส ต่อเนื่อง ตามความเสียหาย กายภาพและเคออส พื้นฐาน ของสกิล โดยพิษสามารถซ้อนทับเพิ่มเติมได้)","( 中毒造成持續性混沌傷害，傷害取決於初始的物理和混沌傷害總和。中毒效果可以疊加 )","","","","","","","","","",""
13,"ReminderTextBleeding","(Bleeding deals Physical Damage over time, based on the base Physical Damage of the Skill. Damage is higher while moving)","(Le Saignement inflige des Dégâts physiques sur la durée, en fonction des Dégâts physiques de l'Aptitude. Les Dégâts sont plus importants lorsque la victime se déplace)","(Bluten verursacht physischen Schaden über Zeit, basierend auf dem physischen Schaden der Fertigkeit. Der Schaden ist bei Bewegung höher)","(Bleed: 出血は物理継続ダメージを与える。ダメージはスキルの基礎物理ダメージに基づく。移動中はダメージが上がる)","(\""출혈\""은 지속 물리 피해를 주며, 피해량은 해당 스킬의 기본 물리 피해에 의해 결정됩니다. 출혈 피해는 이동할 때 더 높아집니다)","(Sangramento causa Dano Degenerativo Físico baseado no Dano Físico base da Habilidade. O Dano é maior enquanto em movimento)","(Кровотечение наносит постепенный физический урон, основанный на базовом физическом уроне от удара. Во время перемещения урон выше)","(El sangrado inflige daño físico degenerativo en función del daño físico base de la habilidad. El daño es mayor si estás en movimiento)","(เลือดออก สร้างความเสียหาย กายภาพ ต่อเนื่อง ตามความเสียหาย กายภาพ พื้นฐาน ของสกิล โดยความเสียหายจะสูงขึ้นเมื่อเคลื่อนที่)","( 流血造成持續性物理傷害，傷害取決於初始的物理傷害。移動時受到的流血傷害增加 )","","","","","","","","","",""
14,"ReminderTextCullingStrike","(Culling Strike means enemies that are on 10% or lower life after your Hit are Killed)","(Coup de grâce vous permet de tuer instantanément les ennemis que vous Touchez s'il leur reste 10% de Vie ou moins).","(Todesstoß tötet Gegner, die nach einem Treffer 10% oder weniger Leben haben)","(Culling Strike: カリングストライクのヒット後、ライフが10%以下の敵は倒される)","(\""마무리 타격\""은 플레이어에게 피격되어 10% 이하의 생명력이 남은 적을 처치하는 것을 의미합니다)","(Golpe Abatedor significa que inimigos que estiverem com 10% ou menos de vida Morrem depois que você os Acertar)","(Добивание означает, что враги с 10% здоровья или ниже умирают после вашего удара)","(Golpe de gracia significa que los enemigos que estén a un 10% o menos de vida después de que los golpees, mueren)","(จู่โจมปลิดชีพ แปลว่าศัตรูที่มี พลังชีวิต 10% หรือต่ำกว่า หลังจากได้รับการปะทะจากคุณ จะถูกสังหารโดยทันที)","( 對生命等於或少於 10% 最大生命的敵人可以造成撲殺，敵人將直接死亡 )","","","","","","","","","",""
15,"ReminderTextPhasing","(While you have Phasing, your movement is not blocked by Enemies)","(Le Déphasage vous permet de traverser les ennemis en vous déplaçant)","(In der Schemenform kann Eure Bewegung nicht von Gegnern geblockt werden)","(Phasing: 透明化中は、敵により移動を阻害されない)","(\""차원 능력\"" 상태에서는 적에 의해 이동이 가로막히지 않습니다)","(Enquanto Trespassando, seu movimento não é bloqueado por Inimigos)","(В форме призрака ваше передвижение не блокируется врагами)","(Cuando tienes Traspasar, los enemigos no pueden bloquear tu movimiento)","(ขณะที่มีสถานะ ทะลุมิติ คุณสามารถเคลื่อนที่ผ่านศัตรูได้โดยที่ไม่ถูกขัดขวาง)","( 當你進入迷蹤狀態時，你將不會被敵人所阻擋 )","","","","","","","","","",""
16,"ReminderTextBlind","(Being Blinded causes 20% less Accuracy Rating and Evasion Rating, for 4 seconds)","(Étre Aveuglé fait subir 20% de Perte de Score de Précision et d'Évasion pendant 4 secondes)","(Geblendet sein bewirkt 20% weniger Treffgenauigkeit und Ausweichwert, für 4 Sekunden)","(Blind: 盲目は、命中率と回避力を20%低下させる。持続時間は4秒)","(실명은 4초 동안 정확도와 회피를 20% 감폭시킵니다.)","(Estar Cego causa perda de 20% menos Precisão e Evasão, por 4 segundos)","(Ослепление даёт на 20% меньше меткости и уклонения на 4 секунды)","(La ceguera otorga un 20% menos de precisión y de evasión, durante 4 segundos)","(สถานะ ตาบอด ลดอัตราความแม่นยำและอัตราการหลบหลีก อีก 20% 4 วินาที)","( 被致盲有20%更少命中率和閃避值，持續4秒 )","","","","","","","","","",""
17,"ReminderTextMaim","(Maimed enemies have 30% reduced Movement Speed)","(Les ennemis Mutilés ont 30% de Réduction de Vitesse de déplacement)","(Verstümmelte Gegner haben 30% verringerte Bewegungsgeschwindigkeit)","(Maim: 重傷の敵は移動スピードが30%減少する)","(\""힘줄 절단\""된 적은 이동 속도가 30% 감소합니다)","(Inimigos Mutilados têm 30% da Velocidade de Movimento reduzida)","(У изувеченных врагов скорость передвижения снижена на 30%)","(Los enemigos lisiados tienen la velocidad de movimiento reducida un 30%)","(ศัตรูที่ ขาหัก มีความเร็วในการเคลื่อนที่ ลดลง 30%)","( 被癱瘓的敵人減少 30% 移動速度 )","","","","","","","","","",""
18,"ReminderTextFortification","(Take 1% less Damage from Hits per Fortification. Maximum 20 Fortification. Fortification lasts 6 seconds)","(Le Renforcement dure 6 secondes et octroie 1% de Perte de Dégâts au Toucher subis par cumul de Renforcement. Le Renforcement se cumule jusqu'à 20 fois)","(Erleidet 1% weniger Schaden von Treffern pro Verstärkung. Maximal 20 Verstärkung. Verstärkung hält 6 Sekunden an)","(Fortify: 堅牢化1につき、ヒットから受けるダメージ1%が低下する。堅牢化の最大数は20で、持続時間は6秒間)","(피격 시 받는 피해가 방어 상승 1당 1% 감폭됩니다. 방어 상승은 최대 20까지 중첩되며 6초 지속됩니다.)","(Sofre 1% menos Dano de Acertos por Fortificação. Máximo de 20 Fortificações. Fortificação dura 6 segundos)","(На 1% меньше получаемого урона от ударов за каждый заряд Укрепления. Максимум 20 Укрепления. Укрепление длится 6 секунд)","(Recibes un 1% menos de daño de los golpes por cada Fortificación. El máximo de Fortificación es 20. Fortificación dura 6 segundos)","(ลดความเสียหาย ปะทะ ที่ได้รับ อีก 1% ต่อจำนวนสถานะ การตั้งมั่น, สถานะ การตั้งมั่น มีจำนวนสูงสุด 20 ระดับ, สถานะ การตั้งมั่น คงอยู่ 6 วินาที)","( 每 1 層護體承受 1% 更少擊中傷害。最大 20 層護體。護體持續 5 秒)","","","","","","","","","",""
