"rownum","Id","i32","Text"
1534,"UniqueHelmetStrInt13",58898,"Our flesh is our most sacred gift.\r\nTaint it not with the occult.\r\n\r\n<default>{This item can be transformed on the Altar of Sacrifice along with Vial of Summoning}"
1535,"UniqueHelmetStrInt14",46063,"From the flesh of the gods, Xibaqua was born.\r\nFrom the carnage of Xibaqua, we were born.\r\nIt is our duty to return to the gods what was once theirs."
1536,"UniqueShieldInt11",11334,"The heart grows slow,\r\nthe spirit grows strong.\r\n\r\n<default>{This item can be transformed on the Altar of Sacrifice along with Vial of Awakening}"
1537,"UniqueShieldInt12",50102,"Give him your body, and your burdens will follow."
1538,"UniqueBodyStrDexInt2",59258,"Destined for sacrifice,\r\nthey were dressed in garments\r\nthat blurred the lines between this world\r\nand the next."
1539,"UniqueAmulet48",29677,"The seed of life, saved and savoured.\r\n\r\n<default>{This item can be transformed on the Altar of Sacrifice along with Vial of Sacrifice}"
1540,"UniqueAmulet49",1820,"We are incapable of change without sacrifice, for we are both the iron and the forge."
1541,"UniqueJewel116",17827,"We are born raw and untested, and we are shaped by life.\r\n\r\n<default>{This item can be transformed on the Altar of Sacrifice along with Vial of Transcendence}"
1542,"UniqueJewel117",41442,"Though the body rots, the spirit lives on.\r\n\r\n<default>{This item can be transformed on the Altar of Sacrifice along with Vial of Transcendence}"
1543,"UniqueJewel118",43025,"Any thought, no matter how fleeting, changes the thinker.\r\n\r\n<default>{This item can be transformed on the Altar of Sacrifice along with Vial of Transcendence}"
1544,"UniqueJewel119",44881,"We are as much shaped by what we do\r\nas what is done to us."
1545,"UniqueJewel120",40122,"Take comfort knowing that, even in death,\r\nwe may serve our Queen and fuel her empire."
1546,"UniqueJewel121",34510,"A keen mind sees what others do not,\r\nmakes connections where others do not, \r\nand is dangerous in a way that others are not."
1547,"UniqueFlask25",13973,"Freedom is for the privileged, even in death.\r\n\r\n<default>{This item can be transformed on the Altar of Sacrifice along with Vial of the Ghost}"
1548,"UniqueFlask26",19137,"\""What care have I for their pain? They're already dead.\""\r\n- Atalui, Vaal Priestess"
1549,"UniqueBelt29",48246,"For the Vaal, the relationship between slave and master\r\nwas as intimate and volatile as that of lovers."
1550,"UniqueBootsDexInt8",61993,"Facing their death,\r\nthe mind of a sacrifice\r\nretreats into instinct and madness.\r\n\r\n<default>{This item can be transformed on the Altar of Sacrifice along with Vial of the Ritual}"
1551,"UniqueBootsDexInt8Royale",15055,"Facing their death,\r\nthe mind of a sacrifice\r\nretreats into instinct and madness."
1552,"UniqueBootsDexInt9",13009,"Only a fool seeks meaning\r\nin a life so fleeting."
1553,"UniqueBelt30",41212,"As a gift or as punishment,\r\nthe Empire will have your blood.\r\n\r\n<default>{This item can be transformed on the Altar of Sacrifice along with Vial of Consequence}"
1554,"UniqueBelt31",57846,"Death is your most important duty.\r\nFace it, or curse your bloodline for all eternity."
1555,"UniqueOneHandSword29",6173,"Through war we found peace. Through death we found advancement.\r\nOur ancestors did not know where their actions would take them.\r\nAre we any better?\r\n\r\n<default>{This item can be transformed on the Altar of Sacrifice along with Vial of Fate}"
1556,"UniqueOneHandSword30",22135,"Doryani promises immortality, yet we build great structures, \r\ncarve magnificent works into stone, so a part of us lives onward.\r\nA sign of faithlessness through action."
1557,"UniqueTwoHandAxe16",6493,"War is a thriving infection.\r\nIt numbs the heart and eats away at the soul\r\nuntil only emptiness remains."
1558,"UniqueSceptre19",17891,"There the weary multitude of man-kind \r\nshall turn in their masses into the wide fire, \r\nwhere the destroying flame embraces the living, \r\nsome will go up, some down, filled with misery."
1559,"UniqueSceptre19x",52539,"\""Lord of Bone, Lord of Flesh, yet all that we can\r\nmaster turns to ash.\"" \r\n- Researcher Arn"
1560,"UniqueShieldDexInt5",10292,"\""Great minds wish to reveal all the secrets of time and space.\r\nBut it does not matter. Creation, the act of Matter Metamorphosis, \r\nis the only secret worth discovering.\"" \r\n- Zeel, Vaal Tinkerer"
1561,"UniqueShieldStrInt12",5887,"An Emperor must conquer his own darkness\r\nbefore he can act as a beacon of light."
1562,"UniqueJewel122",64258,"Kaom watched the torches patrol the top of the Watch. \r\nHe observed the lay of the beach, its barricades and rocks, \r\nand his men in their canoes, ready to lay their lives down for him.\r\nBut when his foot hit the sand, he thought only of the fight."
1563,"UniqueJewel123",20616,"Standing behind iron bars,\r\nDaresso thought of his adoring fans cheering his name, \r\nhis wife's warm embrace waiting for him, \r\nand of the celebrations that would soon be thrown in his name.\r\nBut when the arena gate lifted, he thought only of the fight."
1564,"UniqueJewel124",50099,"Voll stood at the gates of Sarn, and a nation stood behind him. \r\nHe thought of the righteousness of his cause, \r\nand of the glory he would bring to the empire he would soon lead. \r\nBut as Chitus and his gemlings advanced, he thought only of the fight."
1565,"UniqueAmulet50",29713,"\""No man, before or since,\r\nhas climbed to such lofty heights\r\nor fallen so far.\""\r\n- Voll, Emperor of Purity"
1566,"UniqueJewel125",24192,"\""I don't know how I know, \r\nI just know that I know.\"""
1567,"UniqueHelmetStrDex7",23407,"When you're on the run,\r\nlook only to yourself for survival."
1568,"UniqueGlovesInt10",60476,"Xibaqua's treachery was met with divine fury.\r\nOne by one, the gods reclaimed their flesh,\r\nuntil all that remained was a droplet of pure light:\r\nThe first Vaal."
1569,"UniqueRing52",16960,"So great was the thaumaturgy of a bloodpriest's mark,\r\nthat sacrifices soon welcomed their death."
1570,"UniqueStaff23",21783,"Death is but the start of your servitude."
1571,"UniqueGlovesStrInt8",16523,"We serve only the Night."
1572,"UniqueStaff24",27789,"There was never a simpler time.\r\nJust simpler motivations."
1573,"UniqueAmulet51",57776,"The leash of the lifegiver\r\nbinds in both directions."
1574,"UniqueGlovesInt9",57915,"\""One coy look. One blown kiss. One word spoken.\r\nOne night I wish I'd forget.\"""
1575,"UniqueAmulet52",16870,"He was a lot luckier before he lost this."
1576,"UniqueShieldInt13",21022,"The empire is both the tree and the fruit.\r\nIt provides safe harbour as ideas grow within,\r\nand when the time is right, the apple is picked. \r\nThe idea, and our ideals, take root."
1577,"UniqueHelmetDexInt11",34003,"Sing with me one last duet,\r\nthe curtain closes nigh.\r\nJoin me in a quiet song,\r\nBefore we all must die."
1578,"UniqueSceptre20",49019,"The greatest of guardians make the greatest of sacrifices."
1579,"UniqueHelmetInt17",21203,"\""Feel the pain of ancient wounds.\r\nFeel the doom of dying souls.\"""
1580,"UniqueHelmetStrInt15",54899,"You will know if your subjects follow you from fear\r\nor respect when you have your first moment of weakness.\r\nIf it's the former, they will tear you into pieces like rabid dogs."
1581,"UniqueAmulet53",26944,"It was not his fearlessness or ferocity, nor his tactical genius,\r\nit was his leadership that earned Aul, the Last King, his crown."
1582,"UniqueRing53a",35629,"Fleeing the destruction set upon her home,\r\nthe Clayshaper sought safety in the clouds of ash above.\r\n\r\n<default>{This item can be combined with a Meadow and Valley ring at a Vendor.}"
1583,"UniqueRing53b",20905,"Where once had stood a village, lay naught but splinters.\r\nSome had once been her home. \r\nSome had once been her creations.\r\nSome had once been her family.\r\n\r\n<default>{This item can be combined with a Mountain and Valley ring at a Vendor.}"
1584,"UniqueRing53c",11038,"The river, once fertile and fresh, \r\nand flowing briskly to the sea,\r\nnow stood, stained, at a standstill.\r\nDammed by the coagulating dead.\r\n\r\n<default>{This item can be combined with a Meadow and Mountain ring at a Vendor.}"
1585,"UniqueRing53d",17593,"The narrow path turned to rough rocks that led towards the sky.\r\nOne last obstacle in a life-long journey\r\nto find a land they could call home.\r\n\r\n<default>{This item can be combined with a Meadow and Valley ring at a Vendor.}"
1586,"UniqueRing53e",59387,"Cold winds blasted what little grew on the icy surface.\r\nThe gifts of the land lay hidden deeper,\r\nand only patience and persistence would free them.\r\n\r\n<default>{This item can be combined with a Mountain and Valley ring at a Vendor.}"
1587,"UniqueRing53f",22647,"Sheltered beneath thick ice,\r\nthe river ferried fat fish towards the sea.\r\nBut the First King knew the river's secret,\r\nand the fish were not the only ones who grew fat.\r\n\r\n<default>{This item can be combined with a Meadow and Mountain ring at a Vendor.}"
1588,"UniqueRing53g",50873,"He surveyed his lands, green and vital,\r\nwatched with pride as his slaves quarried fine stone for his fortress,\r\nand thanked the heavens for his many blessings.\r\nBut this pilgrimage to the peak was to be his last.\r\n\r\n<default>{This item can be combined with a Meadow and Valley ring at a Vendor.}"
1589,"UniqueRing53h",59684,"The fields were silent but for the plucking of fruits,\r\nthe rustling of leaves, and the breaking of stone.\r\nNo slave dared to speak or look the passing king in the eye.\r\nNo one... except Aul.\r\n\r\n<default>{This item can be combined with a Mountain and Valley ring at a Vendor.}"
1590,"UniqueRing53i",23496,"With no stone for rebuilding, each storm took its toll on the village.\r\nHuts eventually collapsed, their occupants injured or dead.\r\nBodies were left by the river, to appease the gods.\r\nBut the dead would not remain there.\r\n\r\n<default>{This item can be combined with a Meadow and Mountain ring at a Vendor.}"
1591,"UniqueRing54",23274,"History teaches humility."
1592,"UniqueJewel127",48015,"In the weeks that followed the Cataclysm,\r\nthe dead began to rot and fester.\r\nThe air fouled with such concentration,\r\nthat passing birds drowned in flight."
1593,"UniqueShieldInt14",54539,"Though we live and act as individuals,\r\nin truth, we are tethered together. \r\nThe barriers that divide us need not be broken \r\nfor our spirits to become entangled."
1594,"UniqueAmulet54",36162,"Time, like light, can be refracted into all its myriad colours.\r\nThe first shade is beautiful, but the last will drive the unwary insane."
1595,"UniqueBow22",26776,"\""There were no survivors. It had only been fired twice.\""\r\n- Order of the Djinn inscription"
1596,"UniqueRing55",60892,"\""Fusing the parasite with another ring has manifested unpredictable effects.\r\nI theorise the sacrificial vessel's level of anguish is a key variable.\""\r\n- Arzaak, Syndicate Researcher"
1597,"UniqueFlask27",61418,"A controlled burn is sometimes necessary for new life."
1598,"UniqueGlovesStrDex11",42128,"Open the way to new and dangerous lands."
1599,"UniqueGlovesStrDex12_",53658,"Is it better to find new lands - or to create them?"
1600,"UniqueHelmetInt18",47027,"See the land as it is."
1601,"UniqueHelmetInt19a",23145,"See creation as it was, aflame and frantic."
1602,"UniqueHelmetInt19b",7942,"See creation as it will be, frozen and silent."
1603,"UniqueHelmetInt19c",31681,"See creation as it is, energetic and storming."
1604,"UniqueBodyDexInt11",1854,"There can be no defence against the celestial siblings entropy and time."
1605,"UniqueBodyDexInt11x",24536,"\""The form of this replica came to me in a troubled dream.\r\nI do not believe we should ever allow it to be used.\""\r\n- Researcher Arn"
1606,"UniqueRapier6",59126,"What has no siblings but is always a twin?"
1607,"UniqueRapier6x",64037,"\""This is one riddle I can't solve.\"" \r\n- Researcher Graven"
1608,"UniqueBelt32",23436,"Cold winds whirl at the crown of the world."
1609,"UniqueBodyInt18",37280,"In their crimson nightmare, the Vaal are still sacrificing themselves to her glory and beauty. \r\nThey stab their own hearts and cry out in ecstasy, only to rise again."
1610,"UniqueHelmetInt20",27479,"The spirit hungers for the flesh."
1611,"UniqueSceptre21",30866,"The vastness of the cosmos holds energies beyond comprehension,\r\nshould one have the fortitude to grasp them."
1612,"UniqueSceptre21x",6561,"\""We could rival the gods with this power, if only we had the mitigating mechanisms\r\nto make it work. A jewel, a talisman, an armour... or the Font...\"""
1613,"UniqueFlask28",27869,"A tourniquet for the soul, squeezing ethereal into physical."
1614,"UniqueGlovesStrInt9",37253,"\""You covet the strength of your peers, mortal?\r\nPerhaps it can be yours, if you are willing to make an offering of their blood...\""\r\n- Vaal Myth of the Third Snake"
1615,"UniqueBodyInt19",53537,"Exceptional men and women of strong will can flicker a spark, \r\nbut something much greater is needed to unleash the wildfire of true divine flames."
1616,"UniqueGlovesDexInt13",45725,"The power of lightning is a power best shared."
1617,"UniqueHelmetStrInt16",41792,"The judge determines worthiness by comparison to the paragon: himself."
1618,"UniqueRing56",3981,"I condemned an innocent man to the pyres, but to admit this mistake is to condemn myself.\r\nMy only choice is to strive harder."
1619,"UniqueRing57",60519,"My subordinates circled me eternally, attuned to the slightest weakness,\r\nready to tear me apart for their own gains."
1620,"UniqueRing58",40556,"I sacrificed a life of love for one of responsibility, so that she,\r\nand others like her, might be kept safe."
1621,"UniqueRing59",19904,"I was a happy child, before the cruel truth was revealed to me.\r\nI fight so that the children may remain ignorant."
1622,"UniqueRing60",3550,"I feel the moral weight of what I must do to protect Wraeclast.\r\nI accept my guilt without shame. It is my gift to humanity."
1623,"UniqueAmulet55",48217,"Strike true, strike hard, and leave no survivors to retaliate."
1624,"UniqueAmulet55x",4967,"\""The type Delta test subjects could have escaped with the power offered by\r\nPrototype #15, but they suddenly chose to murder each other instead...\"""
1625,"UniqueShieldDexInt6",58840,"Something within the machine never stops moving,\r\nbut Oriathan scholars dare not open it to find out why."
1626,"UniqueBootsStrInt6",23347,"When the time comes to face evil, the faithful are never alone."
1627,"UniqueQuiver15",33510,"Midnight tinkering begets midday murdering;\r\na sinister shaft surreptitiously shot slays a scoundrel.\r\nI will see them again, but not until my work is done."
1628,"UniqueQuiver15x",27341,"\""The Midnight Tinkerer's aid was invaluable during our brief alliance,\r\nbut when we failed to make any progress on resurrection, he continued his search elsewhere...\"""
1629,"UniqueGlovesDexInt14",35962,"The Black Sekhema's trial had only just begun."
1630,"UniqueHelmetDemigods1",44728,"The champion's name echoes through time, \r\ndrowning out the whispers of the defeated."
1631,"UniqueHelmetInt21",26086,"Young Napuatzi was thrown into the pits, an unwilling sacrifice, \r\nbut the offer of her blood was refused. \r\nShe rose from the pit alive and anew.  \r\nA Leader. A Conquerer. A Viper."
1632,"UniqueAmulet56",1382,"\""Hyrri and her arrows broke the sacred code, damning herself. \r\nKaom seized her sacrifice, and in doing so, seized victory.\"" \r\n- Lavianga, Advisor to Kaom"
1633,"UniqueHelmetDexInt12",2398,"\""The more the warrior understood Tangmazu's gift, the less the mask aided him.\r\nHis dreams were filled with divine laughter.\""\r\n- Tenth Song of the Islands"
1634,"UniqueHelmetInt22",18130,"The Light drove the darkness from our lands and from our hearts."
1635,"UniqueSceptre22",16857,"A secret few among the Templars grant absolution by bearing the guilt of others."
1636,"UniqueJewel128",39075,"They believed themselves the pinnacle of civilisation, but that height toppled their empire."
1637,"UniqueJewel129",46561,"They believed themselves the greatest warriors, but that savagery turned upon their own."
1638,"UniqueJewel130",45402,"They believed themselves the most ordered, but that tradition turned their forests to salt."
1639,"UniqueJewel131",36763,"They believed themselves the utmost faithful, but that conviction became oppression."
1640,"UniqueJewel132",29374,"They believed themselves better than the past, but that confidence brought about nightmare."
1641,"UniqueJewel133",56675,"The enslaved Ezomyte clans were not permitted to own weapons.\r\nFor years, they trained in secret, watching and waiting for the\r\nperfect moment to reveal the true depth of the Empire's folly."
1642,"UniqueGlovesExpedition1",40480,"Those heroes that set foot on Wraeclast found\r\nthemselves changing, only subtly at first..."
1643,"UniqueGlovesExpedition2",48556,"For forty-two nights, the Feller of Heroes challenged\r\nthe next greatest warrior to a one-on-one duel.\r\nNone could match his might."
1644,"UniqueBootsExpedition1",59394,"In their hour of desperate need, the Knights of the Sun\r\ncalled out for aid... and the Black Scythe answered."
1645,"UniqueBootsExpedition2",14209,"Where others would retreat when vulnerable,\r\nOlroth the Gallant fought deeper into battle."
1646,"UniqueHelmetExpedition1",23668,"The priests of the Kalguur worshipped knowledge, not gods."
1647,"UniqueHelmetExpedition2",63979,"Cadigan the Third ruled dispassionately\r\nthrough the iron might of artifice."
1648,"UniqueFlask29",5984,"Olroth the Gallant,\r\ntireless and true,\r\nhe fights for me,\r\nhe fights for you!"
1649,"UniqueFlask30",49801,"Uhtred and his priests drank of the skies\r\nto empower runes... and themselves.\r\n"
1650,"UniqueFlask31_",31646,"Nothing endures. All things end.\r\nThen, they begin again."
1651,"UniqueFlask32",43152,"Vorana trained her mercenaries\r\nthus: strike true and survive."
1652,"IncursionVialTrap",38560,"Blood, slaves and stone.\r\nThe timeless edifice of Dominance."
1653,"IncursionVialHealing",39047,"Call to place the demon gods of the past."
1654,"IncursionVialPoison",8264,"The eyes of Apep flicker open and the Poisoned One stirs."
1655,"IncursionVialLightning",42231,"The ritual creates order. \r\nBoth in the minds of men and gods. \r\nThe ritual creates order."
1656,"IncursionVialFire",62449,"Ancient myths of flame, frost and thunder.\r\nWill we ever know the way forward?"
1657,"IncursionVialMinion",2241,"Your actions live but a moment;\r\ntheir repercussions never die."
1658,"IncursionVialBossFlask",35194,"With great tragedy and power,\r\nthe dead are netted in anguish."
1659,"IncursionVialBossJewel",26291,"It is not our flesh, our thoughts, or our soul that limits us;\r\nit is the distinction between them."
1660,"IncursionVialBossAmulet",43908,"Festivities of blood. Bleeding hearts and screaming lungs."
1661,"ScarabBreach1",13223,"The Ember-dwellers sought to throw you to their volcanic god, young Omid,\r\nbut we caught you instead. The Order of the Djinn is your tribe now."
1662,"ScarabBreach2",13085,"We task you, honoured Omid, with the investigation of this mysterious\r\n'Xoph' and artefacts related to rifts in the boundaries of our world."
1663,"ScarabBreach3",19684,"Omid, Master Researcher, has left a final commandment upon his death:\r\nthe world must never know."
1664,"ScarabBreach4",6654,"The Master Researcher's final commandment has failed.\r\nThe High Templar has seen the truth of our situation,\r\nand the world will be undone by his fear."
1665,"ScarabMaps1",47293,"Consider yourself an orphaned Eternal no longer, young Betucia.\r\nThe Order of the Djinn is your family now."
1666,"ScarabMaps2",61491,"For your loyalty and valour, honoured Betucia, we are proud to put\r\nthe requisition of dream-artefacts in your capable hands."
1667,"ScarabMaps3",22104,"Betucia, Bearer of the Sealing Blade, the Order of the Djinn survives\r\nbecause of your sacrifice, but will be forever wounded by your loss."
1668,"ScarabMaps4",15237,"The Sealing Blade has been removed, and the agent of Decay\r\nshall feed upon this world until nothing remains but dust."
1669,"ScarabUniques1",21386,"The Maraketh left you to die alone in the desert, young Sumei, but we\r\nsaw the potential in you. The Order of the Djinn is your akhara now."
1670,"ScarabUniques2",6365,"As the best of our lorekeepers, honoured Sumei, it is now your task\r\nto investigate the mysterious duplication of artefacts of power."
1671,"ScarabUniques3",7891,"Go to your rest now, Sumei, Master Lorekeeper. The Order shall keep\r\ncontained the terrible secret that burdened your final years."
1672,"ScarabUniques4",25240,"The books were burned, and the scribes set themselves aflame.\r\nWhat secret so terrible could they have discovered?\r\nThough centuries have passed, we must investigate this for ourselves."
1673,"ScarabBeasts1",61327,"Feuding Ezomytes slaughtered your kin, young Agnar, but we pulled you\r\nfrom the flames. The Order of the Djinn is your clan now."
1674,"ScarabBeasts2",2729,"None among us understand the beasts of this world better than you,\r\nhonoured Agnar. You will root out the mysteries of wild-artefacts."
1675,"ScarabBeasts3",34038,"The Order was your clan in life, Agnar, Beastmaster, but the First Ones call\r\nback their favoured son. The gift of their Visions will pass to another."
1676,"ScarabBeasts4",10963,"Without an experienced Beastmaster to find them new realms,\r\nthe First Ones' ravaging hunt brings them ever closer to Wraeclast."
1677,"ScarabBeasts4a",46550,"Without an experienced Beastmaster to find them new realms,\r\nthe First Ones' ravaging hunt brings them ever closer to Wraeclast."
1678,"ScarabBeasts4b",345,"Without an experienced Beastmaster to find them new realms,\r\nthe First Ones' ravaging hunt brings them ever closer to Wraeclast."
1679,"ScarabBeasts4c",16020,"Without an experienced Beastmaster to find them new realms,\r\nthe First Ones' ravaging hunt brings them ever closer to Wraeclast."
1680,"ScarabBeasts4d",40223,"Without an experienced Beastmaster to find them new realms,\r\nthe First Ones' ravaging hunt brings them ever closer to Wraeclast."
1681,"ScarabShaperRares1",50731,"The Peak-dwellers saw you as impure, young Qianga, but the Order of\r\nthe Djinn sees you as all the stronger for your uniqueness."
1682,"ScarabShaperRares2",16721,"Bold dreamer, Qianga of the Stars, she of the Celestial Cold! These titles\r\nwe bestow upon the one among us whose soul speaks to the ineffable."
1683,"ScarabShaperRares3",2825,"Qianga of the Stars, Deliverer of the Sealing Blade to the Watchers, go now, and\r\nlet your half-dreamt life be troubled by nightmares of achromic hunger no more."
1684,"ScarabShaperRares4",55217,"The Watchers have gone silent, yet they scream still.\r\nSomething lurks among the stars of our dreams, knocking at the door,\r\nwhispering with the voices of long lost friends..."
1685,"ScarabElderRares1_",41471,"Your visions led the Azmeri down into a world left abandoned by the Vaal.\r\nThey cast you out, young Egrin, but the Order of the Djinn accepts you."
1686,"ScarabElderRares2_",8701,"Speaker of unclean truths, Egrin of the Dark Between Stars.\r\nWe curse you whose soul echoes the madness of the void!"
1687,"ScarabElderRares3",15411,"Egrin of the Dark Between Stars, Forger of the Sealing Blade,\r\nlet your name be redeemed by your unexpected sacrifice."
1688,"ScarabElderRares4",55023,"We are all equally fools for our childish notions.\r\nThat dread force Decay cannot be defeated by self-sacrifice."
1689,"ScarabSulphite1",45622,"As the first Brinerot to join the Order, you have much to prove,\r\nyoung Raethan. We are confident you will succeed."
1690,"ScarabSulphite2",47441,"For harnessing and controlling the power of lightning, you, Raethan,\r\nare now charged with researching this new energy."
1691,"ScarabSulphite3",41731,"Let him not be called Raethan the Betrayer. His discovery was too important\r\nto keep locked away. Now, for good or ill, it is in civilisation's hands."
1692,"ScarabSulphite4",34574,"Madness marches in machine form.\r\nHarnessed lightning, grim faces, and cold ambition abounds.\r\nCivilisation will be its own undoing."
1693,"ScarabDivinationCards1",44847,"You were a casualty of callous Karui warfare, ageless Narumoa, but the Order\r\nmended your wounds. You are bound to us now by your own code."
1694,"ScarabDivinationCards2",49602,"Though your peers fear you, Narumoa, the elders have decided that your\r\nsecond sight is ideal for handling all artefacts that seek to subvert Fate."
1695,"ScarabDivinationCards3",48581,"Your centuries of service have been invaluable to us, Narumoa. Go now,\r\nreturn to Hinekora, and join your ancient kin in the halls of the dead."
1696,"ScarabDivinationCards4",55612,"Hinekora has sent the world another herald, but this hatungo walks another path.\r\nWe are left blinded, and subject to the vagaries of Fate."
1697,"ScarabTorment1",31371,"Young Tsarsk, you were a broken and forgotten child lying glassy-eyed\r\nin a flesh-pit in Trarthus, but the Order found and cleansed you."
1698,"ScarabTorment2",8521,"Your tortured soul long kept you isolated from your peers, Tsarsk, but has attracted\r\nnew kindred in kind. You are tasked with appeasing these anguished spirits."
1699,"ScarabTorment3",6143,"Though you were swallowed by your own darkness, you saved countless others\r\nfrom eternal misery, young Tsarsk. You were not nothing, as you feared."
1700,"ScarabTorment4",36283,"Without a speaker of the dead, the countless anguished spirits only grow in number.\r\nThey have no voice, and no hope. The sun darkens with each passing year."
