"rownum","Id","i32","Text"
0,"KeybladeText",28812,"Forged from thousands of unclaimed Beta keys"
1,"UniqueTwoHandAxe1",63457,"One by one, Kaom slaughtered the weakest tribe\r\nleaders until the others leapt to join his cause."
2,"UniqueOneHandSword1",55516,"As battle calms, blood turns to rust."
3,"UniqueAmulet1",34681,"You are slow, foolish and ignorant.\r\nI am not."
4,"UniqueRing1",65486,"Fear is highly infectious."
5,"UniqueRing2",28070,"A token from the sea\r\nA sign for Kaom\r\nto lead his Karui to Wraeclast."
6,"UniqueRing3",49827,"Danger is the price of wealth."
7,"UniqueBow1",32612,"\""See without doubt, slay without hesitation.\""\r\n- Marceus Lioneye of Sarn"
8,"UniqueAmulet2",55138,"The maidens of court swoon to see\r\nthe challengers crushed at your feet."
9,"UniqueBodyStrInt1",64924,"Although a great leader during the war,\r\nVoll proved disastrous in times of peace."
10,"UniqueDagger1",44922,"Divine intervention feels better\r\nwhen you do it yourself."
11,"UniqueBow2",33951,"\""The wild takes care of its own.\""\r\n- Hyrri of the Karui"
12,"UniqueOneHandSword2",35385,"In the rift between future and past,\r\nlife passes quickly."
13,"UniqueHelmetDexInt1",37403,"It was a sliver of Malachai's soul\r\nthat animated the first Eternal Guardian."
14,"UniqueHelmetStr1",60659,"Centuries of servitude, a day\r\nof glory, an eternity of death."
15,"UniqueBow3",47824,"The mournful music of the strings,\r\nThe creaking arch, the arrow sings.\r\nA choking cry, a rattled breath,\r\nThe Reaper's Song, the Harp of Death."
16,"UniqueStaff1",33121,"Burn to cinders, scar and maim,\r\nRule a world, bathed in flame."
17,"UniqueTwoHandMace1",1531,"\""The crack of bone, the spray of blood.\r\nIs there sweeter music?\""\r\n- Hrimnor of the Ezomytes."
18,"UniqueTwoHandMace2",41704,"\""One quick tap is all the persuasion you'll need.\""\r\n- Archbishop Geofri of Phrecia Cathedral"
19,"UniqueTwoHandSword1",27030,"\""Today, clansmen, my sword is my voice!\""\r\n- Rigwald, at the Battle of Glarryn"
20,"UniqueTwoHandSword2",35895,"Stoic visage, icy heart.\r\nLife of sorrow, lived apart."
21,"UniqueRing4",47327,"Where her mouth should have been\r\nthere was only a whirling, black void."
22,"UniqueRing4x",30722,"\""Prototype #8 makes it difficult to think negatively, but two fatalities\r\nresulted when a lead researcher used an epithet in its presence.\"""
23,"UniqueRing5",62611,"Doryani stumbled into a realm of madness\r\nAnd awoke its Master."
24,"UniqueQuiver1",60380,"Molten feathers, veiled spark,\r\nHissing arrows from the dark."
25,"UniqueQuiver2",17809,"Seeing only foot soldiers, the Sarn Knights cast aside\r\ntheir heavy shields... and paid dearly for their mistake."
26,"UniqueAmulet3",3906,"The breath of life is yours to give."
27,"UniqueAmulet5",6897,"\""Shoot first, ask no questions.\""\r\n- Karui wisdom"
28,"UniqueAmulet5x",23563,"\""In testing, Prototype #9 had no effect on fired arrows. However,\r\nan unknown spell did destroy the entire firing chamber.\"""
29,"UniqueAmulet6",53094,"Never blinking, always watching.\r\n\r\n<default>{This item can be transformed with a Blessing of Chayula}"
30,"UniqueBodyDex1",65142,"Hyrri loosed a barrage of arrows,\r\ntipped with a poisoned hatred\r\nonly oppression can ferment."
31,"UniqueBodyStr1",61508,"The warrior who\r\nfears will fall."
32,"UniqueBodyStr1x",49278,"\""Useless for our purposes, but perhaps we can sell Prototype #5\r\nto an archmage to fund other experiments.\"""
33,"UniqueDexHelmet1",47690,"Fairgraves' trusty tricorne accompanied him far across\r\nthe seas, deep under the ground, and even beyond death."
34,"UniqueDexHelmet2",36784,"Give of your heated passions.\r\nGive of your cold resolve.\r\nYou will be repaid."
35,"UniqueIntHelmet1",5018,"Lift it lightly, don it slow.\r\nThe spikes point out and in, you know."
36,"UniqueIntHelmet2",56458,"Asenath's mind was as quick and nimble\r\nas the fingers that drew her bowstring."
37,"UniqueIntHelmet3",18994,"\""It takes true strength to hold power,\r\nand my grip grows tighter by the day.\""\r\n - Emperor Chitus"
38,"UniqueStrHelmet2",53874,"Hrimnor's presence was as cold as ice,\r\nbut his heart burned for vengeance."
39,"UniqueStrDexHelmet1",41767,"We wander to pass time.\r\nWe travel to fulfill."
40,"UniqueHelmetStrInt1",34109,"\""The craven mind is sharp with self interest.\r\nThe honourable mind is much easier to manipulate.\""\r\n - Malachai the Soulless"
41,"UniqueHelmetStrInt2",23991,"In the battle for honour, Geofri won.\r\nNot so, the battle for survival."
42,"UniqueAmulet4",19103,"It is said to make you invisible when the Great\r\nSpirit comes to take you on your final journey."
43,"UniqueBootsInt1",21057,"Wonders abound at death's door."
44,"UniqueDagger2",64498,"A mighty beast, a lavish feast."
45,"UniqueBootsStrDex1",60090,"Stand and lead the righteous pride,\r\nFight till death, never hide."
46,"UniqueBootsStrDex1x",29092,"\""Twelve dead, and the seventh lab cannot be entered for several years.\r\nPrototype #12 is a 'success,' if we can ever reach it.\"""
47,"UniqueBootsStrInt1",48313,"Tempest's power given form,\r\nFlee before the walking storm."
48,"UniqueBootsInt2",33086,"All the world is my home."
49,"UniqueBootsInt3",35340,"Shavronne raced to Brutus' side,\r\nher last hope against the Karui tide."
50,"UniqueBootsDexInt1",27963,"Blazing body, shining bold.\r\nDance beneath the orb of gold!"
51,"UniqueBootsStr1",15639,"The mocking wind, a shielding spell,\r\nThe haunting screams, a maddening hell."
52,"UniqueGlovesDex1",43965,"Of ancient giants, none remain,\r\nTheir only trace is timeless pain."
53,"UniqueGlovesDex2",17141,"Maligaro operated effortlessly,\r\nwith great speed and terrible consequences."
54,"UniqueGlovesStrDex1",22727,"A soft caress in dead of night,\r\nthat slips about the neck, so tight."
55,"UniqueGlovesStrDex2",64162,"Wealth is not to be borne lightly."
56,"UniqueGlovesInt1",3472,"Wealth unspent is wealth wasted."
57,"UniqueGlovesInt2",45361,"While Doedre lacked Maligaro's sense of style,\r\nshe surpassed her master in pure malevolence."
58,"UniqueGlovesDexInt1",38027,"A single lightning strike fells a man.\r\nA single knife stroke fells an empire."
59,"UniqueGlovesStr1",1020,"Why cling to your sanity? It offers you nothing.\r\nSurrender to me, and I will grant you everything."
60,"UniqueAmulet7",62882,"The light that reveals is the glare that blinds."
61,"UniqueAmulet8",44377,"Mindless rage will shake the world,\r\nCunning lies will bend it.\r\nReckless haste will break the world,\r\nAnd into darkness send it."
62,"UniqueBelt1",54755,"They say a lifetime of wisdom is carried\r\nin every skin the great beasts shed."
63,"UniqueBelt2",20027,"Few men cast a longer shadow\r\n than the Great Meginord of the North."
64,"UniqueBelt3",48116,"A large enough debt turns even a friend\r\ninto an enemy, and the Perandus family\r\nhad more debtors than anyone."
65,"UniqueBelt4",53105,"Kaom's strength was rivaled only by\r\nthe great Meginord of the north."
66,"UniqueShieldStrDex1",64059,"By tourney's end, Daresso bled and shivered.\r\nYet even accursed treachery failed to steal the champion's victory."
67,"UniqueShieldInt1",13627,"The Vaal emptied their slaves of beating hearts,\r\nand left a mountain of twitching dead."
68,"UniqueShieldDex1",64040,"Cold, miserable and alone... but alive."
69,"UniqueShieldDex2",30765,"\""With piety and justice.\""\r\n- Perandus family motto"
70,"UniqueShieldStr1",56658,"Marceus' unblemished shield is a testament\r\nto his arrogance... and his fate."
71,"UniqueTwoHandAce2",25361,"Accept your fate, or lie, pretend.\r\nDeath collects you in the end."
72,"UniqueTwoHandSword3",6138,"His final sensation was of the executioner's blade.\r\nIt was not cold, instead warm and reassuring,\r\nmurmuring a promise of better times ahead.\r\nSmiling, he returned death's embrace."
73,"UniqueRapier1",3540,"She paints her offer in wicked hues\r\nAn off-white grin, an elegant bruise.\r\nTo the nascent scourge she sings the ruse:\r\n\""With me in hand, what else need you use?\"""
74,"UniqueBodyStrInt2",9550,"Nothing stops the pain like a courageous rush into battle."
75,"UniqueBodyStrInt2x",52089,"\""Prototype #7 achieved even greater injury responsiveness than expected,\r\nthough at considerable cost to the long-term survival rate of the user.\"""
76,"UniqueShieldStrInt1",46505,"A swift mind solves problems before they occur."
77,"UniqueHelmetInt4",16022,"The malice in her gaze froze blood and shattered bone."
78,"UniqueWand1",40818,"Cast into darkness\r\nAnd trapped for a thousand years,\r\nThe lonely moon weeps"
79,"UniqueMap1",56241,"\""Should I depart this mortal coil,\r\nso shall all of my treasures.\""\r\n- Atziri, Queen of the Vaal"
80,"UniqueHelmetStrDex2",13836,"Swift as thought are the actions of Man \r\nwhen borne on wings of divine providence."
81,"UniqueShieldStrInt2",9503,"When blood is paid, the weak think twice."
82,"UniqueShieldStrInt3",4325,"From death springs life."
83,"UniqueTwoHandMace3",9032,"Lumbering as a sea lion, clumsy as a berry-drunk pigeon. That was Erqi. \r\nIt mattered little. When Erqi's maul fell true, so did its target."
84,"UniqueAmulet9",38807,"Forged from the blood of countless wars, \r\nits thirst has only begun."
85,"UniqueGlovesStr2",20971,"Ride with pride,\r\nstrike with vengeance,\r\nlive with honour."
86,"UniqueGlovesDexInt2",25943,"Fly like a Storm Crow, crush like a Rhoa"
87,"UniqueBootsDex1",7444,"Do not let them step on your feet. Keep them at bay."
88,"UniqueDagger3",41951,"Unwieldy and garish became graceful\r\nand deadly in Ungil's nimble hands."
89,"UniqueDagger3x",44076,"\""Recommend further production of Prototype #122. It makes\r\nan ideal weapon for our suppression troops and guards.\"""
90,"UniqueBootsDex2",36374,"The wyrm draws warmth from the fires of desire."
91,"UniqueBootsInt4",23221,"The dead man walks where\r\nthe living fear to tread."
92,"UniqueBootsInt4x",43877,"\""Outpost Twelve has been abandoned. On the bright side, I expect the plague of apparitions\r\nto serve as ample defence for the relics we left behind.\"" \r\n- Administrator Qotra"
93,"UniqueOneHandMace1",18427,"\""I know how to say 'faster' and 'attack'\r\nin Karui, Marak and Ezo.\""\r\n- Voll of Thebrus"
94,"UniqueBodyInt1",30680,"Shavronne's apparel became ever more extravagant\r\nas her body and soul became ever more corrupted."
95,"UniqueBow4",29432,"\""The rain of a thousand quills that whittle\r\npresent into past, life into death.\""\r\n- Rigwald of the Ezomytes"
96,"UniqueBow4x",37153,"\""How did you manage to lodge arrows in every single test subject\r\nand researcher in Lab Three simultaneously?\"" \r\n- Doctor Bircus"
97,"UniqueBow5",45238,"\""The Spirit of War knows nothing of good and evil.\r\nIt knows only destruction.\""\r\n- Sekhema Asenath"
98,"UniqueTwoHandAxe3",5370,"Swinging through the air, it sings\r\nof sundered, severed, missing things."
99,"UniqueTwoHandMace4",21218,"Cursed is the star whence it came."
100,"UniqueWand2",16747,"A chilling hush, a scraping sound\r\nOf things no more entombed in ground.\r\nA shambling horde is on its way\r\nTo crush the very light of day."
101,"UniqueWand2x",40312,"\""Simply incredible. I caught an escaping test subject myself with\r\nswarms of burning skulls. Delightful!\"" \r\n- Researcher Olesya"
102,"UniqueBow6",15594,"As a soldier you want to get close to enemy archers.\r\nThat is not the case when fighting the Maraketh."
103,"UniqueBootsDex3",20512,"Alive but not unscathed, Victario fled\r\nas slaughter blossomed at the gates."
104,"UniqueBodyStr2",33894,"It is safer to be feared than to be loved."
105,"UniqueBodyDex2",22735,"I'm hiding, yet everyone knows where I am."
106,"UniqueBodyDex3",38780,"The blasted oak stands forever."
107,"UniqueBodyInt2",30677,"He who sows an ember shall reap an inferno."
108,"UniqueBow7",2659,"Mark us with mercy, then press on with care,\r\nExecute us steadily, notch away at our despair."
109,"UniqueBow7x",59440,"\""How did you manage to lodge arrows in every single test subject\r\nand researcher in Lab Three simultaneously... again?\"" \r\n- Doctor Bircus"
110,"UniqueClaw1",40666,"The darkest clouds clashed and coupled,\r\ngiving birth to four lightning children of hate."
111,"UniqueShieldStr2",25522,"A mighty bulwark, curved and strong\r\nA dauntless wall, against the throng\r\nAll lance and arrow, knocked aside\r\nFor rout of foe, for turn of tide."
112,"QuestGlyph1",14377,"Its corrugated surface brings a strange tingle\r\nto the fingertips. This is no mere decoration."
113,"QuestGlyph2",44832,"When put to the ear it whispers not of\r\nthe sea, but long dead incantations."
114,"QuestGlyph3",13108,"Its pleasing sheen remains even in shadow,\r\nas if it were somehow lit from within."
115,"QuestAllflame",44065,"Distilled from naked ambition and unfettered obsession,\r\nthe Allflame emanates a silvern warmth like no other, \r\nand engulfs those moths fool enough to embrace it."
116,"QuestMedicineChest",32439,"Doctor \""Shaky Hands\"" Opden travelled with only the\r\nfinest medicines and antidotes... and a curiously\r\ngenerous supply of opiates."
117,"QuestPoisonSpear",32006,"Maligaro loved his tools, and took great\r\npains to keep them excruciatingly sharp."
118,"QuestPoisonGem",61677,"The withering glare of corruption, made\r\ncorporeal and pellucid in crystal."
119,"QuestRibbonSpool",28470,"Machinery makes the minions.\r\nMinions make the master."
120,"QuestThaumeticSulphite",10436,"Essence of pure thaumaturgy.\r\nApply with trepidation."
121,"QuestTolmanBracelet",51032,"A craftswoman's ode to\r\nfresh hope, a new love."
122,"QuestIntAmulet",38611,"Segregated by treachery, this artefact\r\nlongs to be reunited with her sisters."
123,"QuestDexAmulet",20017,"While this artefact resonates with power,\r\nit is simply a piece in a larger puzzle."
124,"QuestStrAmulet",32537,"A relic of a sundered relationship,\r\nit awaits reconciliation with its kin."
125,"QuestCombinedAmulet",51391,"Though its power has been shared, there\r\nis still more the Apex might unlock."
126,"QuestGoldenHand",34703,"An open palm raised in peace,\r\ncut down by the slaves of war."
127,"QuestInfernalTalc",8381,"\""A Virtue Gem is a raging thunderstorm imprisoned within a single raindrop.\r\nInfernal Talc simply lets the storm out.\"" - Malachai the Soulless"
128,"QuestSewerKeys",50984,"To enter a city's bowels is to be\r\nprivy to its best-kept secrets. "
129,"QuestTowerKey",28720,"God will only offer the door.\r\nMan must choose whether to open it."
130,"QuestBust1",18249,"The Emperor honours Hector Titucius as Supreme Servant.\r\n\""Strength in purpose is strength in deed.\"""
131,"QuestBust2",54906,"The Emperor honours Gaius Sentari as Supreme Servant.\r\n\""A man's thoughts are his shackles. A man's thoughts are his wings.\"""
132,"QuestBust3",44822,"The Emperor honours Marceus Lioneye as Supreme Servant.\r\n\""The road to Glory is paved with Sacrifice.\"""
133,"UniqueBodyDex4",17632,"To catch an animal, think like an animal."
134,"UniqueStaff2",60488,"Shed by the winged beast of night,\r\nA scaly frost-encrusted thorn.\r\nAll who feel its wintry light\r\nShiver in pain at the frozen dawn."
135,"UniqueHelmetDex3",31810,"No metal slips as easily through the fingers as gold."
136,"UniqueShieldStrInt4",37488,"Born from the marriage of ice and sky,\r\nthe aurora evokes both awe and power."
137,"UniqueSceptre1",35171,"Knowledge brings power, and with power you can\r\ngrab truth by the throat and shape it as you wish."
138,"UniqueBodyInt3",42591,"My Soul is your Strength\r\nMy Price is your Blood"
139,"UniqueBodyInt4",27888,"Despair hums, softly, deadly, in the bones of my enemies. \r\nEyes will burn, and souls wither, as they bask in my radiance."
140,"UniqueClaw2",26157,"Fear blisters the heart and thins the blood.\r\nFear squeezes lungs and sets the guts to fester.\r\nFear is the wound left untended."
141,"UniqueTwoHandSword4",12481,"The nobles wanted to take her throne.\r\nShe let the peasants take their wealth.\r\nThe peasants wanted to take her wealth.\r\nShe let the soldiers take their heads.\r\nThe soldiers wanted to take her head.\r\nShe sat on her throne and wept."
142,"UniqueShieldDex3",48621,"\""As long as I see death in my mirror, so will Wraeclast.\""\r\n- Atziri, Queen of the Vaal"
143,"UniqueTwoHandAxe4",40725,"To cease the flow of blood is to \r\nchoke the rain in the very clouds.\r\nBoth life and land feel the thirst."
144,"UniqueBow8",36727,"Centuries of development in steel armoursmithing\r\nturned the armies of the Eternal Empire\r\ninto very effective lightning rods."
145,"UniqueHelmetWreath1",2536,"To stand triumphant you must serve\r\nno master other than your own ambition."
146,"UniqueShieldInt2",51102,"You carried me through life,\r\nThe least I can do is carry you through death."
147,"UniqueDagger4",60245,"A heart can be stabbed by thoughts, \r\nIf your mind is sharp enough."
148,"UniqueDagger4x",22617,"\""There is something incredibly satisfying about impaling test\r\nsubjects with Ethereal Knives. Perhaps it is the sound -\r\nthe spell, the screams, or both.\""  - Researcher Olesya"
149,"UniqueMap2",37779,"Whispers from a world apart\r\nSpeak my name beyond the tomb;\r\nBound within the Maelström's heart,\r\nWill they grant me strength or doom?"
150,"UniqueBodyDexInt1",29601,"\""...The discomfort shown by the others is amusing, but none\r\ncan deny that my work has made quite the splash...\""\r\n- Maligaro's Journal"
151,"UniqueRing6",45109,"Existence is infinite\r\nA weave of the living and dead\r\nBeyond the understanding\r\nOf the many mortal threads"
152,"UniqueShieldStr3",13842,"Fire dances with those who doubt\r\nLicks the skin and flesh from the fearful\r\nWhere there is no fear\r\nThere is no flame"
153,"UniqueMap3",9859,"For his sins he was hunted in his sleep,\r\njudgement wrought of twisted nightmare.\r\nThe Coward bound his dreams to stone, awaiting\r\nanother to walk the path of true atonement."
154,"UniqueSceptre2",35432,"Left in her tomb by the lynch mob, \r\nthe flame inside still blazed bright after her death, \r\nand so did hers."
155,"QuestPage1",63557,"\""The Vaal were even more steeped in gem culture than \r\nour Emperor and his 'Gemlings'. It's an obsession \r\nas old as civilisation itself.\""\r\n- Icius Perandus"
156,"QuestPage2",57726,"\""A communion... but with what? By all accounts, \r\nit wasn't God that the Vaal were trying to reach.\""\r\n- Icius Perandus "
157,"QuestPage3",9341,"\""A waking Nightmare. \r\nMadness of the mind? \r\nOr madness of the flesh?\""\r\n- Icius Perandus "
158,"QuestPage4",12886,"\""Siosa, your Slavery will cause them to overlook you. \r\nYour Karui Way will guide you. \r\nYour Humanity will shame us all.\""\r\n- Icius Perandus "
159,"UniqueMap4",5194,"Curious, she shook it then,\r\nAnd tiny screams emerged.\r\nCuriouser, she shook again,\r\nAnd an eerie silence purred."
160,"UniqueHelmetDex4",18041,"There was no hero made out of Starkonja's death,\r\nbut merely a long sleep made eternal."
161,"QuestDecanter",59560,"\""Man is blinded by the mud of his corporeal self. Only\r\nthrough the transformation of the material into the\r\nspiritual can we hope to taste the full body of life.\""\r\n- Malachai the Soulless"
162,"QuestPlum",58804,"As succulent as blood, as sweet as power."
163,"QuestSpikeKey",19035,"A sigil of thaumaturgy graven in granite."
164,"UniqueClaw3",44995,"\""For the life of the flesh will always be in the blood.\""\r\n- Atalui, Vaal Priestess"
165,"UniqueTwoHandMace5",57016,"The faithful may continue to serve, even after death."
166,"UniqueHelmetDex5",41988,"Nature respects the strong\r\nAnd paints the snow red\r\nWith the blood of the weak"
167,"UniqueHelmetDex5x",4654,"\""Test subject walked right through the poison gas defenses, and attempts to slow her\r\nfailed. Suppression troop six, the 'Furious Flagellants,' have been sent to intervene.\"""
168,"UniqueShieldStrInt5",25712,"My bearer shall be guarded by flame,\r\nfor I am the phoenix, forever radiant in glory."
169,"UniqueBodyInt5",55682,"The night of a thousand ribbons\r\nTo remember the day of a thousand flames\r\nWhen Sarn burned\r\nAnd was born again"
170,"UniqueBodyDex5",33816,"Forget your kite shield. Just put the biggest man\r\n in the field between you and the archers."
171,"UniqueBootsInt5",56155,"\""They say that you should take life's troubles in your stride.\r\nSome men have a longer stride than others.\""\r\n- Gaius Sentari"
172,"UniqueBootsStrDex2",12713,"\""Sirrius flew on wings of light, faster than wind, faster\r\nthan thought. But try as he might to outrun the darkness,\r\nit was there, at every turn, waiting for him.\""\r\n- Azmerian legend"
173,"UniqueStaff3",8311,"Forged to rule the waves and tide\r\nDestined to serve the monkey's paw\r\nStrong as a tower of iron\r\nDeft as the needle doubt"
174,"UniqueBodyStrInt3",45873,"When Solaris closes her burning eye\r\nAt the end of time,\r\nthe world will perish in ice."
175,"UniqueBodyInt7",27849,"The greatest mistakes cause suffering \r\nlong after they have been made"
176,"UniqueGlovesStrDex3",15059,"One warrior, any armour."
177,"UniqueGlovesInt3",42063,"Cool the head and cool the blade."
178,"UniqueGlovesInt4",31221,"\""You shall hang, in blissful agony, on my every note.\""\r\n- Kalisa, Prima Donna of Sarn"
179,"UniqueGlovesInt4x",21949,"\""Our superiors were getting anxious for results, and lowered security standards.\r\nA single attempt of a spell with this unexpected power destroyed an entire floor.\"""
180,"UniqueGlovesInt5",50338,"Death is beautiful. Let not the elements\r\nmar it with their clumsy ways."
181,"UniqueGlovesInt6",59545,"Absolute corruption empowers absolutely."
182,"UniqueGlovesDexInt3",9258,"The roar of the heavens\r\nStrikes more than fear\r\nInto the hearts of Man"
183,"UniqueGlovesDexInt4",43312,"The cards don't choose life and death\r\nThat's up to the player."
184,"UniqueHelmetDex6",10379,"A lad with no fear of the pest \r\nLet rats fill his helmet in jest \r\nWhen they picked his skull clean\r\nWhere his head should have been\r\nWas naught but a vermin-filled nest!"
185,"UniqueHelmetInt5",7308,"You are the powerless master of fire."
186,"UniqueHelmetInt6",431,"Many still hold the belief that the fossilised bones\r\nof Vaal sacrifices have magical properties."
187,"UniqueHelmetStr3",49196,"When you have slain all of your enemies,\r\nwhat is left to fear?"
188,"UniqueHelmetStr3x",7970,"\""While Prototype #3 does imbue its wearer with strength to match the original,\r\nthe first researcher to don it burst into flames when he walked into sunlight...\"""
189,"UniqueRapier2",22108,"Many a collector of rarities discovered to his dismay\r\nthat the intelligent spirit in this sword\r\ndoes not like to share its master's attention"
190,"UniqueRing7",34155,"The ring I stole,\r\nMy finger they took,\r\nA shrouded mind,\r\nCut their curses short,\r\nAs I drained their spirit\r\nAnd stole their soul.\r\nA blessing is often a curse."
191,"UniqueMap5",62395,"Laughs of all the twisted\r\nEcho through these halls of gold.\r\nIn this cold forgotten void\r\nThey wander, forever uncontrolled."
192,"UniqueMap5x",59068,"\""Suppression troop two, the 'Martyrs for Science,' were able to seal\r\nthe portals before Outpost Four was overrun. Only three men survived.\"""
193,"UniqueHelmetWreath1v2",9035,"The second trial brought most to their knees.\r\nBut not you."
194,"UniqueHelmetStrDex3",54988,"May you never hear it toll."
195,"UniqueClaw4",27689,"Desperate times demand desperate measures."
196,"UniqueClaw4x_",21322,"\""An absurdly vicious weapon in the hands of our test subjects. It seems to\r\nchannel the desperate will to live. Intriguing.\"" \r\n- Researcher Olesya"
197,"UniqueClaw5",48344,"It's cold and dark where the leviathan sleeps.\r\nColder and darker than death.\r\n- Old Sailor's saying"
198,"UniqueClaw6_",31538,"\""When the hyena howls thrice\r\ndeath is sure to follow.\""\r\n-Maraketh Wisdom"
199,"UniqueRing8",51191,"Gentle anger, raging calm."
200,"UniqueAmulet10",28295,"The world is but a piece of parchment, blank and symmetric. \r\nWe label each side: one Good, one Evil; one Black, one White. \r\nThe divine truth, however, is that both are one and the same. \r\n-Jaetai, Vaal Advisor"
201,"UniqueAmulet10x",59425,"\""A rare unequivocal success, Prototype #11 causes wounds to heal so quickly\r\nthe type Delta test subject actually survived the entire testing regimen.\"""
202,"UniqueRing9",7504,"By its light, Lori led her young charges to safety \r\nand bound up their wounds. \r\nHer sword arm was iron, yet her heart gentle \r\nand proof against hate."
203,"UniqueHelmetStrDex4",11337,"\""What lies beneath your feet?!\""\r\n\""Sacred ground, watered with tears of blood!\"""
204,"UniqueBodyInt8",12158,"When dead men rise and darkness falls\r\nOnly faith can be your walls\r\nWalls of Light, not of brick\r\nTwice as strong and twice as thick"
205,"UniqueBodyStrInt4",62835,". . . and the Light faded and hope waned\r\nZahndethus cast aside his faith\r\nand embraced the darkness."
206,"UniqueWand3",24324,"\""The trick is to give nothingness,\r\nand to receive everything in return.\""\r\n- Inquisitor Maligaro"
207,"UniqueOneHandSword3",4276,"Though the Vaal revered peace, it would have \r\nbeen suicide for any culture to rouse them to war.\r\n- Icius Perandus, Scholar to the Empire."
208,"UniqueMap6",64514,"RISE, SISTER!"
209,"UniqueMap7",39962,"The Treasures of the Tides wait\r\nin agony at the End of the World."
210,"UniqueAmulet12",23227,"Flavour Text goes HERE"
211,"UniqueMap8",5855,"Flavourful flavour text is flavourful."
212,"UniqueRing10",25360,"The portrait reflected his pain,\r\na pain that she could never see."
213,"UniqueMap9",59174,"\""Here the soil is more deadly than any swing of the axe.\""\r\n- Oba of the Karui, Conqueror of Corruption."
214,"UniqueOneHandAxe1",19630,"It is too easy for the soul to escape from an open heart."
