"rownum","Id","Name","Description","UnavailableArt","string","AvailableArt","ItemisedSample","BodypartName","i32","AchievementItemsKeys","BodypartNamePlural","i32"
0,"Spammable","Simple","Frequently used, requires no delay to be used again.","Art/2DArt/UIImages/InGame/Metamorphosis/EyeballUnavailable","","Art/2DArt/UIImages/InGame/Metamorphosis/EyeballAvailable",9519,"Eye",1,[],"Eyes",7
1,"GenericShortCooldown","Short Delay","Requires a little time before it may be used again.","Art/2DArt/UIImages/InGame/Metamorphosis/LiverUnavailable","","Art/2DArt/UIImages/InGame/Metamorphosis/LiverAvailable",9520,"Liver",4,[],"Livers",3
2,"GenericMediumCooldown","Medium Delay","Requires some time before it may be used again.","Art/2DArt/UIImages/InGame/Metamorphosis/LungUnavailable","","Art/2DArt/UIImages/InGame/Metamorphosis/LungAvailable",9521,"Lung",2,[],"Lungs",4
3,"GenericLongCooldown","Long Delay","Requires a lot of time before it may be used again.","Art/2DArt/UIImages/InGame/Metamorphosis/HeartUnavailable","","Art/2DArt/UIImages/InGame/Metamorphosis/HeartAvailable",9522,"Heart",3,[],"Hearts",5
4,"GenericAreaDenial","Lingering","Effect persists in the area for some time.","Art/2DArt/UIImages/InGame/Metamorphosis/BrainUnavailable","","Art/2DArt/UIImages/InGame/Metamorphosis/BrainAvailable",9518,"Brain",0,[],"Brains",6
