129,"expanding_rain_of_arrows","Rain of Arrows","Fires multiple arrows into the air, to land in sequence after a delay, starting at the targeted location and spreading outwards in all directions. Each arrow deals damage in an area around it. Half of the arrows will land directly on targets if there are targets in their range.",1,"Art/2DArt/SkillIcons/rainofarrows.dds","[1,2]","[0,40,57,7,10,61,14,13,15,31,88]",[13],"Before they're given their first Long Bow, aspiring archers on Oriath are taught the art of the Arrow Rain. When the student is ready to be tested, he is taken out to the marshes, and commanded to fire a salvo at a flock of geese. The aspirant must bring down at least a dozen birds with one barrage, or it's back for another year of training and discipline. __BREAK__ __BREAK__ Naturally, the Rain of Arrows technique is often used to devastating effect on the field of battle. A skilled archer fires a single enchanted missile aloft, and when it descends, it multiplies to carpet an entire area in a lethal shower. Be wary if you ever behold an enemy archer pointing their bow skyward.","http://s3.amazonaws.com/pathofexile/image/skills/dexterity/rain_of_arrows.jpg",22,1,"[4203,3998,4176,7985,18336]","[70,24,434,7986,6035]",[],"",""
130,"triggered_expanding_rain_of_arrows","Rain of Arrows","Fires multiple arrows into the air, to land in sequence after a delay, starting at the targeted location and spreading outwards in all directions. Each arrow deals damage in an area around it. Half of the arrows will land directly on targets if there are targets in their range.",1,"Art/2DArt/SkillIcons/rainofarrows.dds","[1,2]","[0,40,57,7,10,61,14,13,15,31,88,36,49]",[13],"Before they're given their first Long Bow, aspiring archers on Oriath are taught the art of the Arrow Rain. When the student is ready to be tested, he is taken out to the marshes, and commanded to fire a salvo at a flock of geese. The aspirant must bring down at least a dozen birds with one barrage, or it's back for another year of training and discipline. __BREAK__ __BREAK__ Naturally, the Rain of Arrows technique is often used to devastating effect on the field of battle. A skilled archer fires a single enchanted missile aloft, and when it descends, it multiplies to carpet an entire area in a lethal shower. Be wary if you ever behold an enemy archer pointing their bow skyward.","http://s3.amazonaws.com/pathofexile/image/skills/dexterity/rain_of_arrows.jpg",22,1,"[4203,3998,4176,7985,18336]","[70,24,434,7986,6035]",[],"",""
131,"vaal_expanding_rain_of_arrows","Vaal Rain of Arrows","Fires multiple arrows into the air, to land in multiple sequences after a delay, each starting at the targeted location and spreading outwards in all directions. Each arrow deals damage in an area around it. Half of the arrows will land directly on targets if there are targets in their range.",1,"Art/2DArt/SkillIcons/rainofarrows.dds","[1,2]","[0,40,7,10,61,14,13,15,37,88]",[13],"","",22,1,"[4203,3998,4176,7985,18336]","[70,24,434,7986,6035]",[],"",""
132,"fire_storm","Firestorm","Flaming bolts rain down over the targeted area. They explode when landing, dealing damage to nearby enemies.",1,"Art/2DArt/SkillIcons/FirestormV2.dds","[1,2,22]","[1,6,7,8,13,14,15,21,31,28,55,69,71]",[],"Perhaps the most feared area effect skill in the Witch's arsenal, the mighty Firestorm skill is legendary for its power and cruelty. The incantation tears a rift in the heavens that showers a wide swath of ground in a rain of searing flames. These bolts pound down without mercy, exploding violently to cause even more harm.","http://s3.amazonaws.com/pathofexile/image/skills/intelligence/fire_storm.jpg",22,1,"[4228,4011]","[215,24]",[],3,""
133,"fire_storm_ignore_los","","",1,"","[1,2,8]","[1,6,7,8,13,14,15,21,31,28,71]",[],"","",22,1,"[4228,4011]","[215,24]",[],"",""
134,"vaal_fire_storm","Vaal Firestorm","A fixed number of flaming bolts rain down in a spiral, culminating in the central one impacting the targeted location. They explode when landing, dealing damage to nearby enemies and leaving burning ground, which deals fire damage over time.",1,"Art/2DArt/SkillIcons/FirestormV2.dds","[1,2,22]","[1,6,13,14,15,7,8,28,71,37]",[],"","",22,1,"[4228,4011]","[215,24]",[],2,""
135,"ice_storm","Icestorm","Icy bolts rain down over the targeted area. They explode when landing, dealing damage to nearby enemies and chilling them, as well as causing patches of chilled ground. Skill damage is based on Intelligence.",1,"Art/2DArt/BuffIcons/icestorm.dds","[1,2,22]","[1,6,7,8,13,14,15,21,31,29,55,67,69,71]",[],"","",22,1,[],[],[],3,""
136,"lightning_strike","Lightning Strike","Infuses your melee weapon with electrical energies as you swing. In addition to converting some of your physical damage to lightning damage, the stored energy is released from the weapon as projectiles as you strike, flying out to hit farther-away enemies. The projectiles cannot miss if the melee attack hits a target.",1,"Art/2DArt/SkillIcons/lightningslash.dds","[1,2]","[0,40,2,20,23,19,30,81]","[6,7,9,10,11,12,32,14,15,16,17,57,56]","","http://s3.amazonaws.com/pathofexile/image/skills/strength/lightning_strike.jpg",22,1,"[3987,4242,6254,6255,17999,18002]","[24,173,6249,6235,4988,17916]",[],"",""
137,"vaal_new_lightning_strike","Vaal Lightning Strike","Infuses your melee weapon with electrical energies as you swing. In addition to converting some of your physical damage to lightning damage, the stored energy becomes an orb attached to the enemy you hit, or the ground if you don't hit an enemy. The orb will periodically fire projectiles at other nearby enemies for a duration, which will also damage the enemy the orb is attached to.",1,"Art/2DArt/SkillIcons/lightningslash.dds","[1,2]","[0,20,19,8,37,30,2,40,81]","[6,7,9,10,11,12,32,14,15,16,17,57,56]","","",22,1,"[3987,4242,6254,6255,17999,18002]","[24,173,6249,6235,4988,17916]",[],"",""
138,"vaal_lightning_strike","Vaal Lightning Strike","Infuses your melee weapon with electrical energies as you swing. In addition to converting some of your physical damage to lightning damage, the stored energy is forced into the enemy as you strike, electrically charging them for a duration, during which lightning will arc between them and other nearby enemies, dealing damage. This occurs even if the attack is dodged.",1,"Art/2DArt/SkillIcons/lightningslash.dds","[1,2]","[0,20,19,8,37,30]","[6,7,9,10,11,12,32,14,15,16,17,57,56]","","",22,1,"[3987,4242,6254,6255,17999,18002]","[24,173,6249,6235,4988,17916]",[],"",""
139,"tempest_shield","Tempest Shield","Enchants your shield with the power of storms, which lashes out to deal arcing lightning damage to attackers when you block them.",1,"Art/2DArt/SkillIcons/lightningshield.dds",[4],"[1,6,9,22,30,18,4,11,89,14,63,84,85]",[],"","http://s3.amazonaws.com/pathofexile/image/skills/intelligence/tempest_shield.jpg",22,1,"[4054,4393,15914]","[24,172,4525]",[],"",""
140,"molten_shell","Molten Shell","Summons fiery elemental shields providing additional armour for a short duration. If cumulative physical damage prevented by your blocking or armour reaches a threshold, the shields explode outwards, dealing fire damage to surrounding enemies.",1,"Art/2DArt/SkillIcons/moltenshield.dds",[4],"[1,6,7,8,14,26,31,28,63,71,27,89]",[],"","http://s3.amazonaws.com/pathofexile/image/skills/strength/molten_shell.jpg",22,1,"[4045,4498]","[24,4525]",[],"",""
141,"molten_shell_barrier","Molten Shell","Applies a buff that adds to your armour, and can take some of the damage from hits for you before being depleted. When the buff expires or is depleted, the skill deals reflected damage to enemies around you based on the total damage that was taken from the buff. Shares a cooldown with other Guard skills.",1,"Art/2DArt/SkillIcons/moltenshield.dds",[4],"[1,7,8,14,26,28,63,71,27,31,77,89]",[],"","http://s3.amazonaws.com/pathofexile/image/skills/strength/molten_shell.jpg",22,1,"[9865,4498,9520]","[215,4525,9375]",[],"",""
142,"vaal_molten_shell","Vaal Molten Shell","Applies a buff that raises your armour, and takes some of the damage from hits for you before being depleted. Each second, the skill deals reflected damage to surrounding enemies based on the damage taken by the buff in that second. When the buff is removed, the skill deals reflected damage to enemies around you based on the total damage that was taken by the buff. You cannot have the buff at the same time as any other Guard skill.",1,"Art/2DArt/SkillIcons/moltenshield.dds",[4],"[1,7,8,14,26,28,63,71,27,37,85,84,89,77]",[],"","",22,1,"[9865,4498]","[215,4525]",[],"",""
143,"monster_vaal_molten_shell","Vaal Molten Shell","",1,"",[4],"[1,6,7,8,14,26,37,28,31,71,27]",[],"","",22,1,"[4045,4498]","[24,4525]",[],"",""
144,"power_siphon","Power Siphon","Fires your wand to unleash projectiles that fire toward enemies in front of you or to your sides, dealing increased damage and granting you a power charge if an enemy is killed by, or soon after, the hit.",1,"Art/2DArt/SkillIcons/soulsyphon.dds","[1,2]","[0,40,2,56,14,13,15]",[8],"","http://s3.amazonaws.com/pathofexile/image/skills/intelligence/power_shot.jpg",22,1,"[4209,4016,7953,18036,18037]","[70,24,173,108,3825]",[],3,""
145,"vaal_power_siphon","Vaal Power Siphon","Fires your wand simultaneously at all nearby enemies, culling those close to death and granting you a power charge for each. Cannot be supported by Volley.",1,"Art/2DArt/SkillIcons/soulsyphon.dds","[1,2]","[0,40,2,14,13,15,37,81]",[8],"","",22,1,"[4209,4016,7953,18036,18037]","[70,24,173,108,3825]",[],3,""
146,"mass_frenzy","","",1,"",[4],"[1,7,71]",[],"","",22,1,[],[],[],"",""
147,"mass_endurance","","",1,"",[4],"[1,7,71]",[],"","",22,1,[],[],[],"",""
148,"mass_power","","",1,"",[4],"[1,7,71,31]",[],"","",22,1,[],[],[],"",""
149,"puncture","Puncture","Punctures enemies, causing a bleeding debuff, which will be affected by modifiers to skill duration. Puncture works with bows, daggers, claws or swords.",1,"Art/2DArt/SkillIcons/puncture.dds","[1,2]","[0,40,57,2,56,8,13,15,14,20,23,19,34,31,27]","[13,6,7,9,10,15,56]","","http://s3.amazonaws.com/pathofexile/image/skills/dexterity/puncture.jpg",22,1,"[4005,4226,4261,18025]","[24,215,5412,10964]",[],3,""
150,"lightning_arrow","Lightning Arrow","Fires a charged arrow at the target, causing them to be struck by a bolt of lightning which damages a number of surrounding enemies.",1,"Art/2DArt/SkillIcons/lightningarrow.dds","[1,2]","[0,40,57,7,2,56,14,13,15,30,31]",[13],"","http://s3.amazonaws.com/pathofexile/image/skills/dexterity/lightning_arrow.jpg",22,1,"[4003,4178,17998,18001]","[24,434,4988,17916]",[],"",""
151,"vaal_lightning_arrow","Vaal Lightning Arrow","Fires charged arrows, which repeatedly travel for a short time before changing direction. When they hit enemies, they are struck by a bolt of lightning which damages a number of surrounding enemies.",1,"Art/2DArt/SkillIcons/lightningarrow.dds","[1,2]","[0,40,7,2,56,14,13,15,30,37]",[13],"","",22,1,"[4003,4178,17998,18001]","[24,434,4988,17916]",[],"",""
152,"taunt","Taunt","",1,"",[2],[],[],"","",22,1,[],[],[],"",""
153,"haste","Haste","Casts an aura that increases the movement speed, attack speed and cast speed of you and your allies.",1,"Art/2DArt/SkillIcons/auraspeed.dds",[4],"[1,7,4,11,22,14,38,63,71,80,84,85,89]",[],"","http://s3.amazonaws.com/pathofexile/image/skills/dexterity/haste.jpg",22,1,"[4324,8265,14997,15027,15917]","[13980,14001,14720,14898,1932]",[],"",""
154,"vaal_haste","Vaal Haste","Casts a temporary aura that increases the movement speed, attack speed and cast speed of you and your allies.",1,"Art/2DArt/SkillIcons/auraspeed.dds",[4],"[1,4,7,14,22,8,37,38,71,63,84,85,89]",[],"","",22,1,"[4324,14997,15027,15917]","[13980,14720,14898,1932]",[],"",""
155,"purity","Purity of Elements","Casts an aura that grants elemental resistances and elemental ailment immunity to you and your allies.",1,"Art/2DArt/SkillIcons/auraresist.dds",[4],"[1,7,4,11,22,14,38,63,71,80,84,85,89]",[],"","http://s3.amazonaws.com/pathofexile/image/skills/intelligence/purity.jpg",22,1,"[4318,8267,10963,15008,15038]","[13980,14001,1932,14720,14898]",[],"",""
156,"vitality","Vitality","Casts an aura that grants life regeneration to you and your allies.",1,"Art/2DArt/SkillIcons/auraregen.dds",[4],"[1,7,4,11,22,14,38,63,71,80,84,85,89]",[],"","http://s3.amazonaws.com/pathofexile/image/skills/strength/vitality.jpg",22,1,"[4321,8271,15013,15043]","[13980,14001,14720,14898]",[],"",""
157,"vaal_vitality","Vaal Vitality","Casts a temporary aura that grants life regeneration to you and your allies.",1,"Art/2DArt/SkillIcons/auraregen.dds",[4],"[1,4,7,14,22,8,37,38,71,63,84,85,89]",[],"","",22,1,"[4321,15013,15043]","[13980,14720,14898]",[],"",""
158,"discipline","Discipline","Casts an aura that grants additional energy shield and increased energy shield recharge rate to you and your allies.",1,"Art/2DArt/SkillIcons/auraenergy.dds",[4],"[1,7,4,11,22,14,38,63,71,80,84,85,89]",[],"","http://s3.amazonaws.com/pathofexile/image/skills/intelligence/discipline.jpg",22,1,"[4317,7859,8263,14994,15024]","[13980,1932,14001,14720,14898]",[],"",""
159,"vaal_discipline","Vaal Discipline","Casts a temporary aura that prevents energy shield recharge being delayed by damage taken for you and your allies.",1,"Art/2DArt/SkillIcons/auraenergy.dds",[4],"[1,4,7,14,22,8,37,38,71,63,84,85,89]",[],"","",22,1,"[4317,7859,14994,15024]","[13980,1932,14720,14898]",[],"",""
160,"aura_accuracy_and_crits","Precision","Casts an aura that grants accuracy and critical strike chance to you and your allies.",1,"Art/2DArt/SkillIcons/auracrit.dds",[4],"[1,7,4,11,22,14,38,63,71,80,84,85,89]",[],"","",22,1,"[9537,9538,15006,15036,15131,18148]","[13980,14001,14720,14898,15132,1932]",[],"",""
161,"grace","Grace","Casts an aura that grants evasion to you and your allies.",1,"Art/2DArt/SkillIcons/auraevasion.dds",[4],"[1,7,4,11,22,14,38,63,71,80,84,85,89]",[],"","http://s3.amazonaws.com/pathofexile/image/skills/dexterity/grace.jpg",22,1,"[4323,7860,8264,14996,15026]","[13980,1932,14001,14720,14898]",[],"",""
162,"vaal_grace","Vaal Grace","Casts a temporary aura that grants you and your allies additional chance to evade attacks, and makes suppressed spell damage unlucky against you.",1,"Art/2DArt/SkillIcons/auraevasion.dds",[4],"[1,4,7,14,22,8,37,38,71,63,84,85,89]",[],"","",22,1,"[4323,7860,14996,15026]","[13980,1932,14720,14898]",[],"",""
163,"determination","Determination","Casts an aura that grants armour to you and your allies.",1,"Art/2DArt/SkillIcons/auraarmour.dds",[4],"[1,7,4,11,22,14,38,63,71,27,80,84,85,89]",[],"","http://s3.amazonaws.com/pathofexile/image/skills/strength/determination.jpg",22,1,"[4316,7858,8262,14993,15023]","[13980,1932,14001,14720,14898]",[],"",""
164,"vaal_determination","Determination","Casts a temporary aura that grants physical damage reduction and elemental resistances to you and your allies.",1,"Art/2DArt/SkillIcons/auraarmour.dds",[4],"[1,4,7,14,22,8,37,38,71,27,63,84,85,89]",[],"","",22,1,"[4316,7858,14993,15023]","[13980,1932,14720,14898]",[],"",""
165,"anger","Anger","Casts an aura that adds fire damage to the attacks and spells of you and your allies.",1,"Art/2DArt/SkillIcons/aurafire.dds",[4],"[1,7,4,11,22,14,38,28,63,71,80,84,85,89]",[],"","http://s3.amazonaws.com/pathofexile/image/skills/strength/anger.jpg",22,1,"[3604,3603,8260,14989,15019]","[1932,13980,14001,14720,14898]",[],"",""
166,"hatred","Hatred","Casts an aura that grants extra cold damage based on physical damage to you and your allies.",1,"Art/2DArt/SkillIcons/auracold.dds",[4],"[1,7,4,11,22,14,38,29,63,71,80,84,85,89]",[],"","http://s3.amazonaws.com/pathofexile/image/skills/dexterity/hatred.jpg",22,1,"[4314,7857,8266,13129,14998,15028]","[13980,1932,14001,13130,14720,14898]",[],"",""
167,"monster_hatred","","",1,"Art/2DArt/SkillIcons/auracold.dds",[4],"[1,7,4,11,22,14,38,29,31,71,89]",[],"","http://s3.amazonaws.com/pathofexile/image/skills/dexterity/hatred.jpg",22,1,"[4314,14998,15028]","[13980,14720,14898]",[],"",""
168,"wrath","Wrath","Casts an aura that adds lightning damage to the attacks of you and your allies, and makes your spells deal more lightning damage.",1,"Art/2DArt/SkillIcons/auralightning.dds",[4],"[1,7,4,11,22,14,38,30,63,71,80,84,85,89]",[],"","http://s3.amazonaws.com/pathofexile/image/skills/intelligence/wrath.jpg",22,1,"[4322,7856,8272,15014,15044]","[13980,1932,14001,14720,14898]",[],"",""
169,"burning_arrow","Burning Arrow","Fires a burning arrow that deals fire damage and has a chance to ignite.",1,"Art/2DArt/SkillIcons/firearrow.dds","[1,2]","[0,40,57,2,56,14,13,15,28,43,31]",[13],"","http://s3.amazonaws.com/pathofexile/image/skills/dexterity/burning_arrow.jpg",22,1,"[4251,3976,4252,10733,17989]","[611,24,447,4525,17913]",[],"",""
170,"vaal_burning_arrow","Vaal Burning Arrow","Fires an arrow that explodes, dealing fire damage to its target and other nearby enemies, with an increased chance of igniting them.",1,"Art/2DArt/SkillIcons/firearrow.dds","[1,2]","[0,40,2,56,14,13,15,7,37,28,45]",[13],"","",22,1,"[4251,3976,4252,10733,17989]","[611,24,447,4525,17913]",[],"",""
171,"clarity","Clarity","Casts an aura that grants mana regeneration to you and your allies.",1,"Art/2DArt/SkillIcons/auramana.dds",[4],"[1,7,4,11,22,14,38,63,71,80,84,85,89]",[],"","http://s3.amazonaws.com/pathofexile/image/skills/intelligence/clarity.jpg",22,1,"[4313,8261,14992,15022]","[13980,14001,14720,14898]",[],"",""
172,"vaal_clarity","Vaal Clarity","Casts a temporary aura that lets you and your allies cast skills without paying their mana costs.",1,"Art/2DArt/SkillIcons/auramana.dds",[4],"[1,4,7,14,22,8,37,38,71,63,84,85,89]",[],"","",22,1,"[4313,14992,15022]","[13980,14720,14898]",[],"",""
173,"insectspawnerspawn","","",1,"",[4],"[1,5,76]",[],"","",22,1,[],[],"[0,19,20,23]","",""
174,"detonate_mines","Detonate Mines","Detonates a Mine, starting a Detonation Sequence which will detonate other Mines around it.",1,"Art/2DArt/SkillIcons/detonatemines.dds","[1,22]","[1,13,14,31,63,89]",[],"","",22,1,[],[],[],"",""
175,"totem_earthquake","Shockwave Totem","Summons a totem that shakes the earth around it, knocking back and damaging nearby enemies",1,"Art/2DArt/SkillIcons/earthquaketotem.dds","[4,20,22]","[1,6,7,13,15,25,21,71,27,83]",[],"","http://s3.amazonaws.com/pathofexile/image/skills/strength/totem_earthquake.jpg",5,1,"[4290,4197,4033]","[216,434,24]",[],"",""
176,"totem_life_regen","Rejuvenation Totem","Summons a totem that has an aura which regenerates life for you and your nearby allies.",1,"Art/2DArt/SkillIcons/liferegentotem.dds","[4,20]","[1,4,7,22,13,15,25,38,71,26]",[],"","http://s3.amazonaws.com/pathofexile/image/skills/strength/totem_life_regen.jpg",4,1,"[4287,18047]","[1932,4144]",[],2,""
177,"vaal_totem_life_regen","Vaal Rejuvenation Totem","Summons a totem that has an aura which regenerates life for you and your nearby allies. When things affected by the aura are hit, the totem's life is removed instead for some of the damage.",1,"Art/2DArt/SkillIcons/liferegentotem.dds","[4,20]","[1,4,7,22,13,15,25,38,71,26,37]",[],"","",21,1,"[4287,18047]","[1932,4144]",[],2,""
178,"trap_convert","Conversion Trap","Throws a trap that, when triggered by an enemy, converts that enemy to your side for a short duration. Does not affect unique monsters or players.",1,"Art/2DArt/SkillIcons/conversiontrap.dds",[2],"[1,8,15,32,89]",[],"","http://s3.amazonaws.com/pathofexile/image/skills/intelligence/trap_convert.jpg",22,1,[4364],[3336],[],2,""
179,"trap_beartrap","Bear Trap","Throws a trap that damages and immobilises a single enemy for a duration based on how much damage was dealt. After the immobilise expires, a debuff remains on the enemy for a duration, lowering their movement speed by an amount which lessens over time. The affected enemy will take increased damage from traps and mines until the debuff expires. Modifiers to spell damage do not affect this skill's damage.",1,"Art/2DArt/SkillIcons/beartrap.dds",[2],"[1,8,15,32,6,27,89]",[],"","http://s3.amazonaws.com/pathofexile/image/skills/dexterity/trap_beartrap.jpg",22,1,"[4353,4043,7748]","[3336,24,7747]",[],2,""
180,"mine_freeze","Freeze Mine","Lays a remote mine that you can detonate to freeze all enemies in the area.",1,"Art/2DArt/SkillIcons/iconicetrap.dds","[1,2]","[1,6,7,35,29,71,11]",[],"","http://s3.amazonaws.com/pathofexile/image/skills/dexterity/mine_freeze.jpg",22,1,"[4369,4050]","[434,24]",[],2,""
181,"trap_ground_fire","Fire Trap","Throws a trap that explodes when triggered, dealing fire damage to surrounding enemies and leaving an area of burning ground that damages enemies who walk through it.",1,"Art/2DArt/SkillIcons/groundfire.dds","[2,1]","[1,8,6,15,7,24,32,34,28,71]",[],"","http://s3.amazonaws.com/pathofexile/image/skills/dexterity/trap_ground_fire.jpg",22,1,"[4215,4254,3980,6279,7751,18022]","[3336,209,24,1775,215,17934]",[],2,""
182,"ground_fire_self","Fire Trap","Throws a trap that explodes when triggered, dealing fire damage to surrounding enemies and leaving an area of burning ground that damages enemies who walk through it.",1,"Art/2DArt/SkillIcons/groundfire.dds",[4],"[1,8,6,7,24,34,28,71]",[],"","",22,1,[],[],[],"",""
183,"vaal_fire_trap","Vaal Fire Trap","Throws multiple traps that explode when triggered, dealing fire damage to surrounding enemies and leaving areas of burning ground that damages enemies who walk through them.",1,"Art/2DArt/SkillIcons/groundfire.dds","[2,1]","[1,8,6,15,7,24,32,34,37,28,71]",[],"","",22,1,[4215],[3336],[],"",""
184,"trap_ground_caustic_cloud","","",1,"","[2,1]","[1,8,6,15,7,32,34,41,71]",[],"","",22,1,[],[],[],"",""
185,"ground_caustic_cloud","","",1,"","[2,1]","[1,8,6,7,34,31,41,71]",[],"","",22,1,[],[],[],"",""
186,"trap_ground_ice","","",1,"","[2,1]","[1,8,6,15,7,32,34,29,71]",[],"","",22,1,[],[],[],"",""
187,"totem_taunt","Decoy Totem","Summons a totem that taunts nearby monsters to attack it.",1,"Art/2DArt/SkillIcons/taunttotem.dds",[4],"[1,13,15,7,25,21,71,89]",[],"","http://s3.amazonaws.com/pathofexile/image/skills/strength/totem_taunt.jpg",6,1,"[4195,4284,18047]","[434,166,4144]",[],"",""
188,"totem_consume_corpse","Devouring Totem","Summons a totem that can consume nearby corpses. If you are hurt, it will destroy a corpse to leech life to you.",1,"Art/2DArt/SkillIcons/devouringtotem.dds","[6,20]","[1,13,15,25]",[],"","http://s3.amazonaws.com/pathofexile/image/skills/strength/totem-consume-corpse.png",7,1,[18047],[4144],[],"",""
189,"necromancer_revive_skeleton","","",1,"",[6],[1],[],"","",22,1,[],[],[],"",""
190,"suicide_explosion","","",1,"","[2,1]","[1,7,6,71,31]",[],"","",22,1,[],[],[],"",""
191,"suicide_explosion_self","","",1,"",[4],"[1,6,7,71]",[],"","",22,1,[],[],[],"",""
192,"summon_spawn","","",1,"",[4],"[1,21,31]",[],"","",22,1,[],[],[],"",""
193,"shadow_projectiles","Ethereal Knives","Fires an arc of knives in front of the caster which deals physical damage.",1,"Art/2DArt/SkillIcons/shadowprojectiles.dds","[2,1]","[1,6,2,56,14,13,15,21,31,69,27,8]",[],"","http://s3.amazonaws.com/pathofexile/image/skills/dexterity/shadow_projectiles.jpg",22,1,"[3996,4222,5395,5391,5389,7954,5393]","[24,175,352,173,1777,6235,1400]",[],"",""
194,"shadow_projectiles_no_los","Ethereal Knives","Fires an arc of knives in front of the caster which deals physical damage.",1,"Art/2DArt/SkillIcons/shadowprojectiles.dds","[2,1,8]","[1,6,2,56,14,13,15,21,31,69,27]",[],"","",22,1,[],[],[],"",""
195,"insect_spawner_spit","","",1,"","[2,1]","[2,56]",[],"","",22,1,[],[],[],"",""
196,"scavenger_throw_fire","","",1,"","[2,1]","[2,56]",[],"","",22,1,[],[],[],"",""
197,"ice_shot","Ice Shot","Fires an arrow that converts some physical damage to cold on its target and converts all physical damage to cold in a cone behind that target.",1,"Art/2DArt/SkillIcons/iceshot.dds","[1,2]","[0,40,2,56,7,29,31,57,14,13,15]",[13],"","http://s3.amazonaws.com/pathofexile/image/skills/dexterity/iceshot.jpg",22,1,"[3997,4233,4175,5379,6283,6298,10739,17998,18001]","[24,215,434,5505,6249,6235,10738,4988,17916]",[],"",""
198,"vaal_ice_shot","Vaal Ice Shot","Fires an arrow that converts some physical damage to cold on its target and converts all physical damage to cold in a cone behind that target. When you use this skill, it summons a squad of Mirage Sharpshooters for a duration. Cannot be used by Totems, Traps, or Mines.",1,"Art/2DArt/SkillIcons/iceshot.dds","[1,2]","[0,40,2,56,7,29,37,8,112]",[13],"","",22,1,"[3997,4233,4175,5379,6283,6298,10739,17998,18001]","[24,215,434,5505,6249,6235,10738,4988,17916]",[],"",""
199,"piety_ice_shot","","",1,"Art/2DArt/SkillIcons/iceshot.dds","[1,2,8]","[0,40,57,2,56,7,14,13,15,29,67]",[13],"","http://s3.amazonaws.com/pathofexile/image/skills/dexterity/iceshot.jpg",22,1,[],[],[],"",""
200,"arctic_breath","Creeping Frost","Fire an icy projectile that bursts on impact or when reaching the targeted area, dealing area damage and creating a chilling area that deals cold damage over time. This area will creep across the ground towards nearby enemies until its duration expires.",1,"Art/2DArt/SkillIcons/arcticbreath.dds","[1,2]","[1,2,56,6,13,14,15,8,7,21,31,29,67,69,71]",[],"","http://s3.amazonaws.com/pathofexile/image/skills/intelligence/arcticbreath.jpg",22,1,"[4026,4231,4184,8742,18331,18352]","[24,215,434,8743,10866,13181]",[],"",""
201,"arctic_armour","Arctic Armour","Summons an icy shield that protects against physical and fire damage. It drains your mana while active and at a faster rate while you are moving. When you have no mana left, the skill turns off. While active, it leaves a trail of ground ice which lasts for a short duration.",1,"Art/2DArt/SkillIcons/Iceshield.dds",[4],"[1,4,14,8,11,22,31,29,67,71]",[],"","http://s3.amazonaws.com/pathofexile/image/skills/dexterity/ice-shield.jpg",22,1,[4386],[4525],[],"",""
