"rownum","Id","Name (English)","Name (French)","Name (German)","Name (Japanese)","Name (Korean)","Name (Portuguese)","Name (Russian)","Name (Spanish)","Name (Thai)","Name (Traditional Chinese)","AOFile","ACTFile","BaseMaxLife","BaseMaxMana","WeaponSpeed","MinDamage","MaxDamage","MaxAttackDistance","Icon","IntegerId","BaseStrength","BaseDexterity","BaseIntelligence","[rid]","Description (English)","Description (French)","Description (German)","Description (Japanese)","Description (Korean)","Description (Portuguese)","Description (Russian)","Description (Spanish)","Description (Thai)","Description (Traditional Chinese)","StartSkillGem","rid","i32","i32","CharacterSize","IntroSoundFile","StartWeapons","Gender","TraitDescription (English)","TraitDescription (French)","TraitDescription (German)","TraitDescription (Japanese)","TraitDescription (Korean)","TraitDescription (Portuguese)","TraitDescription (Russian)","TraitDescription (Spanish)","TraitDescription (Thai)","TraitDescription (Traditional Chinese)","rid","rid","rid","rid","i32","[rid]","PassiveTreeImage","i32","i32","TencentVideo","AttrsAsId","LoginScreen","PlayerCritter","PlayerEffect","AfterImage","Mirage","CloneImmobile","ReplicateClone","LightningClone","f32","f32","SkillTreeBackground","Clone","Double","MirageWarrior","DoubleTwo","DarkExile","Attr","AttrLowercase","Script","rid","i32"
0,"Metadata/Characters/Str/Str","Marauder","Maraudeur","Marodeur","マローダー","머라우더","Marauder","Дикарь","Guerrero","Marauder","野蠻人","Metadata/Characters/Str/Str.ao","Metadata/Characters/Str/Str.act",38,34,833,2,8,8,"",1,32,14,14,[2520],"Do you think you are savage enough to face the land of the damned, Marauder?\r\n \r\nWe offered you truth yet still you clasped your superstitious lies. We offered you service, yet you wasted your strength in defiance.\r\n \r\nWraeclast offers you something else: an education in true savagery.","Vous considérez-vous suffisamment sauvage pour vous mesurer à la terre des damnés, maraudeur ?\r\n\r\nNous vous avons offert la vérité, mais vous avez persisté à vous accrocher à vos superstitions mensongères. Nous vous avons accordé l'opportunité de servir, mais vous avez préféré gaspiller vos forces dans la rébellion.\r\n\r\nDésormais, c'est au tour de Wraeclast de vous offrir quelque chose, Karui : l'enseignement de ce qu'est la véritable sauvagerie.","Glaubt Ihr, dass Ihr barbarisch genug seid für das Land der Verdammten, Marodeur? \r\n\r\nWir boten Euch die Wahrheit, doch Ihr wolltet lieber an Eurem lächerlichen Aberglauben festhalten. Wir boten Euch den Dienst an Gott, doch Ihr habt Eure Kräfte mit Trotz und Widerstand vergeudet. \r\n\r\nWraeclast wird Euch etwas ganz anderes bieten - eine Lehre in wahrer Barbarei.","\r\n呪われし者の地に立ち向かえるほど自分が凶暴だと思うか、マローダー？\r\n\r\n我らは其方に真実を与えたが、其方は迷信的な嘘にしがみついた。我らは其方に福祉の機会を与えたが、其方は反抗し、強さを無駄にした。\r\n\r\nレイクラストは其方に少し違うものを与える：本当の凶暴さというものを知ることになるだろう。","머라우더여, 그대는 자신의 맹렬함만으로 이 저주받은 땅과 맞설 수 있으리라 생각하는가?\r\n\r\n우리가 진실을 보여줬건만, 그대는 여전히 미신 같은 참언을 놓지 못하고 있다. 우리는 그대에게 봉사했지만, 그대는 반항하며 힘을 낭비하지 않았는가.\r\n\r\n레이클라스트라면 진정한 야만이 무엇인지 알려줄 수 있으리라.","Você pensa que é selvagem o suficiente para enfrentar a terra dos condenados, Marauder?\r\n\r\nNós lhe oferecemos verdades, porém você adotou suas mentiras supersticiosas. Nós lhe oferecemos trabalho, porém você desperdiçou sua força em resistência.\r\n\r\nWraeclast lhe oferece algo mais: uma educação através da verdadeira selvageria.","Дикарь, достаточно ли ты свиреп, чтобы выжить в проклятом краю?\r\n\r\nМы принесли тебе истину, но ты крепко держишься за свои ложные предрассудки. Мы даровали тебе право служить, но ты растратил силы на упрямое отрицание.\r\n\r\nРэкласт дарует тебе нечто иное — постижение истинной дикости.","¿Te crees lo suficientemente salvaje para enfrentarte a la tierra de los condenados, Guerrero?\r\n\r\nTe ofrecimos la verdad y sin embargo te aferraste a tus mentiras supersticiosas. Te ofrecimos servicio y sin embargo desperdiciaste tu fuerza al desafiarnos.\r\n\r\nWraeclast te ofrece algo distinto: educarte en el verdadero salvajismo.","เจ้า​คิด​ว่า​เจ้า​ป่า​เถื่อน​พอที่​จะ​เผชิญ​กับ​ดิน​แดน​ต้อง​สาป​ไหม​เล่า มอรอว์เดอร์?\r\n\r\nเรา​มอบ​โอกาส​ให้​เจ้า​พบ​กับ​ความ​จริง แต่​เจ้า​กลับ​ยึดถือ​เรื่อง​ราว​โกหก​อัน​งมงายเป็นสรณะ เรา​มอบ​โอกาส​ให้​เจ้า​รับ​ใช้ แต่​เจ้า​กลับ​เสีย​แรง​ขัดขืน​ไป​อย่าง​สูญ​เปล่า\r\n\r\nเวร์แคลส์ท​จะ​มอบ​สิ่ง​อื่น​ให้​กับ​เจ้า​: ​การสั่งสอนให้รู้จักความ​ป่า​เถื่อน​อย่าง​แท้จริง","你以為自己夠格面對這片受詛咒的大地嗎，野蠻人？\r\n\r\n我們賜你真理，但你仍執迷不悟；我們給你侍奉的機會，但你輕蔑的的放棄。\r\n\r\n瓦爾克拉斯將會教你何謂真正的殺戮。",101,0,6,1,2,"Audio/Dialogue/NPC/DominusGlyph/Dom_Intro_Marauder.ogg",[5051],"M","Traits: Strength, Melee","Traits : Force, Mêlée","Charakterzüge: Stärke, Nahkampf","特性：筋力、近接","특성: 힘, 근접 전투","Traços: Força, Corpo a Corpo","Характеристики: сила, ближний бой","Rasgos: Fuerza, Cuerpo a cuerpo","จุดเด่น: Strength, ประชิด","特性：力量，近戰",336,241,336,5214,1,[1163],"Art/2DArt/BaseClassIllustrations/Str.dds",-1736,-1350,"http://down.qq.com/poe/videos/class/ClassStr.bk2","Str","Metadata/Characters/Str/StrLoginSceneFallOfOriath.ao","Metadata/Critters/PlayerCritters/StrCritter","Metadata/Effects/PlayerEffects/StrEffect","Metadata/Effects/Spells/maneuver_mechanics/AfterImage/StrAfterImage",3747,3740,3754,6282,350,-574,"Art/2DArt/UIImages/InGame/Classes/Str/PassiveSkillScreenStartNodeBackground",3733,3395,7904,3402,2613,"Str","str","str_back",521,100
1,"Metadata/Characters/Int/Int","Witch","Sorcière","Hexe","ウィッチ","위치","Bruxa","Ведьма","Bruja","Witch","女巫","Metadata/Characters/Int/Int.ao","Metadata/Characters/Int/Int.act",38,34,833,2,5,8,"",3,14,14,32,[2520],"Why do the keen of mind seek to satiate their curiosity in darkness and depravity?\r\n \r\nInnocence is our Father, Oriath is our Mother. When a daughter strays from the light, she makes herself an orphan.\r\n \r\nLearn well the lessons that Wraeclast will teach you, Witch. It is your only hope of finding your way home.","Pourquoi les esprits les plus brillants cherchent-ils à assouvir leur curiosité dans les ténèbres et la dépravation ?\r\n\r\nInnocence est notre Père. Oriath est notre Mère. Lorsque l'une de leurs filles s'éloigne de la lumière, elle se rend elle-même orpheline.\r\n\r\nRetenez bien les leçons qu'Oriath vous enseignera, sorcière. C'est votre unique espoir de trouver le chemin du retour.","Warum nur suchen diejenigen mit findigem Geist stets nach Erfüllung im Finsteren und Schlechten? \r\n\r\nInnocence ist unser Vater, Oriath unsere Mutter. Wenn eine Tochter vom rechten Wege abkommt, macht sie sich selbst zur Waise.\r\n\r\nMerkt Euch gut, was Euch Wraeclast lehren wird. Denn nur so könnt Ihr Euch die Hoffnung auf Heimkehr erhalten.","頭の切れる者はなぜ好奇心を闇と悪行で満たそうとする？\r\n\r\nイノセンスは我らの父であり、オリアスは我らの母である。光から離れる娘は孤児になる。\r\n\r\nレイクラストの教えから良く学ぶがいい、ウィッチよ。また元の正しい道を見つけるには、そうするしかないだろう。","왜 그대는 어둠과 타락에 대한 호기심을 충족시키는 데에 골몰하고 있는가?\r\n\r\n이노센스는 우리의 아버지요, 오리아스는 우리의 어머니라. 그 딸이 빛에서 멀어지는 것은 곧 스스로 고아가 되는 길이니.\r\n\r\n위치여, 레이클라스트가 그대에게 주는 교훈을 새겨라. 그것이 고향 땅으로 돌아갈 유일한 희망일 것이다.","Por que os gênios buscam saciar a curiosidade na escuridão e depravação?\r\n\r\nInnocence é o nosso Pai, Oriath é a nossa Mãe. Quando uma filha caminha contra a luz, ela se torna órfã.\r\n\r\nAprenda bem as lições que Wraeclast lhe ensinará, Bruxa. É a sua única chance de encontrar o caminho de volta para casa.","Отчего поборники разума так любят совать любопытные носы во тьму и порок?\r\n\r\nНевинность — Отец наш, Ориат — Мать наша. Но если дочь их отворачивается от света, она становится сиротой.\r\n\r\nВедьма, усвой уроки, которые готовит тебе Рэкласт, ибо это твой единственный путь домой.","¿Por qué será que aquellos de mente sagaz buscan saciar su curiosidad en la oscuridad y la depravación?\r\nInocencia es nuestro Padre, Oriath es nuestra Madre. Cuando una hija se aleja de la luz, elige ser huérfana.\r\n\r\nAprende bien las lecciones que Wraeclast te enseñará, Bruja. Es tu única esperanza para encontrar el camino a casa.","เหตุ​ใด​ผู้​มี​สมอง​อัน​ปราด​เปรื่อง​ถึง​คลาย​ความ​สงสัย​ด้วย​ความ​มืด​กับ​ความ​ชั่ว​ช้า​กัน​เล่า​?\r\n\r\nอินโนเซน​ถือ​เป็น​บิดา​ของ​เรา โอริอาท​ถือ​เป็น​มารดา​ของ​เรา เมื่อ​บุตร​สาว​คน​หนึ่ง​พลัด​หลง​ออก​ไป​จาก​แสง​สว่าง เธอ​จึง​กลาย​เป็น​บุตร​กำพร้า\r\n\r\nเจ้า​จง​เรียน​รู้​บท​เรียน​จาก​เวร์แคลส์ท​เสีย​ให้​ดี​เถิด วิทช์ มัน​คือ​หนทาง​เดียว​สู่​มาตุภูมิ​ของ​เจ้า","為什麼要用黑暗與墮落，來滿足妳心靈渴望的好奇心？\r\n\r\n聖潔是我們的父親，奧瑞亞是我們的母親。當女兒背離正道時，家將無她的容身之處。\r\n\r\n謹記一切在瓦爾克拉斯所學，這將是妳唯一回到奧瑞亞的希望。",0,0,6,1,2,"Audio/Dialogue/NPC/DominusGlyph/Dom_Intro_Witch.ogg",[4883],"F","Traits: Intelligence, Spells","Traits :  Intelligence, Sorts","Charakterzüge: Intelligenz, Zauber","特性：知性、スペル","특성: 지능, 주문","Traços: Inteligência, Magias","Характеристики: интеллект, чары","Rasgos: Inteligencia, Hechizos","จุดเด่น: Intelligence, เวท","特性：智慧，法術",338,282,338,4883,2,[4261],"Art/2DArt/BaseClassIllustrations/Int.dds",-1532,-669,"http://down.qq.com/poe/videos/class/ClassInt.bk2","Int","Metadata/Characters/Int/IntLoginSceneFallOfOriath.ao","Metadata/Critters/PlayerCritters/IntCritter","Metadata/Effects/PlayerEffects/IntEffect","Metadata/Effects/Spells/maneuver_mechanics/AfterImage/IntAfterImage",3749,3742,3756,6284,0,0,"Art/2DArt/UIImages/InGame/Classes/Int/PassiveSkillScreenStartNodeBackground",3735,3397,7906,3404,2615,"Int","int","int_back",558,70
2,"Metadata/Characters/StrDexInt/StrDexInt","Scion","Héritière","Adelstochter","サイオン","사이온","Herdeira","Дворянка","Heredera","Scion","貴族","Metadata/Characters/StrDexInt/StrDexInt.ao","Metadata/Characters/StrDexInt/StrDexInt.act",38,34,833,2,6,8,"",0,20,20,20,[2520],"A Scion is perfection in mind, body, and grace. The crowning glory of our civilization, offering us hope, offering us light.\r\n \r\nBut you gave us only murder and darkness.\r\n \r\nMay Wraeclast embrace you as we cannot, for your very presence has become too painful to bear.","Une héritière respectable incarne la perfection du corps, de l'esprit et de l'élégance. La fine fleur de notre civilisation, porteuse d'espoir et de lumière.\r\n\r\nMais vous, vous ne nous avez apporté que le meurtre et la disgrâce.\r\n\r\nPuisse Wraeclast vous accueillir en son sein comme il ne nous est plus possible de le faire, car votre simple présence en ces lieux nous est devenue insupportable.","Eine Adelstochter, die absolute Vollkommenheit aus Verstand, Körper und Anmut. Die ganze Pracht unserer Zivilisation, unsere Hoffnung, unser Licht.\r\n\r\nDoch Ihr hattet für uns nur Mord und Finsternis übrig.\r\n\r\nMöge Wraeclast Euch mit offenen Armen empfangen – wir sind Eurer Anwesenheit längst überdrüssig.","サイオンというのは完璧な精神と身体と優美さを持つ者だ。我らの社会の無上な栄光。希望と光を我らに与えてくれる者。\r\n\r\nだが、其方が我らに与えたのは殺人と闇だけだった。\r\n\r\nレイクラストが其方を受け入れてくれることを願おう、我らは其方の存在がもたらす痛みにはもう耐えることができない。","사이온은 완벽한 몸과 마음, 품위를 자랑한다. 우리 문명의 더할 나위 없는 보배요, 우리의 희망이자 빛인 것이다.\r\n\r\n하지만 그대가 우리에게 준 것은 살인과 어둠뿐.\r\n\r\n그대의 존재는 우리가 품기에 너무나도 고통스럽다. 레이클라스트가 그대를 품어주길 바라노라.","Uma Herdeira é perfeição de corpo, mente e elegância. A glória culminante da nossa civilização, nos oferecendo esperança, nos oferecendo luz.\r\n\r\nMas você nos deu apenas mortes e trevas.\r\n\r\nQue Wraeclast lhe abrace como nós não pudemos, pois sua presença tornou-se dolorosa demais para suportarmos.","У тебя идеально развиты ум, тело и манеры.  Ты — славный венец нашей цивилизации, наша надежда, наш светоч.\r\n \r\nНо ты дала нам только смерть и темноту.\r\n \r\nПусть Рэкласт распахнёт тебе свои объятия, ибо нам стало слишком мучительно даже терпеть твоё присутствие.","Una Heredera es la perfección de la mente, del cuerpo y de la gracia. La Gloria que corona nuestra civilización, que nos ofrece esperanza, que nos ofrece luz.\r\n\r\nSin embargo tú solo nos diste muerte y oscuridad.\r\n\r\nQue Wraeclast te acoja como nosotros no podemos, pues tu sola presencia se ha vuelto demasiado dolorosa para soportar.","ไซออน​คน​หนึ่ง​นั้น​ถือ​เป็น​ผู้​สมบูรณ์​ทั้ง​ปัญญา กายา และ​มารยา ผู้​เป็น​ตัวแทน​อัน​ยิ่ง​ใหญ่​แห่ง​อารยธรรม​ที่​นำพา​ความ​หวัง​ให้​กับ​เรา นำพา​แสง​สว่าง​ให้​กับ​เรา\r\n\r\nแต่​เจ้า​มิได้​มอบ​สิ่ง​ใด​ให้​กับ​เรา​นอกจาก​การ​ฆาตกรรม​กับ​ความ​มืดมน\r\n\r\nขอ​ให้เวร์แคลส์ทยอมรับ​เจ้า​ดัง​ที่​เรา​ไม่​อาจ​ยอมรับ​เจ้า​ได้ เพราะ​เรา​มิ​อาจ​ทน​ให้​เจ้า​อยู่​กับ​พวก​เรา​อีก​ต่อ​ไป","貴族應擁有堅忍不拔的心智、無懈可擊的外貌以及高貴優雅的舉止。貴族是我們文明至高無上的榮耀，他賜予我們希望，給予我們光明。\r\n\r\n但妳，只為我們帶來無盡的殺戮與黑暗。\r\n\r\n我們對妳惱人的存在已經無法再容忍了，願瓦爾克拉斯能接納妳的一切。",208,0,6,1,2,"Audio/Dialogue/NPC/DominusGlyph/Dom_Intro_Scion.ogg",[4998],"F","Traits: Strength, Dexterity, Intelligence","Traits : Force, Dextérité, Intelligence","Charakterzüge: Stärke, Geschick, Intelligenz","特性：筋力、器用さ、知性","특성: 힘, 민첩, 지능","Traços: Força, Destreza, Inteligência","Характеристики: сила, ловкость, интеллект","Rasgos: Fuerza, Destreza, Inteligencia","จุดเด่น: Strength, Dexterity, Intelligence","特性：智慧，力量，敏捷",730,"","","",5,[],"",0,0,"http://down.qq.com/poe/videos/class/ClassStrDexInt.bk2","StrDexInt","Metadata/Characters/StrDexInt/StrDexIntLoginSceneFallOfOriath.ao","Metadata/Critters/PlayerCritters/StrDexIntCritter","Metadata/Effects/PlayerEffects/StrDexIntEffect","Metadata/Effects/Spells/maneuver_mechanics/AfterImage/StrDexIntAfterImage",3753,3746,3760,6288,0,0,"Art/2DArt/UIImages/InGame/Classes/StrDexInt/PassiveSkillScreenStartNodeBackground",3739,3401,7910,3408,2610,"StrDexInt","strdexint","strdexint_back",562,80
3,"Metadata/Characters/Dex/Dex","Ranger","Rôdeuse","Waldläuferin","レンジャー","레인저","Caçadora","Охотница","Cazadora","Ranger","遊俠","Metadata/Characters/Dex/Dex.ao","Metadata/Characters/Dex/Dex.act",38,34,833,2,5,8,"",2,14,32,14,[2520],"Swift and silent you stole the bounty of others. \r\n \r\nA crow that plunders our crops. A stray dog that slaughters our sheep. \r\n \r\nOriath is a land of men, not animals. Think on that, Ranger, when Wraeclast shows you how to truly live like an animal.","Rapide et sournoise, vous vous êtes emparée de ce à quoi vous n'aviez pas droit.\r\n\r\nVous êtes la corneille pillant nos récoltes, le chien errant qui décime nos troupeaux.\r\n\r\nOriath est une terre d'hommes, et les hommes ne sont pas des bêtes. Méditez bien là-dessus, rôdeuse, lorsque Wraeclast vous montrera ce que signifie vraiment de vivre comme un animal.","Heimlich, flink und leise nahmt Ihr Euch, was nicht Euer war.\r\n\r\nWie eine Krähe, die unsere Früchte stiehlt. Ein streunender Hund, der unsere Schafe reißt.\r\n\r\nOriath wird von Menschen bewohnt und nicht von Tieren. Erinnert Euch daran, Waldläuferin, wenn Wraeclast Euch das wahre Tier zeigt.","素早く、そして音も立てずに其方は他人の賜物を盗んだ。\r\n\r\n畑を荒らすカラス。我らの羊を殺す野良犬。\r\n\r\nオリアスは人の国だ。動物の国ではない。レイクラストが其方に本当の動物としての生き方を教える時、そのことをよく考えてみるがいい、レンジャー。","그대는 신속하고 고요한 행동으로 다른 이들의 재물을 훔치고 다녔다.\r\n\r\n우리의 작물을 약탈하는 까마귀요, 양 떼를 도륙하는 방랑견이라.\r\n\r\n오리아스는 인간의 땅이지 짐승의 땅이 아니다. 새겨두거라, 레인저여. 레이클라스트가 진정 짐승처럼 사는 것이 어떤지 보여줄 터이니.","Rapidamente e silenciosamente você roubou as riquezas dos outros.\r\n\r\nUm corvo que saqueia nossas colheitas. Um vira-lata que mata nossas ovelhas.\r\n\r\nOriath é uma terra de homens, não animais. Pense nisso, Caçadora, quando Wraeclast lhe mostrar a verdade sobre como é viver como um animal.","Ловко и тихо ты забрала то, что принадлежит другим.\r\n\r\nСловно ворона, которая истребляет наш урожай. Бродячая собака, которая задирает наших овец.\r\n\r\nОриат — земля людей, а не животных. Охотница, подумай об этом, когда Рэкласт явит тебе истинно животную жизнь.","Rápida y silenciosa, robaste las recompensas de otros. \r\n\r\nEl cuervo que saquea nuestras cosechas. El perro callejero que mata nuestras ovejas.\r\n\r\nOriath es tierra de hombres, no de animales. Recuerda eso, Cazadora, cuando Wraeclast te muestre cómo vivir verdaderamente como un animal.","เจ้า​ช่วง​ชิง​รางวัล​จาก​ผู้​อื่น​อย่าง​ว่องไว​ไร้​เสียง\r\n\r\nดั่ง​อีกา​ที่​ถลุง​พืช​ผล ดั่ง​สุนัข​จรจัด​ที่​จัดการ​แกะ​ของ​เรา\r\n\r\nโอริอาท​นั้น​เป็น​ดิน​แดน​ของ​มนุษย์ หา​ใช่​สัตว์ จงคิด​เรื่อง​นั้น​ให้​ดี​เสีย เรนเจอร์ ในยาม​ที่​เวร์​แค​ลส์ท​สั่ง​สอน​ให้​เจ้า​อยู่​อย่าง​สัตว์​เสีย​จริง","妳鬼祟且狡詐地從他人手中搶奪賞金。\r\n\r\n妳野蠻的行徑，與烏鴉掠奪作物、野狗殘殺牲畜，又有何異？\r\n\r\n奧瑞亞是人類居住的地方，而非野獸棲息之地。等看著吧，遊俠，就讓瓦爾克拉斯教你如何成為一頭真正的野獸。 ",138,0,6,1,2,"Audio/Dialogue/NPC/DominusGlyph/Dom_Intro_Ranger.ogg",[5107],"F","Traits: Dexterity, Ranged","Traits : Dextérité, Armes à Distance","Charakterzüge: Geschick, Fernkampf","特性：器用さ、遠距離","특성: 민첩, 원거리 전투","Traços: Destreza, Longo Alcance","Характеристики: ловкость, дальний бой","Rasgos: Destreza, A distancia","จุดเด่น: Dexterity, ระยะไกล","特性：敏捷，遠距離",337,45,70,5107,2,"[1163,2670]","Art/2DArt/BaseClassIllustrations/Dex.dds",-850,-1255,"http://down.qq.com/poe/videos/class/ClassDex.bk2","Dex","Metadata/Characters/Dex/DexLoginSceneFallOfOriath.ao","Metadata/Critters/PlayerCritters/DexCritter","Metadata/Effects/PlayerEffects/DexEffect","Metadata/Effects/Spells/maneuver_mechanics/AfterImage/DexAfterImage",3748,3741,3755,6283,-536,-281.92,"Art/2DArt/UIImages/InGame/Classes/Dex/PassiveSkillScreenStartNodeBackground",3734,3396,7905,3403,2616,"Dex","dex","dex_back",557,80
